Location Name Key,Date Reported,Attribute,Cumulative Value,Change Since Prior Day,Latitude,Longitude,Country or Region,Province or State,CSV File Name,USA State County,FIPS USA State County code,Last Updated UTC,File Number,Row Number
"Abbeville, SC, USA",03-22-2020,Confirmed,1,,34.22333378,-82.46170658,USA,SC,03-22-2020.csv,Abbeville,45001,2020-03-22T23:45:00Z,60,820
"Acadia, LA, USA",03-29-2020,Deaths,1,,30.295064899999996,-92.41419698,USA,LA,03-29-2020.csv,Acadia,22001,2020-03-29T23:08:25Z,67,1
"Accomack, VA, USA",03-28-2020,Confirmed,2,,37.76707161,-75.63234615,USA,VA,03-28-2020.csv,Accomack,51001,2020-03-28T23:05:37Z,66,2
"Ada, ID, USA",03-25-2020,Active,24,,43.4526575,-116.24155159999998,USA,ID,03-25-2020.csv,Ada,16001,2020-03-25T23:33:19Z,63,3
"Adair, IA, USA",03-22-2020,Deaths,0,,41.33075609,-94.47105874,USA,IA,03-22-2020.csv,Adair,19001,2020-03-22T23:45:00Z,60,1001
"Adair, KY, USA",03-27-2020,Confirmed,0,,37.10459774,-85.28129668,USA,KY,03-27-2020.csv,Adair,21001,2020-03-27T22:14:55Z,65,5
"Adair, MO, USA",03-26-2020,Confirmed,1,,40.19058551,-92.60078167,USA,MO,03-26-2020.csv,Adair,29001,2020-03-26T23:48:35Z,64,6
"Adair, OK, USA",03-24-2020,Deaths,0,,35.88494195,-94.65859267,USA,OK,03-24-2020.csv,Adair,40001,2020-03-24T23:37:31Z,62,7
"Adams, CO, USA",03-22-2020,Deaths,0,,39.87432092,-104.3362578,USA,CO,03-22-2020.csv,Adams,8001,2020-03-22T23:45:00Z,60,429
"Adams, IA, USA",03-24-2020,Deaths,0,,41.02903567,-94.69932645,USA,IA,03-24-2020.csv,Adams,19003,2020-03-24T23:37:31Z,62,12
"Adams, ID, USA",03-24-2020,Confirmed,0,,44.89333571,-116.4545247,USA,ID,03-24-2020.csv,Adams,16003,2020-03-24T23:37:31Z,62,9
"Adams, IL, USA",03-28-2020,Deaths,0,,39.98815591,-91.18786813,USA,IL,03-28-2020.csv,Adams,17001,2020-03-28T23:05:37Z,66,10
"Adams, IN, USA",03-26-2020,Confirmed,1,,40.7457653,-84.93671406,USA,IN,03-26-2020.csv,Adams,18001,2020-03-26T23:48:35Z,64,11
"Adams, MS, USA",03-24-2020,Recovered,0,,31.47669768,-91.35326037,USA,MS,03-24-2020.csv,Adams,28001,2020-03-24T23:37:31Z,62,13
"Adams, ND, USA",03-23-2020,Recovered,0,,46.09686891,-102.5285397,USA,ND,03-23-2020.csv,Adams,38001,2020-03-23T23:19:34Z,61,15
"Adams, NE, USA",03-25-2020,Confirmed,1,,40.52449420000001,-98.50117804,USA,NE,03-25-2020.csv,Adams,31001,2020-03-25T23:33:19Z,63,14
"Adams, OH, USA",03-26-2020,Deaths,0,,38.84541072,-83.4718964,USA,OH,03-26-2020.csv,Adams,39001,2020-03-26T23:48:35Z,64,16
"Adams, PA, USA",03-27-2020,Active,8,,39.87140411,-77.21610347,USA,PA,03-27-2020.csv,Adams,42001,2020-03-27T22:14:55Z,65,17
"Adams, WA, USA",03-25-2020,Deaths,0,,46.98299757,-118.56017340000001,USA,WA,03-25-2020.csv,Adams,53001,2020-03-25T23:33:19Z,63,18
"Adams, WI, USA",03-26-2020,Recovered,0,,43.96974651,-89.76782777,USA,WI,03-26-2020.csv,Adams,55001,2020-03-26T23:48:35Z,64,19
"Addison, VT, USA",03-25-2020,Active,9,,44.03217337,-73.14130877,USA,VT,03-25-2020.csv,Addison,50001,2020-03-25T23:33:19Z,63,20
Afghanistan,03-19-2020,Active,21,,33.9391,67.7100,Afghanistan,,03-19-2020.csv,,,2020-03-17T11:53:10Z,57,178
"Aiken, SC, USA",03-28-2020,Deaths,0,,33.54338026,-81.63645384,USA,SC,03-28-2020.csv,Aiken,45003,2020-03-28T23:05:37Z,66,21
"Aitkin, MN, USA",03-29-2020,Recovered,0,,46.60962049,-93.41168259999999,USA,MN,03-29-2020.csv,Aitkin,27001,2020-03-29T23:08:25Z,67,22
"AK, USA",03-12-2020,Recovered,0,,61.3707,-152.4044,USA,AK,03-12-2020.csv,,,2020-03-10T02:33:04Z,50,213
"AL, USA",03-17-2020,Active,39,,32.3182,-86.9023,USA,AL,03-17-2020.csv,,,2020-03-17T23:13:10Z,55,135
"Alachua, FL, USA",03-23-2020,Confirmed,36,,29.67866525,-82.35928158,USA,FL,03-23-2020.csv,Alachua,12001,2020-03-23T23:19:34Z,61,23
"Alamance, NC, USA",03-22-2020,Deaths,0,,36.0434701,-79.39976137,USA,NC,03-22-2020.csv,Alamance,37001,2020-03-22T23:45:00Z,60,632
"Alameda, CA, USA",03-07-2020,Deaths,0,,37.6017,-121.7195,USA,CA,03-07-2020.csv,Alameda,,2020-03-07T13:13:14Z,45,137
"Alamosa, CO, USA",03-29-2020,Confirmed,1,,37.57250606,-105.7885451,USA,CO,03-29-2020.csv,Alamosa,08003,2020-03-29T23:08:25Z,67,26
Albania,03-10-2020,Recovered,0,,41.1533,20.1683,Albania,,03-10-2020.csv,,,2020-03-10T12:53:02Z,48,106
"Albany, NY, USA",03-26-2020,Recovered,0,,42.60060306,-73.97723916,USA,NY,03-26-2020.csv,Albany,36001,2020-03-26T23:48:35Z,64,27
"Albany, WY, USA",03-26-2020,Recovered,0,,41.65498705,-105.72354150000001,USA,WY,03-26-2020.csv,Albany,56001,2020-03-26T23:48:35Z,64,28
"Albemarle, VA, USA",03-24-2020,Confirmed,2,,38.02080697,-78.55481085,USA,VA,03-24-2020.csv,Albemarle,51003,2020-03-24T23:37:31Z,62,29
"Alberta, Canada",03-27-2020,Deaths,2,,53.9333,-116.5765,Canada,Alberta,03-27-2020.csv,,,2020-03-27T23:27:32Z,65,3173
"Alcona, MI, USA",03-28-2020,Active,0,,44.6846864,-83.59507875,USA,MI,03-28-2020.csv,Alcona,26001,2020-03-28T23:05:37Z,66,30
"Alcorn, MS, USA",03-28-2020,Active,1,,34.88084463,-88.57996173,USA,MS,03-28-2020.csv,Alcorn,28003,2020-03-28T23:05:37Z,66,31
"Aleutians East, AK, USA",03-29-2020,Recovered,0,,55.32222414,-161.9722021,USA,AK,03-29-2020.csv,Aleutians East,02013,2020-03-29T23:08:25Z,67,32
"Aleutians West, AK, USA",03-23-2020,Recovered,0,,52.72541116,-110.4086433,USA,AK,03-23-2020.csv,Aleutians West,02016,2020-03-23T23:19:34Z,61,33
"Alexander, IL, USA",03-30-2020,Active,0,,37.18049267,-89.32910838,USA,IL,03-30-2020.csv,Alexander,17003,2020-03-30T22:52:45Z,68,34
"Alexander, NC, USA",03-28-2020,Confirmed,1,,35.922379600000006,-81.17751948,USA,NC,03-28-2020.csv,Alexander,37003,2020-03-28T23:05:37Z,66,35
"Alexandria, VA, USA",03-27-2020,Confirmed,18,,38.814003,-77.08183073,USA,VA,03-27-2020.csv,Alexandria,51510,2020-03-27T22:14:55Z,65,36
"Alfalfa, OK, USA",03-27-2020,Deaths,0,,36.73090616,-98.32408495,USA,OK,03-27-2020.csv,Alfalfa,40003,2020-03-27T22:14:55Z,65,37
"Alger, MI, USA",03-30-2020,Recovered,0,,46.41292944,-86.60260122,USA,MI,03-30-2020.csv,Alger,26003,2020-03-30T22:52:45Z,68,38
Algeria,03-18-2020,Active,55,,28.0339,1.6596,Algeria,,03-18-2020.csv,,,2020-03-18T19:53:03Z,56,118
"Allamakee, IA, USA",03-22-2020,Confirmed,5,,43.28383218,-91.37860922,USA,IA,03-22-2020.csv,Allamakee,19005,2020-03-22T23:45:00Z,60,990
"Allegan, MI, USA",03-29-2020,Active,2,,42.59147037,-85.89102866,USA,MI,03-29-2020.csv,Allegan,26005,2020-03-29T23:08:25Z,67,40
"Allegany, MD, USA",03-29-2020,Active,0,,39.62357628,-78.69280486,USA,MD,03-29-2020.csv,Allegany,24001,2020-03-29T23:08:25Z,67,41
"Allegany, NY, USA",03-23-2020,Active,2,,42.25748406,-78.02750466,USA,NY,03-23-2020.csv,Allegany,36003,2020-03-23T23:19:34Z,61,42
"Alleghany, NC, USA",03-24-2020,Deaths,0,,36.49360862,-81.12857041,USA,NC,03-24-2020.csv,Alleghany,37005,2020-03-24T23:37:31Z,62,43
"Alleghany, VA, USA",03-26-2020,Deaths,0,,37.78636074,-80.00222498,USA,VA,03-26-2020.csv,Alleghany,51005,2020-03-26T23:48:35Z,64,44
"Allegheny, PA, USA",03-30-2020,Confirmed,290,,40.46809875,-79.98167747,USA,PA,03-30-2020.csv,Allegheny,42003,2020-03-30T22:52:45Z,68,45
"Allen, IN, USA",03-24-2020,Recovered,0,,41.09194313,-85.06800636,USA,IN,03-24-2020.csv,Allen,18003,2020-03-24T23:37:31Z,62,46
"Allen, KS, USA",03-24-2020,Deaths,0,,37.88582951,-95.30030847,USA,KS,03-24-2020.csv,Allen,20001,2020-03-24T23:37:31Z,62,47
"Allen, KY, USA",03-25-2020,Recovered,0,,36.75197631,-86.19457544,USA,KY,03-25-2020.csv,Allen,21003,2020-03-25T23:33:19Z,63,48
"Allen, LA, USA",03-24-2020,Confirmed,2,,30.65385745,-92.82442028,USA,LA,03-24-2020.csv,Allen,22003,2020-03-24T23:37:31Z,62,49
"Allen, OH, USA",03-25-2020,Recovered,0,,40.77285242,-84.10802343,USA,OH,03-25-2020.csv,Allen,39003,2020-03-25T23:33:19Z,63,50
"Allendale, SC, USA",03-24-2020,Confirmed,0,,32.98837386,-81.35321066,USA,SC,03-24-2020.csv,Allendale,45005,2020-03-24T23:37:31Z,62,51
"Alpena, MI, USA",03-30-2020,Deaths,0,,45.03477666,-83.62212411,USA,MI,03-30-2020.csv,Alpena,26007,2020-03-30T22:52:45Z,68,52
"Alpine, CA, USA",03-26-2020,Confirmed,0,,38.59678594,-119.82235940000001,USA,CA,03-26-2020.csv,Alpine,06003,2020-03-26T23:48:35Z,64,53
"Amador, CA, USA",03-29-2020,Confirmed,2,,38.44583082,-120.65696000000001,USA,CA,03-29-2020.csv,Amador,06005,2020-03-29T23:08:25Z,67,54
"Amelia, VA, USA",03-28-2020,Recovered,0,,37.34081025,-77.98584649,USA,VA,03-28-2020.csv,Amelia,51007,2020-03-28T23:05:37Z,66,55
"Amherst, VA, USA",03-30-2020,Confirmed,3,,37.60308293,-79.14548696,USA,VA,03-30-2020.csv,Amherst,51009,2020-03-30T22:52:45Z,68,56
"Amite, MS, USA",03-29-2020,Confirmed,4,,31.17467303,-90.80501621,USA,MS,03-29-2020.csv,Amite,28005,2020-03-29T23:08:25Z,67,57
"Anchorage, AK, USA",03-26-2020,Confirmed,28,,61.14998174,-149.14269860000005,USA,AK,03-26-2020.csv,Anchorage,02020,2020-03-26T23:48:35Z,64,58
"Anderson, KS, USA",03-30-2020,Active,0,,38.21413251,-95.29272815,USA,KS,03-30-2020.csv,Anderson,20003,2020-03-30T22:52:45Z,68,59
"Anderson, KY, USA",03-25-2020,Active,1,,38.00671029,-84.99171713,USA,KY,03-25-2020.csv,Anderson,21005,2020-03-25T23:33:19Z,63,60
"Anderson, SC, USA",03-22-2020,Recovered,0,,34.51828081,-82.63959517,USA,SC,03-22-2020.csv,Anderson,45007,2020-03-22T23:45:00Z,60,807
"Anderson, TN, USA",03-22-2020,Active,1,,36.12684348,-84.19965764,USA,TN,03-22-2020.csv,Anderson,47001,2020-03-22T23:45:00Z,60,513
"Anderson, TX, USA",03-29-2020,Confirmed,0,,31.81534745,-95.65354823,USA,TX,03-29-2020.csv,Anderson,48001,2020-03-29T23:08:25Z,67,63
Andorra,03-26-2020,Recovered,1,,42.5063,1.5218,Andorra,,03-26-2020.csv,,,2020-03-26T23:48:18Z,64,3253
"Andrew, MO, USA",03-24-2020,Deaths,0,,39.98492163,-94.80163024,USA,MO,03-24-2020.csv,Andrew,29003,2020-03-24T23:37:31Z,62,64
"Andrews, TX, USA",03-23-2020,Confirmed,0,,32.30468633,-102.63765479999999,USA,TX,03-23-2020.csv,Andrews,48003,2020-03-23T23:19:34Z,61,65
"Androscoggin, ME, USA",03-30-2020,Active,8,,44.1664747,-70.20380627,USA,ME,03-30-2020.csv,Androscoggin,23001,2020-03-30T22:52:45Z,68,66
"Angelina, TX, USA",03-23-2020,Active,0,,31.25457347,-94.60901487,USA,TX,03-23-2020.csv,Angelina,48005,2020-03-23T23:19:34Z,61,67
Angola,03-20-2020,Active,1,,-11.2027,17.8739,Angola,,03-20-2020.csv,,,2020-03-20T10:13:38Z,58,263
"Anguilla, United Kingdom",03-29-2020,Confirmed,2,,18.2206,-63.0686,United Kingdom,Anguilla,03-29-2020.csv,,,2020-03-29T23:08:13Z,67,3176
"Anhui, China",02-10-2020,Confirmed,830,,,,China,Anhui,02-10-2020.csv,,,2020-02-10T07:23:04Z,19,5
"Anne Arundel, MD, USA",03-25-2020,Deaths,0,,39.00670238,-76.60329337,USA,MD,03-25-2020.csv,Anne Arundel,24003,2020-03-25T23:33:19Z,63,68
"Anoka, MN, USA",03-24-2020,Active,7,,45.27476015,-93.24604565,USA,MN,03-24-2020.csv,Anoka,27003,2020-03-24T23:37:31Z,62,69
"Anson, NC, USA",03-26-2020,Recovered,0,,34.97403241,-80.09953279,USA,NC,03-26-2020.csv,Anson,37007,2020-03-26T23:48:35Z,64,70
"Antelope, NE, USA",03-26-2020,Active,0,,42.17695516,-98.06662829999999,USA,NE,03-26-2020.csv,Antelope,31003,2020-03-26T23:48:35Z,64,71
Antigua and Barbuda,03-22-2020,Active,1,,17.0608,-61.7964,Antigua and Barbuda,,03-22-2020.csv,,,2020-03-22T23:45:00Z,60,3398
"Antrim, MI, USA",03-30-2020,Confirmed,2,,44.99690221,-85.15503082,USA,MI,03-30-2020.csv,Antrim,26009,2020-03-30T22:52:45Z,68,72
"Apache, AZ, USA",03-26-2020,Confirmed,9,,35.39465006,-109.4892383,USA,AZ,03-26-2020.csv,Apache,04001,2020-03-26T23:48:35Z,64,73
"Appanoose, IA, USA",03-27-2020,Recovered,0,,40.74324454,-92.86865906,USA,IA,03-27-2020.csv,Appanoose,19007,2020-03-27T22:14:55Z,65,74
"Appling, GA, USA",03-27-2020,Recovered,0,,31.74847232,-82.28909114,USA,GA,03-27-2020.csv,Appling,13001,2020-03-27T22:14:55Z,65,75
"Appomattox, VA, USA",03-26-2020,Recovered,0,,37.37569884,-78.81340003,USA,VA,03-26-2020.csv,Appomattox,51011,2020-03-26T23:48:35Z,64,76
"AR, USA",03-21-2020,Active,122,,34.9697,-92.3731,USA,AR,03-21-2020.csv,,,2020-03-21T23:13:17Z,59,123
"Aransas, TX, USA",03-24-2020,Recovered,0,,28.10556197,-96.9995047,USA,TX,03-24-2020.csv,Aransas,48007,2020-03-24T23:37:31Z,62,77
"Arapahoe, CO, USA",03-29-2020,Confirmed,241,,39.64977461,-104.3353617,USA,CO,03-29-2020.csv,Arapahoe,08005,2020-03-29T23:08:25Z,67,78
"Archer, TX, USA",03-26-2020,Recovered,0,,33.61569967,-98.68754589,USA,TX,03-26-2020.csv,Archer,48009,2020-03-26T23:48:35Z,64,79
"Archuleta, CO, USA",03-29-2020,Active,0,,37.19474156,-107.04768670000001,USA,CO,03-29-2020.csv,Archuleta,08007,2020-03-29T23:08:25Z,67,80
"Arenac, MI, USA",03-27-2020,Active,0,,44.0636262,-83.89277559,USA,MI,03-27-2020.csv,Arenac,26011,2020-03-27T22:14:55Z,65,81
Argentina,03-18-2020,Deaths,2,,-38.4161,-63.6167,Argentina,,03-18-2020.csv,,,2020-03-18T03:33:03Z,56,110
"Arkansas, AR, USA",03-25-2020,Recovered,0,,34.29145151,-91.37277296,USA,AR,03-25-2020.csv,Arkansas,05001,2020-03-25T23:33:19Z,63,82
"Arlington, VA, USA",03-25-2020,Deaths,0,,38.8767675,-77.10139853,USA,VA,03-25-2020.csv,Arlington,51013,2020-03-25T23:33:19Z,63,83
Armenia,03-25-2020,Active,249,,40.0691,45.0382,Armenia,,03-25-2020.csv,,,2020-03-25T23:33:04Z,63,3258
"Armstrong, PA, USA",03-28-2020,Deaths,0,,40.81665618,-79.46290811,USA,PA,03-28-2020.csv,Armstrong,42005,2020-03-28T23:05:37Z,66,84
"Armstrong, TX, USA",03-30-2020,Confirmed,0,,34.96507426,-101.35748740000001,USA,TX,03-30-2020.csv,Armstrong,48011,2020-03-30T22:52:45Z,68,85
"Aroostook, ME, USA",03-29-2020,Recovered,0,,46.65926321,-68.59841248,USA,ME,03-29-2020.csv,Aroostook,23003,2020-03-29T23:08:25Z,67,86
"Arthur, NE, USA",03-28-2020,Active,0,,41.56896142,-101.6959559,USA,NE,03-28-2020.csv,Arthur,31005,2020-03-28T23:05:37Z,66,87
Aruba,03-15-2020,Recovered,0,,12.5211,-69.9683,Aruba,,03-15-2020.csv,,,2020-03-13T23:53:03Z,53,202
"Aruba, Netherlands",03-18-2020,Active,2,,12.5186,-70.0358,Netherlands,Aruba,03-18-2020.csv,,,2020-03-18T00:53:02Z,56,241
"AS, USA",03-22-2020,Confirmed,0,,-14.271,-170.132,USA,AS,03-22-2020.csv,,60000,2020-03-22T23:45:00Z,60,3174
"Ascension, LA, USA",03-26-2020,Confirmed,91,,30.20406249,-90.91328409999998,USA,LA,03-26-2020.csv,Ascension,22005,2020-03-26T23:48:35Z,64,88
"Ashe, NC, USA",03-23-2020,Active,0,,36.43296207,-81.49862729,USA,NC,03-23-2020.csv,Ashe,37009,2020-03-23T23:19:34Z,61,89
"Ashland, NE, USA",02-21-2020,Deaths,0,,,,USA,NE,02-21-2020.csv,Ashland,,2020-02-21T23:23:06Z,30,43
"Ashland, OH, USA",03-29-2020,Recovered,0,,40.84772277,-82.27280781,USA,OH,03-29-2020.csv,Ashland,39005,2020-03-29T23:08:25Z,67,90
"Ashland, WI, USA",03-28-2020,Recovered,0,,46.31956891,-90.67837132,USA,WI,03-28-2020.csv,Ashland,55003,2020-03-28T23:05:37Z,66,91
"Ashley, AR, USA",03-29-2020,Deaths,0,,33.19153461,-91.76984709999999,USA,AR,03-29-2020.csv,Ashley,05003,2020-03-29T23:08:25Z,67,92
"Ashtabula, OH, USA",03-22-2020,Recovered,0,,41.70860332,-80.74830218,USA,OH,03-22-2020.csv,Ashtabula,39007,2020-03-22T23:45:00Z,60,575
"Asotin, WA, USA",03-26-2020,Active,0,,46.18894415,-117.2022851,USA,WA,03-26-2020.csv,Asotin,53003,2020-03-26T23:48:35Z,64,94
"Assumption, LA, USA",03-30-2020,Active,17,,29.89946234,-91.06461642,USA,LA,03-30-2020.csv,Assumption,22007,2020-03-30T22:52:45Z,68,95
"Atascosa, TX, USA",03-29-2020,Recovered,0,,28.89333001,-98.52730485,USA,TX,03-29-2020.csv,Atascosa,48013,2020-03-29T23:08:25Z,67,96
"Atchison, KS, USA",03-25-2020,Active,0,,39.53185661,-95.30870026,USA,KS,03-25-2020.csv,Atchison,20005,2020-03-25T23:33:19Z,63,97
"Atchison, MO, USA",03-24-2020,Confirmed,0,,40.43238737,-95.42970639,USA,MO,03-24-2020.csv,Atchison,29005,2020-03-24T23:37:31Z,62,98
"Athens, OH, USA",03-24-2020,Recovered,0,,39.33425634,-82.04278644,USA,OH,03-24-2020.csv,Athens,39009,2020-03-24T23:37:31Z,62,99
"Atkinson, GA, USA",03-26-2020,Confirmed,0,,31.29633502,-82.87545866,USA,GA,03-26-2020.csv,Atkinson,13003,2020-03-26T23:48:35Z,64,100
"Atlantic, NJ, USA",03-27-2020,Active,14,,39.47538693,-74.65848483,USA,NJ,03-27-2020.csv,Atlantic,34001,2020-03-27T22:14:55Z,65,101
"Atoka, OK, USA",03-25-2020,Active,0,,34.37366573,-96.03802487,USA,OK,03-25-2020.csv,Atoka,40005,2020-03-25T23:33:19Z,63,102
"Attala, MS, USA",03-26-2020,Recovered,0,,33.08658803,-89.57838564,USA,MS,03-26-2020.csv,Attala,28007,2020-03-26T23:48:35Z,64,103
"Audrain, MO, USA",03-23-2020,Active,0,,39.215877,-91.84242683,USA,MO,03-23-2020.csv,Audrain,29007,2020-03-23T23:19:34Z,61,104
"Audubon, IA, USA",03-28-2020,Recovered,0,,41.6844628,-94.90581859,USA,IA,03-28-2020.csv,Audubon,19009,2020-03-28T23:05:37Z,66,105
"Auglaize, OH, USA",03-22-2020,Active,0,,40.55998859,-84.2242143,USA,OH,03-22-2020.csv,Auglaize,39011,2020-03-22T23:45:00Z,60,2463
"Augusta, VA, USA",03-30-2020,Deaths,0,,38.16404586,-79.12461614,USA,VA,03-30-2020.csv,Augusta,51015,2020-03-30T22:52:45Z,68,107
"Aurora, SD, USA",03-29-2020,Active,1,,43.71757685,-98.56050467,USA,SD,03-29-2020.csv,Aurora,46003,2020-03-29T23:08:25Z,67,108
"Austin, TX, USA",03-29-2020,Recovered,0,,29.88548725,-96.27736949,USA,TX,03-29-2020.csv,Austin,48015,2020-03-29T23:08:25Z,67,109
Australia,01-23-2020,Deaths,0,,,,Australia,,01-23-2020.csv,,,2020-01-23T17:00:00Z,1,42
"Australian Capital Territory, Australia",03-22-2020,Recovered,0,,-35.4735,149.0124,Australia,Australian Capital Territory,03-22-2020.csv,,,2020-03-22T23:48:00Z,60,3195
Austria,03-10-2020,Active,178,,47.5162,14.5501,Austria,,03-10-2020.csv,,,2020-03-10T16:13:16Z,48,34
"Autauga, AL, USA",03-27-2020,Recovered,0,,32.53952745,-86.64408227,USA,AL,03-27-2020.csv,Autauga,01001,2020-03-27T22:14:55Z,65,110
"Avery, NC, USA",03-27-2020,Active,0,,36.07569796,-81.92308483,USA,NC,03-27-2020.csv,Avery,37011,2020-03-27T22:14:55Z,65,111
"Avoyelles, LA, USA",03-24-2020,Deaths,0,,31.07796211,-92.00079449,USA,LA,03-24-2020.csv,Avoyelles,22009,2020-03-24T23:37:31Z,62,112
"AZ, USA",03-19-2020,Recovered,0,,33.7298,-111.4312,USA,AZ,03-19-2020.csv,,,2020-03-19T23:43:04Z,57,150
Azerbaijan,03-26-2020,Active,104,,40.1431,47.5769,Azerbaijan,,03-26-2020.csv,,,2020-03-26T23:48:18Z,64,3259
"Baca, CO, USA",03-24-2020,Recovered,0,,37.31940883,-102.5603223,USA,CO,03-24-2020.csv,Baca,08009,2020-03-24T23:37:31Z,62,113
"Bacon, GA, USA",03-29-2020,Recovered,0,,31.55456473,-82.45936528,USA,GA,03-29-2020.csv,Bacon,13005,2020-03-29T23:08:25Z,67,114
Bahamas,03-24-2020,Active,4,,25.025885,-78.035889,Bahamas,,03-24-2020.csv,,,2020-03-24T23:37:15Z,62,3262
"Bahamas, The",03-19-2020,Active,3,,25.0343,-77.3963,"Bahamas, The",,03-19-2020.csv,,,2020-03-19T11:33:39Z,57,231
Bahrain,03-05-2020,Confirmed,55,,26.0275,50.5500,Bahrain,,03-05-2020.csv,,,2020-03-05T13:53:03Z,43,45
"Bailey, TX, USA",03-22-2020,Deaths,0,,34.06854817,-102.8299707,USA,TX,03-22-2020.csv,Bailey,48017,2020-03-22T23:45:00Z,60,2751
"Baker, FL, USA",03-24-2020,Active,4,,30.33060121,-82.28467476,USA,FL,03-24-2020.csv,Baker,12003,2020-03-24T23:37:31Z,62,116
"Baker, GA, USA",03-28-2020,Active,0,,31.32669878,-84.44218806,USA,GA,03-28-2020.csv,Baker,13007,2020-03-28T23:05:37Z,66,117
"Baker, OR, USA",03-27-2020,Deaths,0,,44.70915557,-117.6749883,USA,OR,03-27-2020.csv,Baker,41001,2020-03-27T22:14:55Z,65,118
"Baldwin, AL, USA",03-26-2020,Recovered,0,,30.72774991,-87.72207058,USA,AL,03-26-2020.csv,Baldwin,01003,2020-03-26T23:48:35Z,64,119
"Baldwin, GA, USA",03-23-2020,Deaths,0,,33.06882326,-83.24701748,USA,GA,03-23-2020.csv,Baldwin,13009,2020-03-23T23:19:34Z,61,120
"Ballard, KY, USA",03-25-2020,Confirmed,0,,37.05842757,-88.99427697,USA,KY,03-25-2020.csv,Ballard,21007,2020-03-25T23:33:19Z,63,121
"Baltimore City, MD, USA",03-26-2020,Active,72,,39.30211911,-76.61151012,USA,MD,03-26-2020.csv,Baltimore City,24510,2020-03-26T23:48:35Z,64,123
"Baltimore, MD, USA",03-23-2020,Active,34,,39.45784712,-76.62911955,USA,MD,03-23-2020.csv,Baltimore,24005,2020-03-23T23:19:34Z,61,122
"Bamberg, SC, USA",03-22-2020,Active,0,,33.21927586,-81.05659969,USA,SC,03-22-2020.csv,Bamberg,45009,2020-03-22T23:45:00Z,60,2620
"Bandera, TX, USA",03-24-2020,Recovered,0,,29.74619598,-99.24598147,USA,TX,03-24-2020.csv,Bandera,48019,2020-03-24T23:37:31Z,62,125
Bangladesh,03-20-2020,Deaths,1,,23.6850,90.3563,Bangladesh,,03-20-2020.csv,,,2020-03-20T15:13:21Z,58,186
"Banks, GA, USA",03-23-2020,Confirmed,0,,34.35607081,-83.49644388,USA,GA,03-23-2020.csv,Banks,13011,2020-03-23T23:19:34Z,61,126
"Banner, NE, USA",03-26-2020,Recovered,0,,41.54634427,-103.7114332,USA,NE,03-26-2020.csv,Banner,31007,2020-03-26T23:48:35Z,64,127
"Bannock, ID, USA",03-28-2020,Active,3,,42.67002716,-112.2233311,USA,ID,03-28-2020.csv,Bannock,16005,2020-03-28T23:05:37Z,66,128
"Baraga, MI, USA",03-27-2020,Recovered,0,,46.6720582,-88.36363591,USA,MI,03-27-2020.csv,Baraga,26013,2020-03-27T22:14:55Z,65,129
Barbados,03-25-2020,Active,18,,13.1939,-59.5432,Barbados,,03-25-2020.csv,,,2020-03-25T23:33:04Z,63,3264
"Barber, KS, USA",03-24-2020,Recovered,0,,37.2288586,-98.68460053,USA,KS,03-24-2020.csv,Barber,20007,2020-03-24T23:37:31Z,62,130
"Barbour, AL, USA",03-27-2020,Deaths,0,,31.868263,-85.3871286,USA,AL,03-27-2020.csv,Barbour,01005,2020-03-27T22:14:55Z,65,131
"Barbour, WV, USA",03-27-2020,Recovered,0,,39.1307219,-80.00350858,USA,WV,03-27-2020.csv,Barbour,54001,2020-03-27T22:14:55Z,65,132
"Barnes, ND, USA",03-26-2020,Confirmed,0,,46.93579637,-98.06605978,USA,ND,03-26-2020.csv,Barnes,38003,2020-03-26T23:48:35Z,64,133
"Barnstable, MA, USA",03-22-2020,Confirmed,24,,41.72980578,-70.28854339,USA,MA,03-22-2020.csv,Barnstable,25001,2020-03-22T23:45:00Z,60,290
"Barnwell, SC, USA",03-25-2020,Deaths,0,,33.26679302,-81.43584352,USA,SC,03-25-2020.csv,Barnwell,45011,2020-03-25T23:33:19Z,63,135
"Barren, KY, USA",03-24-2020,Active,0,,36.96469836,-85.93338945,USA,KY,03-24-2020.csv,Barren,21009,2020-03-24T23:37:31Z,62,136
"Barron, WI, USA",03-26-2020,Recovered,0,,45.42372701,-91.84833627,USA,WI,03-26-2020.csv,Barron,55005,2020-03-26T23:48:35Z,64,137
"Barrow, GA, USA",03-27-2020,Active,6,,33.99148694,-83.71436292,USA,GA,03-27-2020.csv,Barrow,13013,2020-03-27T22:14:55Z,65,138
"Barry, MI, USA",03-23-2020,Deaths,0,,42.59513984,-85.30834519,USA,MI,03-23-2020.csv,Barry,26015,2020-03-23T23:19:34Z,61,139
"Barry, MO, USA",03-28-2020,Active,1,,36.70978521,-93.82919888,USA,MO,03-28-2020.csv,Barry,29009,2020-03-28T23:05:37Z,66,140
"Bartholomew, IN, USA",03-27-2020,Deaths,0,,39.20744865,-85.89558181,USA,IN,03-27-2020.csv,Bartholomew,18005,2020-03-27T22:14:55Z,65,141
"Barton, KS, USA",03-23-2020,Deaths,0,,38.47889676,-98.75636726,USA,KS,03-23-2020.csv,Barton,20009,2020-03-23T23:19:34Z,61,142
"Barton, MO, USA",03-23-2020,Active,0,,37.50207671,-94.34757022,USA,MO,03-23-2020.csv,Barton,29011,2020-03-23T23:19:34Z,61,143
"Bartow, GA, USA",03-25-2020,Recovered,0,,34.23732119,-84.83887523,USA,GA,03-25-2020.csv,Bartow,13015,2020-03-25T23:33:19Z,63,144
"Bastrop, TX, USA",03-25-2020,Active,1,,30.10370699,-97.31206354,USA,TX,03-25-2020.csv,Bastrop,48021,2020-03-25T23:33:19Z,63,145
"Bates, MO, USA",03-28-2020,Confirmed,1,,38.25271289,-94.34113157,USA,MO,03-28-2020.csv,Bates,29013,2020-03-28T23:05:37Z,66,146
"Bath, KY, USA",03-29-2020,Active,0,,38.14735938,-83.74588932,USA,KY,03-29-2020.csv,Bath,21011,2020-03-29T23:08:25Z,67,147
"Bath, VA, USA",03-29-2020,Active,0,,38.05852573,-79.73912095,USA,VA,03-29-2020.csv,Bath,51017,2020-03-29T23:08:25Z,67,148
"Bavaria, Germany",01-30-2020,Recovered,0,,,,Germany,Bavaria,01-30-2020.csv,,,2020-01-30T16:00:00Z,8,53
"Baxter, AR, USA",03-26-2020,Active,0,,36.28784385,-92.33782872,USA,AR,03-26-2020.csv,Baxter,05005,2020-03-26T23:48:35Z,64,149
"Bay, FL, USA",03-22-2020,Deaths,0,,30.26548745,-85.62122584,USA,FL,03-22-2020.csv,Bay,12005,2020-03-22T23:45:00Z,60,241
"Bay, MI, USA",03-22-2020,Recovered,0,,43.70639106,-83.98731479,USA,MI,03-22-2020.csv,Bay,26017,2020-03-22T23:45:00Z,60,187
"Bayfield, WI, USA",03-23-2020,Deaths,0,,46.52868768,-91.19716729,USA,WI,03-23-2020.csv,Bayfield,55007,2020-03-23T23:19:34Z,61,152
"Baylor, TX, USA",03-28-2020,Deaths,0,,33.61640794,-99.21352901,USA,TX,03-28-2020.csv,Baylor,48023,2020-03-28T23:05:37Z,66,153
"Beadle, SD, USA",03-23-2020,Deaths,0,,44.41464384,-98.27858469,USA,SD,03-23-2020.csv,Beadle,46005,2020-03-23T23:19:34Z,61,154
"Bear Lake, ID, USA",03-22-2020,Recovered,0,,42.28269683,-111.3289238,USA,ID,03-22-2020.csv,Bear Lake,16007,2020-03-22T23:45:00Z,60,1463
"Beaufort, NC, USA",03-23-2020,Active,0,,35.48531943,-76.84325809,USA,NC,03-23-2020.csv,Beaufort,37013,2020-03-23T23:19:34Z,61,156
"Beaufort, SC, USA",03-26-2020,Confirmed,26,,32.39226291,-80.72619758,USA,SC,03-26-2020.csv,Beaufort,45013,2020-03-26T23:48:35Z,64,157
"Beauregard, LA, USA",03-24-2020,Deaths,0,,30.64836518,-93.34173616,USA,LA,03-24-2020.csv,Beauregard,22011,2020-03-24T23:37:31Z,62,158
"Beaver, OK, USA",03-22-2020,Recovered,0,,36.7496847,-100.4758872,USA,OK,03-22-2020.csv,Beaver,40007,2020-03-22T23:45:00Z,60,2508
"Beaver, PA, USA",03-23-2020,Active,3,,40.6825484,-80.34921611,USA,PA,03-23-2020.csv,Beaver,42007,2020-03-23T23:19:34Z,61,160
"Beaver, UT, USA",03-25-2020,Deaths,0,,38.35657051,-113.2342232,USA,UT,03-25-2020.csv,Beaver,49001,2020-03-25T23:33:19Z,63,161
"Beaverhead, MT, USA",03-28-2020,Recovered,0,,45.13434354,-112.89846940000001,USA,MT,03-28-2020.csv,Beaverhead,30001,2020-03-28T23:05:37Z,66,162
"Becker, MN, USA",03-29-2020,Deaths,0,,46.93479392,-95.67158144,USA,MN,03-29-2020.csv,Becker,27005,2020-03-29T23:08:25Z,67,163
"Beckham, OK, USA",03-28-2020,Confirmed,0,,35.26862449,-99.68128023,USA,OK,03-28-2020.csv,Beckham,40009,2020-03-28T23:05:37Z,66,164
"Bedford, PA, USA",03-29-2020,Active,0,,40.00522157,-78.48998442,USA,PA,03-29-2020.csv,Bedford,42009,2020-03-29T23:08:25Z,67,165
"Bedford, TN, USA",03-28-2020,Confirmed,1,,35.51123746,-86.45549096,USA,TN,03-28-2020.csv,Bedford,47003,2020-03-28T23:05:37Z,66,166
"Bedford, VA, USA",03-30-2020,Active,2,,37.3080028,-79.5281964,USA,VA,03-30-2020.csv,Bedford,51019,2020-03-30T22:52:45Z,68,167
"Bee, TX, USA",03-24-2020,Deaths,0,,28.41761668,-97.74215593,USA,TX,03-24-2020.csv,Bee,48025,2020-03-24T23:37:31Z,62,168
"Beijing, China",02-26-2020,Recovered,235,,,,China,Beijing,02-26-2020.csv,,,2020-02-26T00:53:02Z,35,15
Belarus,03-11-2020,Recovered,3,,53.7098,27.9534,Belarus,,03-11-2020.csv,,,2020-03-10T16:13:27Z,49,122
Belgium,02-18-2020,Recovered,1,,,,Belgium,,02-18-2020.csv,,,2020-02-17T04:23:06Z,27,59
Belize,03-26-2020,Active,2,,17.1899,-88.4976,Belize,,03-26-2020.csv,,,2020-03-26T23:48:18Z,64,3266
"Belknap, NH, USA",03-29-2020,Recovered,0,,43.51637314,-71.41684235,USA,NH,03-29-2020.csv,Belknap,33001,2020-03-29T23:08:25Z,67,169
"Bell, KY, USA",03-26-2020,Confirmed,0,,36.73355174,-83.67766671,USA,KY,03-26-2020.csv,Bell,21013,2020-03-26T23:48:35Z,64,170
"Bell, TX, USA",03-25-2020,Recovered,0,,31.03736027,-97.4785025,USA,TX,03-25-2020.csv,Bell,48027,2020-03-25T23:33:19Z,63,171
"Belmont, OH, USA",03-24-2020,Deaths,0,,40.01625942,-80.9924051,USA,OH,03-24-2020.csv,Belmont,39013,2020-03-24T23:37:31Z,62,172
"Beltrami, MN, USA",03-28-2020,Deaths,0,,47.97373527,-94.93732139,USA,MN,03-28-2020.csv,Beltrami,27007,2020-03-28T23:05:37Z,66,173
"Ben Hill, GA, USA",03-23-2020,Active,0,,31.76095874,-83.22145359,USA,GA,03-23-2020.csv,Ben Hill,13017,2020-03-23T23:19:34Z,61,174
"Benewah, ID, USA",03-30-2020,Deaths,0,,47.21754179,-116.6586851,USA,ID,03-30-2020.csv,Benewah,16009,2020-03-30T22:52:45Z,68,175
Benin,03-19-2020,Recovered,0,,9.3077,2.3158,Benin,,03-19-2020.csv,,,2020-03-18T14:13:56Z,57,243
"Bennett, SD, USA",03-22-2020,Deaths,0,,43.19486375,-101.6665572,USA,SD,03-22-2020.csv,Bennett,46007,2020-03-22T23:45:00Z,60,2633
"Bennington, VT, USA",03-27-2020,Active,15,,43.03519828,-73.09048868,USA,VT,03-27-2020.csv,Bennington,50003,2020-03-27T22:14:55Z,65,177
"Benson, ND, USA",03-27-2020,Confirmed,0,,48.0683985,-99.35916363,USA,ND,03-27-2020.csv,Benson,38005,2020-03-27T22:14:55Z,65,178
"Bent, CO, USA",03-26-2020,Deaths,0,,37.95474293,-103.0720195,USA,CO,03-26-2020.csv,Bent,08011,2020-03-26T23:48:35Z,64,179
"Benton, AR, USA",03-26-2020,Confirmed,18,,36.33644656,-94.25680817,USA,AR,03-26-2020.csv,Benton,05007,2020-03-26T23:48:35Z,64,180
"Benton, IA, USA",03-30-2020,Recovered,0,,42.08011739,-92.06463573,USA,IA,03-30-2020.csv,Benton,19011,2020-03-30T22:52:45Z,68,182
"Benton, IN, USA",03-24-2020,Recovered,0,,40.60626947,-87.31093999,USA,IN,03-24-2020.csv,Benton,18007,2020-03-24T23:37:31Z,62,181
"Benton, MN, USA",03-28-2020,Confirmed,1,,45.69804958,-93.99514135,USA,MN,03-28-2020.csv,Benton,27009,2020-03-28T23:05:37Z,66,183
"Benton, MO, USA",03-22-2020,Deaths,0,,38.29503305,-93.28756116,USA,MO,03-22-2020.csv,Benton,29015,2020-03-22T23:45:00Z,60,2077
"Benton, MS, USA",03-26-2020,Confirmed,1,,34.81681228,-89.18945516,USA,MS,03-26-2020.csv,Benton,28009,2020-03-26T23:48:35Z,64,184
"Benton, OR, USA",03-27-2020,Recovered,0,,44.49167306,-123.4316987,USA,OR,03-27-2020.csv,Benton,41003,2020-03-27T22:14:55Z,65,186
"Benton, TN, USA",03-30-2020,Recovered,0,,36.07110411,-88.06849355,USA,TN,03-30-2020.csv,Benton,47005,2020-03-30T22:52:45Z,68,187
"Benton, WA, USA",03-28-2020,Recovered,0,,46.23946995,-119.51208340000001,USA,WA,03-28-2020.csv,Benton,53005,2020-03-28T23:05:37Z,66,188
"Benzie, MI, USA",03-26-2020,Active,0,,44.63899297,-86.01608482,USA,MI,03-26-2020.csv,Benzie,26019,2020-03-26T23:48:35Z,64,189
"Bergen, NJ, USA",03-24-2020,Confirmed,701,,40.96010917,-74.07164325,USA,NJ,03-24-2020.csv,Bergen,34003,2020-03-24T23:37:31Z,62,190
"Berkeley, CA, USA",03-03-2020,Confirmed,1,,37.8715,-122.2730,USA,CA,03-03-2020.csv,Berkeley,,2020-03-03T23:53:03Z,41,130
"Berkeley, SC, USA",03-22-2020,Active,2,,33.20222596,-79.94654523,USA,SC,03-22-2020.csv,Berkeley,45015,2020-03-22T23:45:00Z,60,815
"Berkeley, WV, USA",03-24-2020,Deaths,0,,39.46704621,-78.02414609,USA,WV,03-24-2020.csv,Berkeley,54003,2020-03-24T23:37:31Z,62,192
"Berks, PA, USA",03-28-2020,Active,65,,40.41570541,-75.92457766,USA,PA,03-28-2020.csv,Berks,42011,2020-03-28T23:05:37Z,66,193
"Berkshire, MA, USA",03-27-2020,Confirmed,105,,42.37428441,-73.20524838,USA,MA,03-27-2020.csv,Berkshire,25003,2020-03-27T22:14:55Z,65,194
"Bermuda, United Kingdom",03-28-2020,Confirmed,17,,32.3078,-64.7505,United Kingdom,Bermuda,03-28-2020.csv,,,2020-03-28T23:05:25Z,66,3177
"Bernalillo, NM, USA",03-23-2020,Confirmed,38,,35.05163625,-106.6703554,USA,NM,03-23-2020.csv,Bernalillo,35001,2020-03-23T23:19:34Z,61,195
"Berrien, GA, USA",03-27-2020,Recovered,0,,31.27590016,-83.22529920000002,USA,GA,03-27-2020.csv,Berrien,13019,2020-03-27T22:14:55Z,65,196
"Berrien, MI, USA",03-28-2020,Confirmed,22,,41.95447397,-86.41313079999998,USA,MI,03-28-2020.csv,Berrien,26021,2020-03-28T23:05:37Z,66,197
"Bertie, NC, USA",03-24-2020,Deaths,0,,36.0688473,-76.96545943,USA,NC,03-24-2020.csv,Bertie,37015,2020-03-24T23:37:31Z,62,198
"Bethel, AK, USA",03-25-2020,Recovered,0,,60.90980451,-159.8561831,USA,AK,03-25-2020.csv,Bethel,02050,2020-03-25T23:33:19Z,63,199
"Bexar, TX, USA",02-21-2020,Recovered,0,,,,USA,TX,02-21-2020.csv,Bexar,,2020-02-21T23:23:06Z,30,60
Bhutan,03-12-2020,Confirmed,1,,27.5142,90.4336,Bhutan,,03-12-2020.csv,,,2020-03-06T15:43:02Z,50,186
"Bibb, AL, USA",03-30-2020,Deaths,0,,32.99642064,-87.12511459999996,USA,AL,03-30-2020.csv,Bibb,01007,2020-03-30T22:52:45Z,68,201
"Bibb, GA, USA",03-22-2020,Deaths,0,,32.80904227,-83.70489165,USA,GA,03-22-2020.csv,Bibb,13021,2020-03-22T23:45:00Z,60,407
"Bienville, LA, USA",03-27-2020,Deaths,1,,32.34569994,-93.05398492,USA,LA,03-27-2020.csv,Bienville,22013,2020-03-27T22:14:55Z,65,203
"Big Horn, MT, USA",03-23-2020,Deaths,0,,45.42335905,-107.492347,USA,MT,03-23-2020.csv,Big Horn,30003,2020-03-23T23:19:34Z,61,204
"Big Horn, WY, USA",03-24-2020,Recovered,0,,44.52405055,-107.9960365,USA,WY,03-24-2020.csv,Big Horn,56003,2020-03-24T23:37:31Z,62,205
"Big Stone, MN, USA",03-22-2020,Confirmed,0,,45.42712824,-96.41403739,USA,MN,03-22-2020.csv,Big Stone,27011,2020-03-22T23:45:00Z,60,1984
"Billings, ND, USA",03-30-2020,Active,0,,47.02366884,-103.3762965,USA,ND,03-30-2020.csv,Billings,38007,2020-03-30T22:52:45Z,68,207
"Bingham, ID, USA",03-25-2020,Confirmed,2,,43.21672879999999,-112.3978437,USA,ID,03-25-2020.csv,Bingham,16011,2020-03-25T23:33:19Z,63,208
"Black Hawk, IA, USA",03-26-2020,Deaths,0,,42.4704581,-92.30524729,USA,IA,03-26-2020.csv,Black Hawk,19013,2020-03-26T23:48:35Z,64,209
"Blackford, IN, USA",03-27-2020,Deaths,0,,40.47388153,-85.32499702,USA,IN,03-27-2020.csv,Blackford,18009,2020-03-27T22:14:55Z,65,210
"Bladen, NC, USA",03-28-2020,Confirmed,0,,34.61296243,-78.56180059,USA,NC,03-28-2020.csv,Bladen,37017,2020-03-28T23:05:37Z,66,211
"Blaine, ID, USA",03-26-2020,Deaths,2,,43.4085812,-113.9752658,USA,ID,03-26-2020.csv,Blaine,16013,2020-03-26T23:48:35Z,64,212
"Blaine, MT, USA",03-25-2020,Confirmed,0,,48.43175214,-108.9582723,USA,MT,03-25-2020.csv,Blaine,30005,2020-03-25T23:33:19Z,63,213
"Blaine, NE, USA",03-23-2020,Active,0,,41.91311716,-99.97677845,USA,NE,03-23-2020.csv,Blaine,31009,2020-03-23T23:19:34Z,61,214
"Blaine, OK, USA",03-30-2020,Active,0,,35.87518314,-98.43307003,USA,OK,03-30-2020.csv,Blaine,40011,2020-03-30T22:52:45Z,68,215
"Blair, PA, USA",03-22-2020,Recovered,0,,40.47961444,-78.34917412,USA,PA,03-22-2020.csv,Blair,42013,2020-03-22T23:45:00Z,60,2587
"Blanco, TX, USA",03-24-2020,Active,1,,30.26640707,-98.3999852,USA,TX,03-24-2020.csv,Blanco,48031,2020-03-24T23:37:31Z,62,217
"Bland, VA, USA",03-23-2020,Confirmed,0,,37.13128068,-81.13599391,USA,VA,03-23-2020.csv,Bland,51021,2020-03-23T23:19:34Z,61,218
"Bleckley, GA, USA",03-27-2020,Confirmed,0,,32.43829035,-83.33035166,USA,GA,03-27-2020.csv,Bleckley,13023,2020-03-27T22:14:55Z,65,219
"Bledsoe, TN, USA",03-29-2020,Recovered,0,,35.59942968,-85.20611967,USA,TN,03-29-2020.csv,Bledsoe,47007,2020-03-29T23:08:25Z,67,220
"Blount, AL, USA",03-23-2020,Active,0,,33.98210918,-86.56790593,USA,AL,03-23-2020.csv,Blount,01009,2020-03-23T23:19:34Z,61,221
"Blount, TN, USA",03-29-2020,Deaths,0,,35.68938198,-83.92847788,USA,TN,03-29-2020.csv,Blount,47009,2020-03-29T23:08:25Z,67,222
"Blue Earth, MN, USA",03-24-2020,Deaths,0,,44.03554215,-94.06699781,USA,MN,03-24-2020.csv,Blue Earth,27013,2020-03-24T23:37:31Z,62,223
"Boise, ID, USA",03-26-2020,Confirmed,0,,43.98829931,-115.7309284,USA,ID,03-26-2020.csv,Boise,16015,2020-03-26T23:48:35Z,64,224
"Bolivar, MS, USA",03-27-2020,Active,9,,33.79696941,-90.87372121,USA,MS,03-27-2020.csv,Bolivar,28011,2020-03-27T22:14:55Z,65,225
Bolivia,03-22-2020,Confirmed,24,,-16.2902,-63.5887,Bolivia,,03-22-2020.csv,,,2020-03-22T23:45:00Z,60,3340
"Bollinger, MO, USA",03-22-2020,Deaths,0,,37.32449052,-90.02725304,USA,MO,03-22-2020.csv,Bollinger,29017,2020-03-22T23:45:00Z,60,2078
"Bon Homme, SD, USA",03-22-2020,Deaths,0,,42.98914167,-97.88592746,USA,SD,03-22-2020.csv,Bon Homme,46009,2020-03-22T23:45:00Z,60,1142
"Bond, IL, USA",03-29-2020,Recovered,0,,38.88829622,-89.43534887,USA,IL,03-29-2020.csv,Bond,17005,2020-03-29T23:08:25Z,67,228
"Bonner, ID, USA",03-27-2020,Active,0,,48.29996017,-116.6017932,USA,ID,03-27-2020.csv,Bonner,16017,2020-03-27T22:14:55Z,65,229
"Bonneville, ID, USA",03-28-2020,Confirmed,1,,43.38713372,-111.6161537,USA,ID,03-28-2020.csv,Bonneville,16019,2020-03-28T23:05:37Z,66,230
"Boone, AR, USA",03-23-2020,Deaths,0,,36.3084504,-93.09374925,USA,AR,03-23-2020.csv,Boone,05009,2020-03-23T23:19:34Z,61,231
"Boone, IA, USA",03-29-2020,Active,1,,42.03657094,-93.9313999,USA,IA,03-29-2020.csv,Boone,19015,2020-03-29T23:08:25Z,67,234
"Boone, IL, USA",03-22-2020,Confirmed,0,,42.32359279,-88.82345779,USA,IL,03-22-2020.csv,Boone,17007,2020-03-22T23:45:00Z,60,1499
"Boone, IN, USA",03-24-2020,Active,3,,40.0509304,-86.46841646,USA,IN,03-24-2020.csv,Boone,18011,2020-03-24T23:37:31Z,62,233
"Boone, KY, USA",03-23-2020,Deaths,0,,38.97065142,-84.72615357,USA,KY,03-23-2020.csv,Boone,21015,2020-03-23T23:19:34Z,61,235
"Boone, MO, USA",03-26-2020,Active,36,,38.99186229,-92.30723575,USA,MO,03-26-2020.csv,Boone,29019,2020-03-26T23:48:35Z,64,236
"Boone, NE, USA",03-26-2020,Active,0,,41.70759415,-98.06737183,USA,NE,03-26-2020.csv,Boone,31011,2020-03-26T23:48:35Z,64,237
"Boone, WV, USA",03-24-2020,Confirmed,0,,38.01974191,-81.69888019,USA,WV,03-24-2020.csv,Boone,54005,2020-03-24T23:37:31Z,62,238
"Borden, TX, USA",03-26-2020,Deaths,0,,32.74363984,-101.43165090000001,USA,TX,03-26-2020.csv,Borden,48033,2020-03-26T23:48:35Z,64,239
Bosnia and Herzegovina,03-12-2020,Confirmed,11,,43.9159,17.6791,Bosnia and Herzegovina,,03-12-2020.csv,,,2020-03-12T09:13:26Z,50,125
"Bosque, TX, USA",03-23-2020,Deaths,0,,31.89978581,-97.63613524,USA,TX,03-23-2020.csv,Bosque,48035,2020-03-23T23:19:34Z,61,240
"Bossier, LA, USA",03-28-2020,Active,45,,32.67932307,-93.60460152,USA,LA,03-28-2020.csv,Bossier,22015,2020-03-28T23:05:37Z,66,241
"Boston, MA, USA",03-03-2020,Deaths,0,,42.3601,-71.0589,USA,MA,03-03-2020.csv,Boston,,2020-02-28T21:13:12Z,41,131
"Botetourt, VA, USA",03-27-2020,Active,1,,37.55531756,-79.80982182,USA,VA,03-27-2020.csv,Botetourt,51023,2020-03-27T22:14:55Z,65,242
Botswana,03-30-2020,Deaths,0,,-22.3285,24.6849,Botswana,,03-30-2020.csv,,,2020-03-30T22:52:33Z,68,3286
"Bottineau, ND, USA",03-28-2020,Confirmed,0,,48.79106111,-100.8378166,USA,ND,03-28-2020.csv,Bottineau,38009,2020-03-28T23:05:37Z,66,243
"Boulder, CO, USA",03-24-2020,Confirmed,39,,40.09313619,-105.3546767,USA,CO,03-24-2020.csv,Boulder,08013,2020-03-24T23:37:31Z,62,244
"Boundary, ID, USA",03-25-2020,Deaths,0,,48.76684761,-116.4630179,USA,ID,03-25-2020.csv,Boundary,16021,2020-03-25T23:33:19Z,63,245
"Bourbon, KS, USA",03-24-2020,Recovered,0,,37.85508555,-94.84865997,USA,KS,03-24-2020.csv,Bourbon,20011,2020-03-24T23:37:31Z,62,246
"Bourbon, KY, USA",03-29-2020,Confirmed,2,,38.2054607,-84.21827874,USA,KY,03-29-2020.csv,Bourbon,21017,2020-03-29T23:08:25Z,67,247
"Bowie, TX, USA",03-23-2020,Deaths,0,,33.44626922,-94.41834132,USA,TX,03-23-2020.csv,Bowie,48037,2020-03-23T23:19:34Z,61,248
"Bowman, ND, USA",03-22-2020,Confirmed,0,,46.11285362,-103.5203343,USA,ND,03-22-2020.csv,Bowman,38011,2020-03-22T23:45:00Z,60,2418
"Box Butte, NE, USA",03-22-2020,Active,0,,42.22079243,-103.0878834,USA,NE,03-22-2020.csv,Box Butte,31013,2020-03-22T23:45:00Z,60,2220
"Box Elder, UT, USA",03-28-2020,Deaths,0,,41.52106798,-113.08328159999999,USA,UT,03-28-2020.csv,Box Elder,49003,2020-03-28T23:05:37Z,66,251
"Boyd, KY, USA",03-22-2020,Active,0,,38.36176608,-82.68652187,USA,KY,03-22-2020.csv,Boyd,21019,2020-03-22T23:45:00Z,60,1793
"Boyd, NE, USA",03-24-2020,Active,0,,42.899727399999996,-98.76486568,USA,NE,03-24-2020.csv,Boyd,31015,2020-03-24T23:37:31Z,62,253
"Boyle, KY, USA",03-23-2020,Active,0,,37.62680923,-84.8633779,USA,KY,03-23-2020.csv,Boyle,21021,2020-03-23T23:19:34Z,61,254
"Bracken, KY, USA",03-25-2020,Confirmed,0,,38.69158994,-84.08532444,USA,KY,03-25-2020.csv,Bracken,21023,2020-03-25T23:33:19Z,63,255
"Bradford, FL, USA",03-24-2020,Confirmed,1,,29.95079741,-82.16611613,USA,FL,03-24-2020.csv,Bradford,12007,2020-03-24T23:37:31Z,62,256
"Bradford, PA, USA",03-22-2020,Active,0,,41.78869215,-76.51570822,USA,PA,03-22-2020.csv,Bradford,42015,2020-03-22T23:45:00Z,60,2588
"Bradley, AR, USA",03-25-2020,Active,4,,33.46755808,-92.15980837,USA,AR,03-25-2020.csv,Bradley,05011,2020-03-25T23:33:19Z,63,258
"Bradley, TN, USA",03-29-2020,Confirmed,8,,35.15739424,-84.857186,USA,TN,03-29-2020.csv,Bradley,47011,2020-03-29T23:08:25Z,67,259
"Branch, MI, USA",03-22-2020,Active,0,,41.91600556,-85.05929476,USA,MI,03-22-2020.csv,Branch,26023,2020-03-22T23:45:00Z,60,1937
"Brantley, GA, USA",03-25-2020,Active,0,,31.19576557,-81.97743999,USA,GA,03-25-2020.csv,Brantley,13025,2020-03-25T23:33:19Z,63,261
"Braxton, WV, USA",03-27-2020,Recovered,0,,38.70036159,-80.72011184,USA,WV,03-27-2020.csv,Braxton,54007,2020-03-27T22:14:55Z,65,262
Brazil,03-30-2020,Confirmed,4579,,-14.235,-51.9253,Brazil,,03-30-2020.csv,,,2020-03-30T22:52:33Z,68,3287
"Brazoria, TX, USA",03-25-2020,Recovered,0,,29.18757369,-95.44563172,USA,TX,03-25-2020.csv,Brazoria,48039,2020-03-25T23:33:19Z,63,263
"Brazos, TX, USA",03-23-2020,Deaths,0,,30.663644800000004,-96.30205577,USA,TX,03-23-2020.csv,Brazos,48041,2020-03-23T23:19:34Z,61,264
"Breathitt, KY, USA",03-23-2020,Active,1,,37.52333168,-83.31959161,USA,KY,03-23-2020.csv,Breathitt,21025,2020-03-23T23:19:34Z,61,265
"Breckinridge, KY, USA",03-24-2020,Recovered,0,,37.77377239,-86.42885017,USA,KY,03-24-2020.csv,Breckinridge,21027,2020-03-24T23:37:31Z,62,266
"Bremer, IA, USA",03-28-2020,Confirmed,0,,42.77461496,-92.31795937,USA,IA,03-28-2020.csv,Bremer,19017,2020-03-28T23:05:37Z,66,267
"Brevard, FL, USA",03-24-2020,Active,9,,28.29409504,-80.73091022,USA,FL,03-24-2020.csv,Brevard,12009,2020-03-24T23:37:31Z,62,268
"Brewster, TX, USA",03-30-2020,Confirmed,0,,29.81008251,-103.25203259999999,USA,TX,03-30-2020.csv,Brewster,48043,2020-03-30T22:52:45Z,68,269
"Briscoe, TX, USA",03-22-2020,Recovered,0,,34.53026962,-101.2084947,USA,TX,03-22-2020.csv,Briscoe,48045,2020-03-22T23:45:00Z,60,2760
"Bristol Bay, AK, USA",03-26-2020,Recovered,0,,58.74513976,-156.701064,USA,AK,03-26-2020.csv,Bristol Bay,02060,2020-03-26T23:48:35Z,64,274
"Bristol, MA, USA",03-26-2020,Active,90,,41.79228404,-71.10872211,USA,MA,03-26-2020.csv,Bristol,25005,2020-03-26T23:48:35Z,64,271
"Bristol, RI, USA",03-26-2020,Recovered,0,,41.71018079,-71.28652315,USA,RI,03-26-2020.csv,Bristol,44001,2020-03-26T23:48:35Z,64,272
"Bristol, VA, USA",03-23-2020,Active,0,,36.616302399999995,-82.16359122,USA,VA,03-23-2020.csv,Bristol,51520,2020-03-23T23:19:34Z,61,273
"British Columbia, Canada",03-28-2020,Confirmed,884,,53.7267,-127.6476,Canada,British Columbia,03-28-2020.csv,,,2020-03-28T23:10:51Z,66,3178
"British Virgin Islands, United Kingdom",03-30-2020,Deaths,0,,18.4207,-64.64,United Kingdom,British Virgin Islands,03-30-2020.csv,,,2020-03-30T22:52:33Z,68,3187
"Broadwater, MT, USA",03-26-2020,Recovered,0,,46.33277565,-111.49558130000001,USA,MT,03-26-2020.csv,Broadwater,30007,2020-03-26T23:48:35Z,64,275
"Bronx, NY, USA",03-26-2020,Deaths,0,,40.85209301,-73.86282755,USA,NY,03-26-2020.csv,Bronx,36005,2020-03-26T23:48:35Z,64,276
"Brooke, WV, USA",03-24-2020,Recovered,0,,40.27367263,-80.57915332,USA,WV,03-24-2020.csv,Brooke,54009,2020-03-24T23:37:31Z,62,277
"Brookings, SD, USA",03-27-2020,Active,1,,44.36974375,-96.79079945,USA,SD,03-27-2020.csv,Brookings,46011,2020-03-27T22:14:55Z,65,278
"Brooks, GA, USA",03-23-2020,Deaths,0,,30.83922642,-83.58303423,USA,GA,03-23-2020.csv,Brooks,13027,2020-03-23T23:19:34Z,61,279
"Brooks, TX, USA",03-28-2020,Confirmed,0,,27.03103197,-98.21808402,USA,TX,03-28-2020.csv,Brooks,48047,2020-03-28T23:05:37Z,66,280
"Broome, NY, USA",03-22-2020,Recovered,0,,42.15903158,-75.81326086,USA,NY,03-22-2020.csv,Broome,36007,2020-03-22T23:45:00Z,60,25
"Broomfield, CO, USA",03-26-2020,Confirmed,10,,39.95998787,-105.0566324,USA,CO,03-26-2020.csv,Broomfield,08014,2020-03-26T23:48:35Z,64,282
"Broward, FL, USA",03-23-2020,Deaths,3,,26.15184651,-80.48725556,USA,FL,03-23-2020.csv,Broward,12011,2020-03-23T23:19:34Z,61,283
"Brown, IL, USA",03-23-2020,Deaths,0,,39.96209138,-90.75068024,USA,IL,03-23-2020.csv,Brown,17009,2020-03-23T23:19:34Z,61,284
"Brown, IN, USA",03-22-2020,Recovered,0,,39.19605589,-86.22868909,USA,IN,03-22-2020.csv,Brown,18013,2020-03-22T23:45:00Z,60,1571
"Brown, KS, USA",03-24-2020,Confirmed,0,,39.82652589,-95.56421698,USA,KS,03-24-2020.csv,Brown,20013,2020-03-24T23:37:31Z,62,286
"Brown, MN, USA",03-27-2020,Active,0,,44.24205652,-94.72562874,USA,MN,03-27-2020.csv,Brown,27015,2020-03-27T22:14:55Z,65,287
"Brown, NE, USA",03-30-2020,Deaths,0,,42.43018907,-99.92904055,USA,NE,03-30-2020.csv,Brown,31017,2020-03-30T22:52:45Z,68,288
"Brown, OH, USA",03-28-2020,Deaths,0,,38.93416837,-83.86788395,USA,OH,03-28-2020.csv,Brown,39015,2020-03-28T23:05:37Z,66,289
"Brown, SD, USA",03-22-2020,Active,1,,45.58994323,-98.35165355,USA,SD,03-22-2020.csv,Brown,46013,2020-03-22T23:45:00Z,60,1144
"Brown, TX, USA",03-30-2020,Deaths,0,,31.77430356,-98.99907113,USA,TX,03-30-2020.csv,Brown,48049,2020-03-30T22:52:45Z,68,291
"Brown, WI, USA",03-30-2020,Confirmed,7,,44.452655299999996,-88.00411844,USA,WI,03-30-2020.csv,Brown,55009,2020-03-30T22:52:45Z,68,292
"Brule, SD, USA",03-26-2020,Deaths,0,,43.71756379,-99.08118954,USA,SD,03-26-2020.csv,Brule,46015,2020-03-26T23:48:35Z,64,293
Brunei,03-24-2020,Deaths,0,,4.5353,114.7277,Brunei,,03-24-2020.csv,,,2020-03-24T23:37:15Z,62,3274
"Brunswick, NC, USA",03-24-2020,Confirmed,10,,34.070565,-78.22814204,USA,NC,03-24-2020.csv,Brunswick,37019,2020-03-24T23:37:31Z,62,294
"Brunswick, VA, USA",03-24-2020,Recovered,0,,36.76366949,-77.8593436,USA,VA,03-24-2020.csv,Brunswick,51025,2020-03-24T23:37:31Z,62,295
"Bryan, GA, USA",03-28-2020,Active,6,,32.00979311,-81.44002948,USA,GA,03-28-2020.csv,Bryan,13029,2020-03-28T23:05:37Z,66,296
"Bryan, OK, USA",03-28-2020,Recovered,0,,33.96472458,-96.25903472,USA,OK,03-28-2020.csv,Bryan,40013,2020-03-28T23:05:37Z,66,297
"Buchanan, IA, USA",03-29-2020,Active,2,,42.4709188,-91.83510825,USA,IA,03-29-2020.csv,Buchanan,19019,2020-03-29T23:08:25Z,67,298
"Buchanan, MO, USA",03-30-2020,Active,3,,39.65816401,-94.80138942,USA,MO,03-30-2020.csv,Buchanan,29021,2020-03-30T22:52:45Z,68,299
"Buchanan, VA, USA",03-25-2020,Confirmed,0,,37.26818323,-82.03749726,USA,VA,03-25-2020.csv,Buchanan,51027,2020-03-25T23:33:19Z,63,300
"Buckingham, VA, USA",03-28-2020,Deaths,0,,37.57242268,-78.52518834,USA,VA,03-28-2020.csv,Buckingham,51029,2020-03-28T23:05:37Z,66,301
"Bucks, PA, USA",03-23-2020,Active,43,,40.33682119,-75.10836643,USA,PA,03-23-2020.csv,Bucks,42017,2020-03-23T23:19:34Z,61,302
"Buena Vista, IA, USA",03-25-2020,Confirmed,0,,42.73545875,-95.15100162,USA,IA,03-25-2020.csv,Buena Vista,19021,2020-03-25T23:33:19Z,63,303
"Buena Vista, VA, USA",03-26-2020,Recovered,0,,37.73484642,-79.35296097,USA,VA,03-26-2020.csv,Buena Vista,51530,2020-03-26T23:48:35Z,64,304
"Buffalo, NE, USA",03-24-2020,Active,2,,40.85486962,-99.07500296,USA,NE,03-24-2020.csv,Buffalo,31019,2020-03-24T23:37:31Z,62,305
"Buffalo, SD, USA",03-27-2020,Recovered,0,,44.07657829,-99.20814467,USA,SD,03-27-2020.csv,Buffalo,46017,2020-03-27T22:14:55Z,65,306
"Buffalo, WI, USA",03-26-2020,Active,0,,44.37835084,-91.75332578,USA,WI,03-26-2020.csv,Buffalo,55011,2020-03-26T23:48:35Z,64,307
Bulgaria,03-08-2020,Active,4,,42.7339,25.4858,Bulgaria,,03-08-2020.csv,,,2020-03-08T11:13:17Z,46,124
"Bullitt, KY, USA",03-24-2020,Deaths,0,,37.97162523,-85.68955617,USA,KY,03-24-2020.csv,Bullitt,21029,2020-03-24T23:37:31Z,62,308
"Bulloch, GA, USA",03-23-2020,Active,0,,32.39577406,-81.74811421,USA,GA,03-23-2020.csv,Bulloch,13031,2020-03-23T23:19:34Z,61,309
"Bullock, AL, USA",03-28-2020,Active,3,,32.10030533,-85.71265535,USA,AL,03-28-2020.csv,Bullock,01011,2020-03-28T23:05:37Z,66,310
"Buncombe, NC, USA",03-26-2020,Active,15,,35.61113393,-82.53305,USA,NC,03-26-2020.csv,Buncombe,37021,2020-03-26T23:48:35Z,64,311
"Bureau, IL, USA",03-26-2020,Confirmed,0,,41.40385234,-89.5283051,USA,IL,03-26-2020.csv,Bureau,17011,2020-03-26T23:48:35Z,64,312
"Burke, GA, USA",03-30-2020,Deaths,0,,33.05917989,-81.99928721,USA,GA,03-30-2020.csv,Burke,13033,2020-03-30T22:52:45Z,68,313
"Burke, NC, USA",03-29-2020,Recovered,0,,35.74989637,-81.70755735,USA,NC,03-29-2020.csv,Burke,37023,2020-03-29T23:08:25Z,67,314
"Burke, ND, USA",03-26-2020,Recovered,0,,48.79094471,-102.51821170000001,USA,ND,03-26-2020.csv,Burke,38013,2020-03-26T23:48:35Z,64,315
Burkina Faso,03-10-2020,Active,1,,12.2383,-1.5616,Burkina Faso,,03-10-2020.csv,,,2020-03-10T05:33:02Z,48,171
"Burleigh, ND, USA",03-24-2020,Deaths,0,,46.97847375,-100.46452140000001,USA,ND,03-24-2020.csv,Burleigh,38015,2020-03-24T23:37:31Z,62,316
"Burleson, TX, USA",03-22-2020,Recovered,0,,30.49273808,-96.62158484,USA,TX,03-22-2020.csv,Burleson,48051,2020-03-22T23:45:00Z,60,2762
"Burlington, NJ, USA",03-24-2020,Confirmed,42,,39.87681124,-74.66927768,USA,NJ,03-24-2020.csv,Burlington,34005,2020-03-24T23:37:31Z,62,318
Burma,03-27-2020,Confirmed,8,,21.9162,95.956,Burma,,03-27-2020.csv,,,2020-03-27T23:23:03Z,65,3282
"Burnet, TX, USA",03-28-2020,Confirmed,1,,30.78801353,-98.181887,USA,TX,03-28-2020.csv,Burnet,48053,2020-03-28T23:05:37Z,66,319
"Burnett, WI, USA",03-27-2020,Confirmed,0,,45.86303537,-92.36711412,USA,WI,03-27-2020.csv,Burnett,55013,2020-03-27T22:14:55Z,65,320
"Burt, NE, USA",03-28-2020,Recovered,0,,41.85056773,-96.32605633,USA,NE,03-28-2020.csv,Burt,31021,2020-03-28T23:05:37Z,66,321
"Butler, AL, USA",03-30-2020,Deaths,0,,31.75300095,-86.68057478,USA,AL,03-30-2020.csv,Butler,01013,2020-03-30T22:52:45Z,68,322
"Butler, IA, USA",03-26-2020,Active,0,,42.73172833,-92.79015971,USA,IA,03-26-2020.csv,Butler,19023,2020-03-26T23:48:35Z,64,323
"Butler, KS, USA",03-23-2020,Active,3,,37.78134351,-96.83878537,USA,KS,03-23-2020.csv,Butler,20015,2020-03-23T23:19:34Z,61,324
"Butler, KY, USA",03-24-2020,Active,0,,37.20946153,-86.68748787,USA,KY,03-24-2020.csv,Butler,21031,2020-03-24T23:37:31Z,62,325
"Butler, MO, USA",03-28-2020,Active,0,,36.71462476,-90.40421163,USA,MO,03-28-2020.csv,Butler,29023,2020-03-28T23:05:37Z,66,326
"Butler, NE, USA",03-26-2020,Confirmed,0,,41.22703692,-97.13106306,USA,NE,03-26-2020.csv,Butler,31023,2020-03-26T23:48:35Z,64,327
"Butler, OH, USA",03-27-2020,Confirmed,23,,39.44012838,-84.57388716,USA,OH,03-27-2020.csv,Butler,39017,2020-03-27T22:14:55Z,65,328
"Butler, PA, USA",03-29-2020,Recovered,0,,40.91152759,-79.91351055,USA,PA,03-29-2020.csv,Butler,42019,2020-03-29T23:08:25Z,67,329
"Butte, CA, USA",03-24-2020,Active,2,,39.66727762,-121.6005252,USA,CA,03-24-2020.csv,Butte,06007,2020-03-24T23:37:31Z,62,330
"Butte, ID, USA",03-27-2020,Active,0,,43.72592209,-113.1735463,USA,ID,03-27-2020.csv,Butte,16023,2020-03-27T22:14:55Z,65,331
"Butte, SD, USA",03-25-2020,Deaths,0,,44.90608745,-103.5079318,USA,SD,03-25-2020.csv,Butte,46019,2020-03-25T23:33:19Z,63,332
"Butts, GA, USA",03-27-2020,Active,3,,33.283094500000004,-83.95435040000002,USA,GA,03-27-2020.csv,Butts,13035,2020-03-27T22:14:55Z,65,333
"CA, USA",03-15-2020,Active,414,,36.1162,-119.6816,USA,CA,03-15-2020.csv,,,2020-03-15T18:33:03Z,53,32
"Cabarrus, NC, USA",03-24-2020,Recovered,0,,35.3877799,-80.55267168,USA,NC,03-24-2020.csv,Cabarrus,37025,2020-03-24T23:37:31Z,62,334
"Cabell, WV, USA",03-29-2020,Recovered,0,,38.42424062,-82.23855912,USA,WV,03-29-2020.csv,Cabell,54011,2020-03-29T23:08:25Z,67,335
Cabo Verde,03-23-2020,Active,3,,16.5388,-23.0418,Cabo Verde,,03-23-2020.csv,,,2020-03-23T23:19:21Z,61,3278
"Cache, UT, USA",03-27-2020,Active,0,,41.72330587,-111.74436670000001,USA,UT,03-27-2020.csv,Cache,49005,2020-03-27T22:14:55Z,65,336
"Caddo, LA, USA",03-27-2020,Active,138,,32.57991587,-93.88375652,USA,LA,03-27-2020.csv,Caddo,22017,2020-03-27T22:14:55Z,65,337
"Caddo, OK, USA",03-28-2020,Active,1,,35.17364557,-98.37534464,USA,OK,03-28-2020.csv,Caddo,40015,2020-03-28T23:05:37Z,66,338
"Calaveras, CA, USA",03-25-2020,Recovered,0,,38.20537103,-120.55291299999999,USA,CA,03-25-2020.csv,Calaveras,06009,2020-03-25T23:33:19Z,63,339
"Calcasieu, LA, USA",03-27-2020,Active,21,,30.22931235,-93.35400434,USA,LA,03-27-2020.csv,Calcasieu,22019,2020-03-27T22:14:55Z,65,340
"Caldwell, KY, USA",03-30-2020,Deaths,0,,37.14749129,-87.86948214,USA,KY,03-30-2020.csv,Caldwell,21033,2020-03-30T22:52:45Z,68,341
"Caldwell, LA, USA",03-25-2020,Deaths,0,,32.0902519,-92.11752148,USA,LA,03-25-2020.csv,Caldwell,22021,2020-03-25T23:33:19Z,63,342
"Caldwell, MO, USA",03-28-2020,Active,0,,39.65620858,-93.98308093,USA,MO,03-28-2020.csv,Caldwell,29025,2020-03-28T23:05:37Z,66,343
"Caldwell, NC, USA",03-25-2020,Confirmed,3,,35.95204977,-81.54799522,USA,NC,03-25-2020.csv,Caldwell,37027,2020-03-25T23:33:19Z,63,344
"Caldwell, TX, USA",03-26-2020,Active,0,,29.83668859,-97.61814775,USA,TX,03-26-2020.csv,Caldwell,48055,2020-03-26T23:48:35Z,64,345
"Caledonia, VT, USA",03-26-2020,Confirmed,1,,44.46548598,-72.10314651,USA,VT,03-26-2020.csv,Caledonia,50005,2020-03-26T23:48:35Z,64,346
"Calgary, Alberta, Canada",03-06-2020,Confirmed,1,,51.0447,-114.0719,Canada,Alberta,03-06-2020.csv,Calgary,,2020-03-06T13:13:34Z,44,144
"Calhoun, AL, USA",03-29-2020,Deaths,0,,33.77483727,-85.82630386,USA,AL,03-29-2020.csv,Calhoun,01015,2020-03-29T23:08:25Z,67,347
"Calhoun, AR, USA",03-23-2020,Deaths,0,,33.55598792,-92.49974403,USA,AR,03-23-2020.csv,Calhoun,05013,2020-03-23T23:19:34Z,61,348
"Calhoun, FL, USA",03-26-2020,Deaths,0,,30.40666734,-85.19394153,USA,FL,03-26-2020.csv,Calhoun,12013,2020-03-26T23:48:35Z,64,349
"Calhoun, GA, USA",03-22-2020,Deaths,0,,31.53169785,-84.62725131,USA,GA,03-22-2020.csv,Calhoun,13037,2020-03-22T23:45:00Z,60,1373
"Calhoun, IA, USA",03-26-2020,Confirmed,0,,42.38521079,-94.64046046,USA,IA,03-26-2020.csv,Calhoun,19025,2020-03-26T23:48:35Z,64,352
"Calhoun, IL, USA",03-26-2020,Deaths,0,,39.16840183,-90.66330078,USA,IL,03-26-2020.csv,Calhoun,17013,2020-03-26T23:48:35Z,64,351
"Calhoun, MI, USA",03-23-2020,Confirmed,3,,42.24633834,-85.00493569,USA,MI,03-23-2020.csv,Calhoun,26025,2020-03-23T23:19:34Z,61,353
"Calhoun, MS, USA",03-28-2020,Active,3,,33.93683395,-89.33686647,USA,MS,03-28-2020.csv,Calhoun,28013,2020-03-28T23:05:37Z,66,354
"Calhoun, SC, USA",03-25-2020,Active,1,,33.66926881,-80.77722168,USA,SC,03-25-2020.csv,Calhoun,45017,2020-03-25T23:33:19Z,63,355
"Calhoun, TX, USA",03-23-2020,Deaths,0,,28.47048236,-96.61633945,USA,TX,03-23-2020.csv,Calhoun,48057,2020-03-23T23:19:34Z,61,356
"Calhoun, WV, USA",03-24-2020,Confirmed,0,,38.84315422,-81.11934872,USA,WV,03-24-2020.csv,Calhoun,54013,2020-03-24T23:37:31Z,62,357
"Callahan, TX, USA",03-23-2020,Active,0,,32.29760619,-99.37326312,USA,TX,03-23-2020.csv,Callahan,48059,2020-03-23T23:19:34Z,61,358
"Callaway, MO, USA",03-22-2020,Deaths,0,,38.83674754,-91.92186505,USA,MO,03-22-2020.csv,Callaway,29027,2020-03-22T23:45:00Z,60,2082
"Calloway, KY, USA",03-24-2020,Active,1,,36.62093411,-88.2731593,USA,KY,03-24-2020.csv,Calloway,21035,2020-03-24T23:37:31Z,62,360
"Calumet, WI, USA",03-26-2020,Active,1,,44.0816316,-88.21780273,USA,WI,03-26-2020.csv,Calumet,55015,2020-03-26T23:48:35Z,64,361
"Calvert, MD, USA",03-23-2020,Active,1,,38.53961642,-76.56820632,USA,MD,03-23-2020.csv,Calvert,24009,2020-03-23T23:19:34Z,61,362
"Camas, ID, USA",03-26-2020,Active,0,,43.46665742,-114.8065892,USA,ID,03-26-2020.csv,Camas,16025,2020-03-26T23:48:35Z,64,363
Cambodia,02-04-2020,Recovered,0,,,,Cambodia,,02-04-2020.csv,,,2020-01-31T08:15:53Z,13,56
"Cambria, PA, USA",03-27-2020,Active,1,,40.49527404,-78.71377428,USA,PA,03-27-2020.csv,Cambria,42021,2020-03-27T22:14:55Z,65,364
"Camden, GA, USA",03-27-2020,Deaths,0,,30.92951916,-81.66601818,USA,GA,03-27-2020.csv,Camden,13039,2020-03-27T22:14:55Z,65,365
"Camden, MO, USA",03-25-2020,Confirmed,1,,38.02199522,-92.76083747,USA,MO,03-25-2020.csv,Camden,29029,2020-03-25T23:33:19Z,63,366
"Camden, NC, USA",03-27-2020,Deaths,0,,36.33804939,-76.15568396,USA,NC,03-27-2020.csv,Camden,37029,2020-03-27T22:14:55Z,65,368
"Camden, NJ, USA",03-29-2020,Active,162,,39.80343818,-74.96388753,USA,NJ,03-29-2020.csv,Camden,34007,2020-03-29T23:08:25Z,67,367
"Cameron, LA, USA",03-26-2020,Active,0,,29.87592238,-93.19310676,USA,LA,03-26-2020.csv,Cameron,22023,2020-03-26T23:48:35Z,64,369
"Cameron, PA, USA",03-30-2020,Deaths,0,,41.43625568,-78.20376845,USA,PA,03-30-2020.csv,Cameron,42023,2020-03-30T22:52:45Z,68,370
"Cameron, TX, USA",03-30-2020,Confirmed,20,,26.14524221,-97.48140372,USA,TX,03-30-2020.csv,Cameron,48061,2020-03-30T22:52:45Z,68,371
Cameroon,03-18-2020,Deaths,0,,3.8480,11.5021,Cameroon,,03-18-2020.csv,,,2020-03-17T15:53:13Z,56,199
"Camp, TX, USA",03-27-2020,Deaths,0,,32.97195142,-94.97790104,USA,TX,03-27-2020.csv,Camp,48063,2020-03-27T22:14:55Z,65,372
"Campbell, KY, USA",03-30-2020,Confirmed,4,,38.94384345,-84.37875208,USA,KY,03-30-2020.csv,Campbell,21037,2020-03-30T22:52:45Z,68,373
"Campbell, SD, USA",03-23-2020,Recovered,0,,45.77074915,-100.0510181,USA,SD,03-23-2020.csv,Campbell,46021,2020-03-23T23:19:34Z,61,374
"Campbell, TN, USA",03-24-2020,Confirmed,2,,36.40355516,-84.15108559999999,USA,TN,03-24-2020.csv,Campbell,47013,2020-03-24T23:37:31Z,62,375
"Campbell, VA, USA",03-23-2020,Active,0,,37.20553386,-79.09678609,USA,VA,03-23-2020.csv,Campbell,51031,2020-03-23T23:19:34Z,61,376
"Campbell, WY, USA",03-29-2020,Deaths,0,,44.24886082,-105.54744040000001,USA,WY,03-29-2020.csv,Campbell,56005,2020-03-29T23:08:25Z,67,377
"Canadian, OK, USA",03-22-2020,Confirmed,2,,35.5426055,-97.98465569,USA,OK,03-22-2020.csv,Canadian,40017,2020-03-22T23:45:00Z,60,1041
"Candler, GA, USA",03-26-2020,Recovered,0,,32.40209349,-82.07702563,USA,GA,03-26-2020.csv,Candler,13043,2020-03-26T23:48:35Z,64,379
"Cannon, TN, USA",03-29-2020,Recovered,0,,35.80990797,-86.05738983,USA,TN,03-29-2020.csv,Cannon,47015,2020-03-29T23:08:25Z,67,380
"Canyon, ID, USA",03-29-2020,Recovered,0,,43.61970148,-116.70954990000001,USA,ID,03-29-2020.csv,Canyon,16027,2020-03-29T23:08:25Z,67,381
"Cape Girardeau, MO, USA",03-23-2020,Recovered,0,,37.38489388,-89.6843587,USA,MO,03-23-2020.csv,Cape Girardeau,29031,2020-03-23T23:19:34Z,61,382
"Cape May, NJ, USA",03-27-2020,Recovered,0,,39.15008829,-74.80170244,USA,NJ,03-27-2020.csv,Cape May,34009,2020-03-27T22:14:55Z,65,383
Cape Verde,03-21-2020,Confirmed,1,,15.1111,-23.6167,Cape Verde,,03-21-2020.csv,,,2020-03-21T23:43:02Z,59,271
"Carbon, MT, USA",03-23-2020,Active,0,,45.22850116,-109.0274047,USA,MT,03-23-2020.csv,Carbon,30009,2020-03-23T23:19:34Z,61,384
"Carbon, PA, USA",03-28-2020,Confirmed,3,,40.91545395,-75.7068525,USA,PA,03-28-2020.csv,Carbon,42025,2020-03-28T23:05:37Z,66,385
"Carbon, UT, USA",03-24-2020,Active,0,,39.64834818,-110.58725120000001,USA,UT,03-24-2020.csv,Carbon,49007,2020-03-24T23:37:31Z,62,386
"Carbon, WY, USA",03-24-2020,Confirmed,2,,41.69357844,-106.9326084,USA,WY,03-24-2020.csv,Carbon,56007,2020-03-24T23:37:31Z,62,387
"Caribou, ID, USA",03-30-2020,Confirmed,0,,42.77149116,-111.5597683,USA,ID,03-30-2020.csv,Caribou,16029,2020-03-30T22:52:45Z,68,388
"Carlisle, KY, USA",03-27-2020,Active,0,,36.85372876,-88.96692220000001,USA,KY,03-27-2020.csv,Carlisle,21039,2020-03-27T22:14:55Z,65,389
"Carlton, MN, USA",03-30-2020,Recovered,0,,46.59180601,-92.67601019,USA,MN,03-30-2020.csv,Carlton,27017,2020-03-30T22:52:45Z,68,390
"Caroline, MD, USA",03-29-2020,Active,3,,38.87172293,-75.82904158,USA,MD,03-29-2020.csv,Caroline,24011,2020-03-29T23:08:25Z,67,391
"Caroline, VA, USA",03-22-2020,Recovered,0,,38.02679129,-77.34901405,USA,VA,03-22-2020.csv,Caroline,51033,2020-03-22T23:45:00Z,60,2977
"Carroll, AR, USA",03-25-2020,Active,0,,36.34038560000001,-93.54270261,USA,AR,03-25-2020.csv,Carroll,05015,2020-03-25T23:33:19Z,63,393
"Carroll, GA, USA",03-22-2020,Deaths,0,,33.58138199,-85.07976677,USA,GA,03-22-2020.csv,Carroll,13045,2020-03-22T23:45:00Z,60,367
"Carroll, IA, USA",03-26-2020,Active,1,,42.03617207,-94.86032705,USA,IA,03-26-2020.csv,Carroll,19027,2020-03-26T23:48:35Z,64,397
"Carroll, IL, USA",03-24-2020,Recovered,0,,42.06823429,-89.93395545,USA,IL,03-24-2020.csv,Carroll,17015,2020-03-24T23:37:31Z,62,395
"Carroll, IN, USA",03-25-2020,Deaths,0,,40.580783200000006,-86.56198812,USA,IN,03-25-2020.csv,Carroll,18015,2020-03-25T23:33:19Z,63,396
"Carroll, KY, USA",03-25-2020,Recovered,0,,38.66599534,-85.12601074,USA,KY,03-25-2020.csv,Carroll,21041,2020-03-25T23:33:19Z,63,398
"Carroll, MD, USA",03-25-2020,Confirmed,5,,39.56453592,-77.02373735,USA,MD,03-25-2020.csv,Carroll,24013,2020-03-25T23:33:19Z,63,399
"Carroll, MO, USA",03-28-2020,Active,0,,39.42762566,-93.50626255,USA,MO,03-28-2020.csv,Carroll,29033,2020-03-28T23:05:37Z,66,401
"Carroll, MS, USA",03-24-2020,Confirmed,0,,33.44834567,-89.91994479,USA,MS,03-24-2020.csv,Carroll,28015,2020-03-24T23:37:31Z,62,400
"Carroll, NH, USA",03-26-2020,Recovered,0,,43.87498583,-71.20430216,USA,NH,03-26-2020.csv,Carroll,33003,2020-03-26T23:48:35Z,64,402
"Carroll, OH, USA",03-28-2020,Deaths,0,,40.578968599999996,-81.09178213,USA,OH,03-28-2020.csv,Carroll,39019,2020-03-28T23:05:37Z,66,403
"Carroll, TN, USA",03-28-2020,Deaths,0,,35.97366108,-88.45189331,USA,TN,03-28-2020.csv,Carroll,47017,2020-03-28T23:05:37Z,66,404
"Carroll, VA, USA",03-27-2020,Deaths,0,,36.73066666,-80.73455942,USA,VA,03-27-2020.csv,Carroll,51035,2020-03-27T22:14:55Z,65,405
"Carson City, NV, USA",03-26-2020,Confirmed,2,,39.15509045,-119.7480219,USA,NV,03-26-2020.csv,Carson City,32510,2020-03-26T23:48:35Z,64,407
"Carson, TX, USA",03-29-2020,Active,0,,35.40365929,-101.35426690000001,USA,TX,03-29-2020.csv,Carson,48065,2020-03-29T23:08:25Z,67,406
"Carter, KY, USA",03-23-2020,Confirmed,0,,38.31690743,-83.05092385,USA,KY,03-23-2020.csv,Carter,21043,2020-03-23T23:19:34Z,61,408
"Carter, MO, USA",03-26-2020,Deaths,0,,36.94160441,-90.96051322,USA,MO,03-26-2020.csv,Carter,29035,2020-03-26T23:48:35Z,64,409
"Carter, MT, USA",03-23-2020,Confirmed,0,,45.5197966,-104.53955359999999,USA,MT,03-23-2020.csv,Carter,30011,2020-03-23T23:19:34Z,61,410
"Carter, OK, USA",03-24-2020,Deaths,0,,34.25103751,-97.28552485,USA,OK,03-24-2020.csv,Carter,40019,2020-03-24T23:37:31Z,62,411
"Carter, TN, USA",03-30-2020,Recovered,0,,36.28969086,-82.12588974,USA,TN,03-30-2020.csv,Carter,47019,2020-03-30T22:52:45Z,68,412
"Carteret, NC, USA",03-23-2020,Active,5,,34.8932941,-76.54120135,USA,NC,03-23-2020.csv,Carteret,37031,2020-03-23T23:19:34Z,61,413
"Carver, MN, USA",03-29-2020,Active,9,,44.82017001,-93.80099179999999,USA,MN,03-29-2020.csv,Carver,27019,2020-03-29T23:08:25Z,67,414
"Cascade, MT, USA",03-28-2020,Deaths,0,,47.30797024,-111.3467922,USA,MT,03-28-2020.csv,Cascade,30013,2020-03-28T23:05:37Z,66,415
"Casey, KY, USA",03-24-2020,Confirmed,0,,37.32533118,-84.92726209,USA,KY,03-24-2020.csv,Casey,21045,2020-03-24T23:37:31Z,62,416
"Cass, IA, USA",03-23-2020,Confirmed,0,,41.33149454,-94.92792482,USA,IA,03-23-2020.csv,Cass,19029,2020-03-23T23:19:34Z,61,419
"Cass, IL, USA",03-25-2020,Confirmed,0,,39.96991073,-90.24734436,USA,IL,03-25-2020.csv,Cass,17017,2020-03-25T23:33:19Z,63,417
"Cass, IN, USA",03-28-2020,Deaths,0,,40.76135835,-86.34830753,USA,IN,03-28-2020.csv,Cass,18017,2020-03-28T23:05:37Z,66,418
"Cass, MI, USA",03-28-2020,Active,2,,41.91522292,-85.99405727,USA,MI,03-28-2020.csv,Cass,26027,2020-03-28T23:05:37Z,66,420
"Cass, MN, USA",03-24-2020,Confirmed,1,,46.95043611,-94.32603968,USA,MN,03-24-2020.csv,Cass,27021,2020-03-24T23:37:31Z,62,421
"Cass, MO, USA",03-30-2020,Active,9,,38.64789422,-94.353399,USA,MO,03-30-2020.csv,Cass,29037,2020-03-30T22:52:45Z,68,422
"Cass, ND, USA",03-24-2020,Confirmed,3,,46.93201724,-97.24447190000001,USA,ND,03-24-2020.csv,Cass,38017,2020-03-24T23:37:31Z,62,424
"Cass, NE, USA",03-22-2020,Active,1,,40.90899107,-96.13971217,USA,NE,03-22-2020.csv,Cass,31025,2020-03-22T23:45:00Z,60,1096
"Cass, TX, USA",03-23-2020,Deaths,0,,33.07499881,-94.34646905,USA,TX,03-23-2020.csv,Cass,48067,2020-03-23T23:19:34Z,61,425
"Cassia, ID, USA",03-29-2020,Active,1,,42.28347888,-113.6012409,USA,ID,03-29-2020.csv,Cassia,16031,2020-03-29T23:08:25Z,67,426
"Castro, TX, USA",03-22-2020,Confirmed,2,,34.53016752,-102.2617243,USA,TX,03-22-2020.csv,Castro,48069,2020-03-22T23:45:00Z,60,330
"Caswell, NC, USA",03-24-2020,Active,0,,36.39312665,-79.33353281,USA,NC,03-24-2020.csv,Caswell,37033,2020-03-24T23:37:31Z,62,428
"Catahoula, LA, USA",03-24-2020,Active,0,,31.66778967,-91.84526385,USA,LA,03-24-2020.csv,Catahoula,22025,2020-03-24T23:37:31Z,62,429
"Catawba, NC, USA",03-30-2020,Recovered,0,,35.66211129,-81.2132617,USA,NC,03-30-2020.csv,Catawba,37035,2020-03-30T22:52:45Z,68,430
"Catoosa, GA, USA",03-30-2020,Recovered,0,,34.89872298,-85.13757014,USA,GA,03-30-2020.csv,Catoosa,13047,2020-03-30T22:52:45Z,68,431
"Catron, NM, USA",03-29-2020,Active,0,,33.91514144,-108.4046587,USA,NM,03-29-2020.csv,Catron,35003,2020-03-29T23:08:25Z,67,432
"Cattaraugus, NY, USA",03-28-2020,Active,1,,42.24778241,-78.67923096,USA,NY,03-28-2020.csv,Cattaraugus,36009,2020-03-28T23:05:37Z,66,433
"Cavalier, ND, USA",03-26-2020,Deaths,0,,48.77286211,-98.46685243,USA,ND,03-26-2020.csv,Cavalier,38019,2020-03-26T23:48:35Z,64,434
Cayman Islands,03-15-2020,Active,1,,19.3133,-81.2546,Cayman Islands,,03-15-2020.csv,,,2020-03-13T12:33:03Z,53,223
"Cayman Islands, United Kingdom",03-22-2020,Recovered,0,,19.3133,-81.2546,United Kingdom,Cayman Islands,03-22-2020.csv,,,2020-03-22T23:45:00Z,60,3373
"Cayuga, NY, USA",03-30-2020,Deaths,0,,42.91261714,-76.55731592,USA,NY,03-30-2020.csv,Cayuga,36011,2020-03-30T22:52:45Z,68,435
"Cecil, MD, USA",03-25-2020,Active,4,,39.56647682,-75.94627411,USA,MD,03-25-2020.csv,Cecil,24015,2020-03-25T23:33:19Z,63,436
"Cedar, IA, USA",03-26-2020,Deaths,0,,41.77233777,-91.13246684,USA,IA,03-26-2020.csv,Cedar,19031,2020-03-26T23:48:35Z,64,437
"Cedar, MO, USA",03-23-2020,Recovered,0,,37.72391475,-93.85445441,USA,MO,03-23-2020.csv,Cedar,29039,2020-03-23T23:19:34Z,61,438
"Cedar, NE, USA",03-27-2020,Recovered,0,,42.598885100000004,-97.25311951,USA,NE,03-27-2020.csv,Cedar,31027,2020-03-27T22:14:55Z,65,439
Central African Republic,03-18-2020,Recovered,0,,6.6111,20.9394,Central African Republic,,03-18-2020.csv,,,2020-03-16T03:33:03Z,56,251
"Centre, PA, USA",03-22-2020,Recovered,0,,40.92058903,-77.82200624,USA,PA,03-22-2020.csv,Centre,42027,2020-03-22T23:45:00Z,60,473
"Cerro Gordo, IA, USA",03-23-2020,Deaths,0,,43.08177563,-93.2612239,USA,IA,03-23-2020.csv,Cerro Gordo,19033,2020-03-23T23:19:34Z,61,441
Chad,03-22-2020,Recovered,0,,15.4542,18.7322,Chad,,03-22-2020.csv,,,2020-03-22T23:45:00Z,60,3399
"Chaffee, CO, USA",03-23-2020,Confirmed,3,,38.74745778,-106.19265729999998,USA,CO,03-23-2020.csv,Chaffee,08015,2020-03-23T23:19:34Z,61,442
"Chambers, AL, USA",03-29-2020,Confirmed,27,,32.91360079,-85.39072749,USA,AL,03-29-2020.csv,Chambers,01017,2020-03-29T23:08:25Z,67,443
"Chambers, TX, USA",03-25-2020,Active,1,,29.70972016,-94.67154501,USA,TX,03-25-2020.csv,Chambers,48071,2020-03-25T23:33:19Z,63,444
"Champaign, IL, USA",03-25-2020,Recovered,0,,40.13919438,-88.20046615,USA,IL,03-25-2020.csv,Champaign,17019,2020-03-25T23:33:19Z,63,445
"Champaign, OH, USA",03-23-2020,Deaths,0,,40.13923427,-83.76875242,USA,OH,03-23-2020.csv,Champaign,39021,2020-03-23T23:19:34Z,61,446
Channel Islands,03-10-2020,Recovered,0,,49.3723,-2.3644,Channel Islands,,03-10-2020.csv,,,2020-03-10T05:33:02Z,48,172
"Channel Islands, United Kingdom",03-16-2020,Recovered,0,,49.3723,-2.3644,United Kingdom,Channel Islands,03-16-2020.csv,,,2020-03-16T14:38:45Z,54,198
"Chariton, MO, USA",03-30-2020,Confirmed,3,,39.51499357,-92.9629191,USA,MO,03-30-2020.csv,Chariton,29041,2020-03-30T22:52:45Z,68,447
"Charles City, VA, USA",03-26-2020,Active,1,,37.35358063,-77.05634116,USA,VA,03-26-2020.csv,Charles City,51036,2020-03-26T23:48:35Z,64,449
"Charles Mix, SD, USA",03-26-2020,Confirmed,1,,43.20660134,-98.58856175,USA,SD,03-26-2020.csv,Charles Mix,46023,2020-03-26T23:48:35Z,64,450
"Charles, MD, USA",03-23-2020,Recovered,0,,38.51092331,-76.98580666,USA,MD,03-23-2020.csv,Charles,24017,2020-03-23T23:19:34Z,61,448
"Charleston, SC, USA",03-25-2020,Recovered,0,,32.82487866,-79.96512315,USA,SC,03-25-2020.csv,Charleston,45019,2020-03-25T23:33:19Z,63,451
"Charlevoix, MI, USA",03-22-2020,Deaths,0,,45.37790017,-85.19614053,USA,MI,03-22-2020.csv,Charlevoix,26029,2020-03-22T23:45:00Z,60,181
"Charlotte, FL, USA",03-24-2020,Deaths,0,,26.90131002,-81.92949121,USA,FL,03-24-2020.csv,Charlotte,12015,2020-03-24T23:37:31Z,62,453
"Charlotte, VA, USA",03-27-2020,Confirmed,0,,37.01909701,-78.66314092,USA,VA,03-27-2020.csv,Charlotte,51037,2020-03-27T22:14:55Z,65,454
"Charlottesville, VA, USA",03-26-2020,Deaths,0,,38.03527919,-78.48569588,USA,VA,03-26-2020.csv,Charlottesville,51540,2020-03-26T23:48:35Z,64,455
"Charlton, GA, USA",03-28-2020,Recovered,0,,30.78371028,-82.13951596,USA,GA,03-28-2020.csv,Charlton,13049,2020-03-28T23:05:37Z,66,456
"Chase, KS, USA",03-30-2020,Active,0,,38.30292938,-96.59563862,USA,KS,03-30-2020.csv,Chase,20017,2020-03-30T22:52:45Z,68,457
"Chase, NE, USA",03-22-2020,Active,0,,40.5237198,-101.6978026,USA,NE,03-22-2020.csv,Chase,31029,2020-03-22T23:45:00Z,60,2226
"Chatham, GA, USA",03-22-2020,Recovered,0,,32.00043026,-81.12489526,USA,GA,03-22-2020.csv,Chatham,13051,2020-03-22T23:45:00Z,60,383
"Chatham, NC, USA",03-28-2020,Recovered,0,,35.70394416,-79.25541492,USA,NC,03-28-2020.csv,Chatham,37037,2020-03-28T23:05:37Z,66,460
"Chattahoochee, GA, USA",03-23-2020,Recovered,0,,32.34341231,-84.78809239,USA,GA,03-23-2020.csv,Chattahoochee,13053,2020-03-23T23:19:34Z,61,461
"Chattooga, GA, USA",03-27-2020,Confirmed,1,,34.47197698,-85.34535662,USA,GA,03-27-2020.csv,Chattooga,13055,2020-03-27T22:14:55Z,65,462
"Chautauqua, KS, USA",03-26-2020,Active,0,,37.14994405,-96.2454192,USA,KS,03-26-2020.csv,Chautauqua,20019,2020-03-26T23:48:35Z,64,463
"Chautauqua, NY, USA",03-28-2020,Deaths,0,,42.22769210000001,-79.36691763,USA,NY,03-28-2020.csv,Chautauqua,36013,2020-03-28T23:05:37Z,66,464
"Chaves, NM, USA",03-30-2020,Deaths,0,,33.36406072,-104.4665365,USA,NM,03-30-2020.csv,Chaves,35005,2020-03-30T22:52:45Z,68,465
"Cheatham, TN, USA",03-24-2020,Active,5,,36.26136216,-87.08903581,USA,TN,03-24-2020.csv,Cheatham,47021,2020-03-24T23:37:31Z,62,466
"Cheboygan, MI, USA",03-30-2020,Active,1,,45.44787015,-84.50122149,USA,MI,03-30-2020.csv,Cheboygan,26031,2020-03-30T22:52:45Z,68,467
"Chelan, WA, USA",03-23-2020,Recovered,0,,47.87046092,-120.6173956,USA,WA,03-23-2020.csv,Chelan,53007,2020-03-23T23:19:34Z,61,468
"Chemung, NY, USA",03-28-2020,Recovered,0,,42.13891056,-76.7638805,USA,NY,03-28-2020.csv,Chemung,36015,2020-03-28T23:05:37Z,66,469
"Chenango, NY, USA",03-25-2020,Confirmed,3,,42.49430041,-75.60887553,USA,NY,03-25-2020.csv,Chenango,36017,2020-03-25T23:33:19Z,63,470
"Cherokee, AL, USA",03-25-2020,Confirmed,1,,34.17805983,-85.60638968,USA,AL,03-25-2020.csv,Cherokee,01019,2020-03-25T23:33:19Z,63,471
"Cherokee, GA, USA",03-22-2020,Recovered,0,,34.24393976,-84.47431861,USA,GA,03-22-2020.csv,Cherokee,13057,2020-03-22T23:45:00Z,60,365
"Cherokee, IA, USA",03-23-2020,Confirmed,0,,42.73538914,-95.62389402,USA,IA,03-23-2020.csv,Cherokee,19035,2020-03-23T23:19:34Z,61,473
"Cherokee, KS, USA",03-23-2020,Confirmed,2,,37.16928494,-94.8462897,USA,KS,03-23-2020.csv,Cherokee,20021,2020-03-23T23:19:34Z,61,474
"Cherokee, NC, USA",03-22-2020,Deaths,0,,35.1349263,-84.05970864,USA,NC,03-22-2020.csv,Cherokee,37039,2020-03-22T23:45:00Z,60,619
"Cherokee, OK, USA",03-28-2020,Active,1,,35.90692775,-94.99980896,USA,OK,03-28-2020.csv,Cherokee,40021,2020-03-28T23:05:37Z,66,476
"Cherokee, SC, USA",03-23-2020,Confirmed,0,,35.05122251,-81.61828622,USA,SC,03-23-2020.csv,Cherokee,45021,2020-03-23T23:19:34Z,61,477
"Cherokee, TX, USA",03-24-2020,Deaths,0,,31.837258000000002,-95.16559897,USA,TX,03-24-2020.csv,Cherokee,48073,2020-03-24T23:37:31Z,62,478
"Cherry, NE, USA",03-24-2020,Deaths,0,,42.54502621,-101.1244332,USA,NE,03-24-2020.csv,Cherry,31031,2020-03-24T23:37:31Z,62,479
"Chesapeake, VA, USA",03-25-2020,Active,3,,36.67670048,-76.30545744,USA,VA,03-25-2020.csv,Chesapeake,51550,2020-03-25T23:33:19Z,63,480
"Cheshire, NH, USA",03-22-2020,Recovered,0,,42.92015988,-72.25311043,USA,NH,03-22-2020.csv,Cheshire,33005,2020-03-22T23:45:00Z,60,1032
"Chester, PA, USA",03-22-2020,Active,23,,39.97291773,-75.74768357,USA,PA,03-22-2020.csv,Chester,42029,2020-03-22T23:45:00Z,60,455
"Chester, SC, USA",03-28-2020,Deaths,0,,34.69249168,-81.1583216,USA,SC,03-28-2020.csv,Chester,45023,2020-03-28T23:05:37Z,66,483
"Chester, TN, USA",03-25-2020,Recovered,0,,35.42527478,-88.6095842,USA,TN,03-25-2020.csv,Chester,47023,2020-03-25T23:33:19Z,63,484
"Chesterfield, SC, USA",03-24-2020,Deaths,0,,34.64137396,-80.15640140000002,USA,SC,03-24-2020.csv,Chesterfield,45025,2020-03-24T23:37:31Z,62,485
"Chesterfield, VA, USA",03-26-2020,Recovered,0,,37.37373208,-77.58680140000001,USA,VA,03-26-2020.csv,Chesterfield,51041,2020-03-26T23:48:35Z,64,486
"Cheyenne, CO, USA",03-25-2020,Recovered,0,,38.82777431,-102.6032558,USA,CO,03-25-2020.csv,Cheyenne,08017,2020-03-25T23:33:19Z,63,487
"Cheyenne, KS, USA",03-28-2020,Recovered,0,,39.78580976,-101.7318201,USA,KS,03-28-2020.csv,Cheyenne,20023,2020-03-28T23:05:37Z,66,488
"Cheyenne, NE, USA",03-28-2020,Recovered,0,,41.21999357,-102.9941693,USA,NE,03-28-2020.csv,Cheyenne,31033,2020-03-28T23:05:37Z,66,489
"Chickasaw, IA, USA",03-25-2020,Deaths,0,,43.06001295,-92.31773347,USA,IA,03-25-2020.csv,Chickasaw,19037,2020-03-25T23:33:19Z,63,490
"Chickasaw, MS, USA",03-29-2020,Confirmed,10,,33.91983202,-88.9481545,USA,MS,03-29-2020.csv,Chickasaw,28017,2020-03-29T23:08:25Z,67,491
"Chicot, AR, USA",03-23-2020,Confirmed,0,,33.26458973,-91.29539209,USA,AR,03-23-2020.csv,Chicot,05017,2020-03-23T23:19:34Z,61,492
"Childress, TX, USA",03-22-2020,Deaths,0,,34.5293041,-100.2077916,USA,TX,03-22-2020.csv,Childress,48075,2020-03-22T23:45:00Z,60,2770
Chile,03-09-2020,Recovered,0,,-35.6751,-71.5430,Chile,,03-09-2020.csv,,,2020-03-08T15:43:03Z,47,104
"Chilton, AL, USA",03-26-2020,Recovered,0,,32.85044126,-86.7173256,USA,AL,03-26-2020.csv,Chilton,01021,2020-03-26T23:48:35Z,64,494
"Chippewa, MI, USA",03-24-2020,Deaths,0,,46.29552653,-84.54353449,USA,MI,03-24-2020.csv,Chippewa,26033,2020-03-24T23:37:31Z,62,495
"Chippewa, MN, USA",03-24-2020,Active,0,,45.02343421,-95.56403693,USA,MN,03-24-2020.csv,Chippewa,27023,2020-03-24T23:37:31Z,62,496
"Chippewa, WI, USA",03-28-2020,Confirmed,4,,45.06939744,-91.28068855,USA,WI,03-28-2020.csv,Chippewa,55017,2020-03-28T23:05:37Z,66,497
"Chisago, MN, USA",03-25-2020,Confirmed,2,,45.5021011,-92.90861945,USA,MN,03-25-2020.csv,Chisago,27025,2020-03-25T23:33:19Z,63,498
"Chittenden, VT, USA",03-30-2020,Confirmed,117,,44.46322849,-73.08359212,USA,VT,03-30-2020.csv,Chittenden,50007,2020-03-30T22:52:45Z,68,499
"Choctaw, AL, USA",03-22-2020,Confirmed,0,,32.02227341,-88.2656443,USA,AL,03-22-2020.csv,Choctaw,1023,2020-03-22T23:45:00Z,60,1168
"Choctaw, MS, USA",03-25-2020,Confirmed,3,,33.34598242,-89.24809382,USA,MS,03-25-2020.csv,Choctaw,28019,2020-03-25T23:33:19Z,63,501
"Choctaw, OK, USA",03-30-2020,Confirmed,1,,34.02807439,-95.54771129,USA,OK,03-30-2020.csv,Choctaw,40023,2020-03-30T22:52:45Z,68,502
"Chongqing, China",03-12-2020,Recovered,564,,30.0572,107.8740,China,Chongqing,03-12-2020.csv,,,2020-03-12T23:44:32Z,50,21
"Chouteau, MT, USA",03-30-2020,Active,0,,47.88084126,-110.4353362,USA,MT,03-30-2020.csv,Chouteau,30015,2020-03-30T22:52:45Z,68,503
"Chowan, NC, USA",03-25-2020,Active,0,,36.12908077,-76.60118385,USA,NC,03-25-2020.csv,Chowan,37041,2020-03-25T23:33:19Z,63,504
"Christian, IL, USA",03-30-2020,Recovered,0,,39.54581621,-89.27780482,USA,IL,03-30-2020.csv,Christian,17021,2020-03-30T22:52:45Z,68,505
"Christian, KY, USA",03-23-2020,Active,2,,36.89267803,-87.49055367,USA,KY,03-23-2020.csv,Christian,21047,2020-03-23T23:19:34Z,61,506
"Christian, MO, USA",03-24-2020,Active,2,,36.9711783,-93.18537118,USA,MO,03-24-2020.csv,Christian,29043,2020-03-24T23:37:31Z,62,507
"Churchill, NV, USA",03-29-2020,Recovered,0,,39.58105744,-118.3394607,USA,NV,03-29-2020.csv,Churchill,32001,2020-03-29T23:08:25Z,67,508
"Cibola, NM, USA",03-29-2020,Deaths,0,,34.91131525,-107.998876,USA,NM,03-29-2020.csv,Cibola,35006,2020-03-29T23:08:25Z,67,509
"Cimarron, OK, USA",03-30-2020,Deaths,0,,36.74817177,-102.5173885,USA,OK,03-30-2020.csv,Cimarron,40025,2020-03-30T22:52:45Z,68,510
"Citrus, FL, USA",03-25-2020,Active,9,,28.84804315,-82.47614748,USA,FL,03-25-2020.csv,Citrus,12017,2020-03-25T23:33:19Z,63,511
"Clackamas, OR, USA",03-23-2020,Recovered,0,,45.18787398,-122.2179634,USA,OR,03-23-2020.csv,Clackamas,41005,2020-03-23T23:19:34Z,61,512
"Claiborne, LA, USA",03-30-2020,Confirmed,4,,32.82308512,-92.99526883,USA,LA,03-30-2020.csv,Claiborne,22027,2020-03-30T22:52:45Z,68,513
"Claiborne, MS, USA",03-24-2020,Confirmed,0,,31.97061673,-90.90702196,USA,MS,03-24-2020.csv,Claiborne,28021,2020-03-24T23:37:31Z,62,514
"Claiborne, TN, USA",03-28-2020,Deaths,0,,36.48319149,-83.65947309,USA,TN,03-28-2020.csv,Claiborne,47025,2020-03-28T23:05:37Z,66,515
"Clallam, WA, USA",03-24-2020,Recovered,0,,48.04754642,-123.92263190000001,USA,WA,03-24-2020.csv,Clallam,53009,2020-03-24T23:37:31Z,62,516
"Clare, MI, USA",03-28-2020,Recovered,0,,43.98794227,-84.84819859999998,USA,MI,03-28-2020.csv,Clare,26035,2020-03-28T23:05:37Z,66,517
"Clarendon, SC, USA",03-28-2020,Deaths,1,,33.66610974,-80.21647898,USA,SC,03-28-2020.csv,Clarendon,45027,2020-03-28T23:05:37Z,66,518
"Clarion, PA, USA",03-30-2020,Recovered,0,,41.19265812,-79.42413524,USA,PA,03-30-2020.csv,Clarion,42031,2020-03-30T22:52:45Z,68,519
"Clark, AR, USA",03-23-2020,Confirmed,7,,34.04613432,-93.17484713,USA,AR,03-23-2020.csv,Clark,05019,2020-03-23T23:19:34Z,61,520
"Clark, ID, USA",03-26-2020,Deaths,0,,44.28496071,-112.35057040000001,USA,ID,03-26-2020.csv,Clark,16033,2020-03-26T23:48:35Z,64,521
"Clark, IL, USA",03-25-2020,Active,0,,39.33425789,-87.78705622,USA,IL,03-25-2020.csv,Clark,17023,2020-03-25T23:33:19Z,63,522
"Clark, IN, USA",03-26-2020,Confirmed,10,,38.48015445,-85.70510334,USA,IN,03-26-2020.csv,Clark,18019,2020-03-26T23:48:35Z,64,523
"Clark, KS, USA",03-25-2020,Active,0,,37.23577007,-99.81883015,USA,KS,03-25-2020.csv,Clark,20025,2020-03-25T23:33:19Z,63,524
"Clark, KY, USA",03-30-2020,Recovered,0,,37.9689263,-84.14615986,USA,KY,03-30-2020.csv,Clark,21049,2020-03-30T22:52:45Z,68,525
"Clark, MO, USA",03-23-2020,Confirmed,0,,40.41040752,-91.73661677,USA,MO,03-23-2020.csv,Clark,29045,2020-03-23T23:19:34Z,61,526
"Clark, NV, USA",03-28-2020,Deaths,10,,36.21458855,-115.0130241,USA,NV,03-28-2020.csv,Clark,32003,2020-03-28T23:05:37Z,66,527
"Clark, OH, USA",03-28-2020,Recovered,0,,39.91592258,-83.78498252,USA,OH,03-28-2020.csv,Clark,39023,2020-03-28T23:05:37Z,66,528
"Clark, SD, USA",03-23-2020,Active,0,,44.85834507,-97.72925109,USA,SD,03-23-2020.csv,Clark,46025,2020-03-23T23:19:34Z,61,529
"Clark, WA, USA",03-28-2020,Confirmed,82,,45.77568046,-122.48292040000001,USA,WA,03-28-2020.csv,Clark,53011,2020-03-28T23:05:37Z,66,530
"Clark, WI, USA",03-22-2020,Recovered,0,,44.73483377,-90.61207486,USA,WI,03-22-2020.csv,Clark,55019,2020-03-22T23:45:00Z,60,3121
"Clarke, AL, USA",03-22-2020,Active,0,,31.68099859,-87.83548597,USA,AL,03-22-2020.csv,Clarke,1025,2020-03-22T23:45:00Z,60,1169
"Clarke, GA, USA",03-28-2020,Active,33,,33.95436462,-83.37124007,USA,GA,03-28-2020.csv,Clarke,13059,2020-03-28T23:05:37Z,66,533
"Clarke, IA, USA",03-27-2020,Recovered,0,,41.02868181,-93.78499767,USA,IA,03-27-2020.csv,Clarke,19039,2020-03-27T22:14:55Z,65,534
"Clarke, MS, USA",03-23-2020,Active,0,,32.04158545,-88.68896219999998,USA,MS,03-23-2020.csv,Clarke,28023,2020-03-23T23:19:34Z,61,535
"Clarke, VA, USA",03-22-2020,Recovered,0,,39.11271747,-77.99199425,USA,VA,03-22-2020.csv,Clarke,51043,2020-03-22T23:45:00Z,60,2981
"Clatsop, OR, USA",03-28-2020,Active,3,,45.99712889,-123.660711,USA,OR,03-28-2020.csv,Clatsop,41007,2020-03-28T23:05:37Z,66,537
"Clay, AL, USA",03-22-2020,Deaths,0,,33.26984193,-85.85836077,USA,AL,03-22-2020.csv,Clay,1027,2020-03-22T23:45:00Z,60,1170
"Clay, AR, USA",03-27-2020,Recovered,0,,36.36826212,-90.4148172,USA,AR,03-27-2020.csv,Clay,05021,2020-03-27T22:14:55Z,65,539
"Clay, FL, USA",03-22-2020,Active,6,,29.98319144,-81.85609986,USA,FL,03-22-2020.csv,Clay,12019,2020-03-22T23:45:00Z,60,221
"Clay, GA, USA",03-25-2020,Active,0,,31.62221166,-84.97713865,USA,GA,03-25-2020.csv,Clay,13061,2020-03-25T23:33:19Z,63,541
"Clay, IA, USA",03-26-2020,Confirmed,0,,43.08247182,-95.15096481,USA,IA,03-26-2020.csv,Clay,19041,2020-03-26T23:48:35Z,64,544
"Clay, IL, USA",03-28-2020,Active,0,,38.75388572,-88.48914513,USA,IL,03-28-2020.csv,Clay,17025,2020-03-28T23:05:37Z,66,542
"Clay, IN, USA",03-27-2020,Confirmed,0,,39.39561833,-87.11723506,USA,IN,03-27-2020.csv,Clay,18021,2020-03-27T22:14:55Z,65,543
"Clay, KS, USA",03-22-2020,Recovered,0,,39.34948772,-97.16518128,USA,KS,03-22-2020.csv,Clay,20027,2020-03-22T23:45:00Z,60,1707
"Clay, KY, USA",03-25-2020,Recovered,0,,37.16451126,-83.712575,USA,KY,03-25-2020.csv,Clay,21051,2020-03-25T23:33:19Z,63,546
"Clay, MN, USA",03-23-2020,Active,2,,46.89289518,-96.48761922,USA,MN,03-23-2020.csv,Clay,27027,2020-03-23T23:19:34Z,61,547
"Clay, MO, USA",03-24-2020,Deaths,0,,39.31132056,-94.41850862,USA,MO,03-24-2020.csv,Clay,29047,2020-03-24T23:37:31Z,62,549
"Clay, MS, USA",03-30-2020,Confirmed,2,,33.65358105,-88.77784255,USA,MS,03-30-2020.csv,Clay,28025,2020-03-30T22:52:45Z,68,548
"Clay, NC, USA",03-26-2020,Active,0,,35.05704275,-83.74353633,USA,NC,03-26-2020.csv,Clay,37043,2020-03-26T23:48:35Z,64,551
"Clay, NE, USA",03-28-2020,Confirmed,0,,40.52439441,-98.05126296,USA,NE,03-28-2020.csv,Clay,31035,2020-03-28T23:05:37Z,66,550
"Clay, SD, USA",03-24-2020,Active,0,,42.91296147,-96.97656917,USA,SD,03-24-2020.csv,Clay,46027,2020-03-24T23:37:31Z,62,552
"Clay, TN, USA",03-25-2020,Confirmed,0,,36.55151008,-85.53930419,USA,TN,03-25-2020.csv,Clay,47027,2020-03-25T23:33:19Z,63,553
"Clay, TX, USA",03-22-2020,Active,0,,33.78686685,-98.20771198,USA,TX,03-22-2020.csv,Clay,48077,2020-03-22T23:45:00Z,60,2771
"Clay, WV, USA",03-23-2020,Confirmed,0,,38.46231092,-81.07652217,USA,WV,03-23-2020.csv,Clay,54015,2020-03-23T23:19:34Z,61,555
"Clayton, GA, USA",03-28-2020,Deaths,1,,33.54187245,-84.35594188,USA,GA,03-28-2020.csv,Clayton,13063,2020-03-28T23:05:37Z,66,556
"Clayton, IA, USA",03-23-2020,Recovered,0,,42.84443388,-91.34133693,USA,IA,03-23-2020.csv,Clayton,19043,2020-03-23T23:19:34Z,61,557
"Clear Creek, CO, USA",03-23-2020,Confirmed,3,,39.68864463,-105.6463118,USA,CO,03-23-2020.csv,Clear Creek,08019,2020-03-23T23:19:34Z,61,558
"Clearfield, PA, USA",03-22-2020,Deaths,0,,41.00110782,-78.47592663,USA,PA,03-22-2020.csv,Clearfield,42033,2020-03-22T23:45:00Z,60,2593
"Clearwater, ID, USA",03-26-2020,Recovered,0,,46.67459924,-115.6622393,USA,ID,03-26-2020.csv,Clearwater,16035,2020-03-26T23:48:35Z,64,560
"Clearwater, MN, USA",03-29-2020,Deaths,0,,47.57992111,-95.37790562,USA,MN,03-29-2020.csv,Clearwater,27029,2020-03-29T23:08:25Z,67,561
"Cleburne, AL, USA",03-23-2020,Deaths,0,,33.67679204,-85.52005899,USA,AL,03-23-2020.csv,Cleburne,01029,2020-03-23T23:19:34Z,61,562
"Cleburne, AR, USA",03-23-2020,Confirmed,27,,35.53864922,-92.02640019,USA,AR,03-23-2020.csv,Cleburne,05023,2020-03-23T23:19:34Z,61,563
"Clermont, OH, USA",03-30-2020,Active,9,,39.04847534,-84.15375786,USA,OH,03-30-2020.csv,Clermont,39025,2020-03-30T22:52:45Z,68,564
"Cleveland, AR, USA",03-30-2020,Active,5,,33.89723187,-92.18537045,USA,AR,03-30-2020.csv,Cleveland,05025,2020-03-30T22:52:45Z,68,565
"Cleveland, NC, USA",03-23-2020,Deaths,0,,35.33553364,-81.55204486,USA,NC,03-23-2020.csv,Cleveland,37045,2020-03-23T23:19:34Z,61,566
"Cleveland, OK, USA",03-29-2020,Active,46,,35.20413532,-97.32519562,USA,OK,03-29-2020.csv,Cleveland,40027,2020-03-29T23:08:25Z,67,567
"Clinch, GA, USA",03-23-2020,Active,1,,30.91395822,-82.70432472,USA,GA,03-23-2020.csv,Clinch,13065,2020-03-23T23:19:34Z,61,568
"Clinton, IA, USA",03-23-2020,Active,0,,41.89981633,-90.53275096,USA,IA,03-23-2020.csv,Clinton,19045,2020-03-23T23:19:34Z,61,571
"Clinton, IL, USA",03-24-2020,Deaths,0,,38.60704876,-89.42385254,USA,IL,03-24-2020.csv,Clinton,17027,2020-03-24T23:37:31Z,62,569
"Clinton, IN, USA",03-25-2020,Active,0,,40.30319754,-86.47277257,USA,IN,03-25-2020.csv,Clinton,18023,2020-03-25T23:33:19Z,63,570
"Clinton, KY, USA",03-30-2020,Recovered,0,,36.72581156,-85.13377529,USA,KY,03-30-2020.csv,Clinton,21053,2020-03-30T22:52:45Z,68,572
"Clinton, MI, USA",03-27-2020,Recovered,0,,42.94400871,-84.60145248,USA,MI,03-27-2020.csv,Clinton,26037,2020-03-27T22:14:55Z,65,573
"Clinton, MO, USA",03-29-2020,Deaths,0,,39.6013098,-94.40465394,USA,MO,03-29-2020.csv,Clinton,29049,2020-03-29T23:08:25Z,67,574
"Clinton, NY, USA",03-26-2020,Confirmed,11,,44.74530905,-73.67875352,USA,NY,03-26-2020.csv,Clinton,36019,2020-03-26T23:48:35Z,64,575
"Clinton, OH, USA",03-30-2020,Confirmed,3,,39.41485808,-83.80852286,USA,OH,03-30-2020.csv,Clinton,39027,2020-03-30T22:52:45Z,68,576
"Clinton, PA, USA",03-23-2020,Active,0,,41.23255967,-77.63785995,USA,PA,03-23-2020.csv,Clinton,42035,2020-03-23T23:19:34Z,61,577
"Cloud, KS, USA",03-30-2020,Active,0,,39.48028352,-97.64925343,USA,KS,03-30-2020.csv,Cloud,20029,2020-03-30T22:52:45Z,68,578
"CO, USA",03-15-2020,Active,130,,39.0598,-105.3111,USA,CO,03-15-2020.csv,,,2020-03-14T22:13:32Z,53,74
"Coahoma, MS, USA",03-27-2020,Recovered,0,,34.22772299,-90.60415045,USA,MS,03-27-2020.csv,Coahoma,28027,2020-03-27T22:14:55Z,65,579
"Coal, OK, USA",03-28-2020,Active,0,,34.58840127,-96.29798747,USA,OK,03-28-2020.csv,Coal,40029,2020-03-28T23:05:37Z,66,580
"Cobb, GA, USA",03-27-2020,Active,142,,33.94243204,-84.5761255,USA,GA,03-27-2020.csv,Cobb,13067,2020-03-27T22:14:55Z,65,581
"Cochise, AZ, USA",03-25-2020,Active,1,,31.87934684,-109.7516088,USA,AZ,03-25-2020.csv,Cochise,04003,2020-03-25T23:33:19Z,63,582
"Cochran, TX, USA",03-25-2020,Deaths,0,,33.60425307,-102.82844990000001,USA,TX,03-25-2020.csv,Cochran,48079,2020-03-25T23:33:19Z,63,583
"Cocke, TN, USA",03-25-2020,Active,1,,35.9278914,-83.11828725,USA,TN,03-25-2020.csv,Cocke,47029,2020-03-25T23:33:19Z,63,584
"Coconino, AZ, USA",03-22-2020,Deaths,0,,35.83883429,-111.7707178,USA,AZ,03-22-2020.csv,Coconino,4005,2020-03-22T23:45:00Z,60,942
"Codington, SD, USA",03-26-2020,Recovered,0,,44.97788119,-97.18827677,USA,SD,03-26-2020.csv,Codington,46029,2020-03-26T23:48:35Z,64,586
"Coffee, AL, USA",03-28-2020,Deaths,0,,31.39932826,-85.98901039,USA,AL,03-28-2020.csv,Coffee,01031,2020-03-28T23:05:37Z,66,587
"Coffee, GA, USA",03-24-2020,Active,2,,31.54892966,-82.85492059999999,USA,GA,03-24-2020.csv,Coffee,13069,2020-03-24T23:37:31Z,62,588
"Coffee, TN, USA",03-27-2020,Recovered,0,,35.49090731,-86.07311784,USA,TN,03-27-2020.csv,Coffee,47031,2020-03-27T22:14:55Z,65,589
"Coffey, KS, USA",03-25-2020,Recovered,0,,38.2365018,-95.73379515,USA,KS,03-25-2020.csv,Coffey,20031,2020-03-25T23:33:19Z,63,590
"Coke, TX, USA",03-28-2020,Confirmed,0,,31.88911733,-100.5297533,USA,TX,03-28-2020.csv,Coke,48081,2020-03-28T23:05:37Z,66,591
"Colbert, AL, USA",03-29-2020,Deaths,0,,34.69847452,-87.80168544,USA,AL,03-29-2020.csv,Colbert,01033,2020-03-29T23:08:25Z,67,592
"Cole, MO, USA",03-28-2020,Recovered,0,,38.50455671,-92.27860244,USA,MO,03-28-2020.csv,Cole,29051,2020-03-28T23:05:37Z,66,593
"Coleman, TX, USA",03-23-2020,Recovered,0,,31.76736834,-99.45240766,USA,TX,03-23-2020.csv,Coleman,48083,2020-03-23T23:19:34Z,61,594
"Coles, IL, USA",03-28-2020,Confirmed,0,,39.51949084,-88.22358557,USA,IL,03-28-2020.csv,Coles,17029,2020-03-28T23:05:37Z,66,595
"Colfax, NE, USA",03-27-2020,Deaths,0,,41.57486951,-97.0868542,USA,NE,03-27-2020.csv,Colfax,31037,2020-03-27T22:14:55Z,65,596
"Colfax, NM, USA",03-27-2020,Deaths,0,,36.60569702,-104.64726740000002,USA,NM,03-27-2020.csv,Colfax,35007,2020-03-27T22:14:55Z,65,597
"Colleton, SC, USA",03-23-2020,Recovered,0,,32.87582989,-80.67641292,USA,SC,03-23-2020.csv,Colleton,45029,2020-03-23T23:19:34Z,61,598
"Collier, FL, USA",03-29-2020,Confirmed,95,,26.11091986,-81.34687065,USA,FL,03-29-2020.csv,Collier,12021,2020-03-29T23:08:25Z,67,599
"Collin, TX, USA",03-25-2020,Deaths,1,,33.18820114,-96.57264368,USA,TX,03-25-2020.csv,Collin,48085,2020-03-25T23:33:19Z,63,600
"Collingsworth, TX, USA",03-29-2020,Recovered,0,,34.96489496,-100.27001109999999,USA,TX,03-29-2020.csv,Collingsworth,48087,2020-03-29T23:08:25Z,67,601
Colombia,03-23-2020,Confirmed,277,,4.5709,-74.2973,Colombia,,03-23-2020.csv,,,2020-03-23T23:19:21Z,61,3284
"Colonial Heights, VA, USA",03-26-2020,Confirmed,0,,37.26420587,-77.39609676,USA,VA,03-26-2020.csv,Colonial Heights,51570,2020-03-26T23:48:35Z,64,602
"Colorado, TX, USA",03-22-2020,Confirmed,0,,29.622098,-96.5273805,USA,TX,03-22-2020.csv,Colorado,48089,2020-03-22T23:45:00Z,60,2776
"Colquitt, GA, USA",03-26-2020,Active,4,,31.18810588,-83.7677946,USA,GA,03-26-2020.csv,Colquitt,13071,2020-03-26T23:48:35Z,64,604
"Columbia, AR, USA",03-26-2020,Active,1,,33.21230701,-93.22642793,USA,AR,03-26-2020.csv,Columbia,05027,2020-03-26T23:48:35Z,64,605
"Columbia, FL, USA",03-25-2020,Active,3,,30.22509788,-82.62160164,USA,FL,03-25-2020.csv,Columbia,12023,2020-03-25T23:33:19Z,63,606
"Columbia, GA, USA",03-29-2020,Deaths,0,,33.54534185,-82.263524,USA,GA,03-29-2020.csv,Columbia,13073,2020-03-29T23:08:25Z,67,607
"Columbia, NY, USA",03-26-2020,Deaths,0,,42.24819348,-73.63089095,USA,NY,03-26-2020.csv,Columbia,36021,2020-03-26T23:48:35Z,64,608
"Columbia, OR, USA",03-22-2020,Recovered,0,,45.94464254,-123.0890898,USA,OR,03-22-2020.csv,Columbia,41009,2020-03-22T23:45:00Z,60,2568
"Columbia, PA, USA",03-27-2020,Confirmed,3,,41.04821986,-76.40565017,USA,PA,03-27-2020.csv,Columbia,42037,2020-03-27T22:14:55Z,65,610
"Columbia, WA, USA",03-22-2020,Recovered,0,,46.29442881,-117.9051983,USA,WA,03-22-2020.csv,Columbia,53013,2020-03-22T23:45:00Z,60,68
"Columbia, WI, USA",03-28-2020,Active,7,,43.46492199,-89.33589004,USA,WI,03-28-2020.csv,Columbia,55021,2020-03-28T23:05:37Z,66,612
"Columbiana, OH, USA",03-26-2020,Recovered,0,,40.76932373,-80.78094576,USA,OH,03-26-2020.csv,Columbiana,39029,2020-03-26T23:48:35Z,64,613
"Columbus, NC, USA",03-27-2020,Confirmed,0,,34.26744084,-78.65801424,USA,NC,03-27-2020.csv,Columbus,37047,2020-03-27T22:14:55Z,65,614
"Colusa, CA, USA",03-26-2020,Active,0,,39.17881957,-122.2331726,USA,CA,03-26-2020.csv,Colusa,06011,2020-03-26T23:48:35Z,64,615
"Comal, TX, USA",03-30-2020,Active,9,,29.80811278,-98.27647225,USA,TX,03-30-2020.csv,Comal,48091,2020-03-30T22:52:45Z,68,616
"Comanche, KS, USA",03-27-2020,Active,0,,37.19114520000001,-99.27113247,USA,KS,03-27-2020.csv,Comanche,20033,2020-03-27T22:14:55Z,65,617
"Comanche, OK, USA",03-29-2020,Recovered,0,,34.65973764,-98.47195055,USA,OK,03-29-2020.csv,Comanche,40031,2020-03-29T23:08:25Z,67,618
"Comanche, TX, USA",03-25-2020,Deaths,0,,31.94854689,-98.55876441,USA,TX,03-25-2020.csv,Comanche,48093,2020-03-25T23:33:19Z,63,619
"Concho, TX, USA",03-27-2020,Confirmed,0,,31.32635934,-99.86473038,USA,TX,03-27-2020.csv,Concho,48095,2020-03-27T22:14:55Z,65,620
"Concordia, LA, USA",03-24-2020,Active,0,,31.44817835,-91.63814433,USA,LA,03-24-2020.csv,Concordia,22029,2020-03-24T23:37:31Z,62,621
"Conecuh, AL, USA",03-23-2020,Confirmed,0,,31.43401703,-86.99320044,USA,AL,03-23-2020.csv,Conecuh,01035,2020-03-23T23:19:34Z,61,622
"Conejos, CO, USA",03-27-2020,Confirmed,0,,37.201606,-106.19174879999998,USA,CO,03-27-2020.csv,Conejos,08021,2020-03-27T22:14:55Z,65,623
Congo (Brazzaville),03-19-2020,Active,3,,-0.2280,15.8277,Congo (Brazzaville),,03-19-2020.csv,,,2020-03-19T20:13:56Z,57,233
Congo (Kinshasa),03-19-2020,Confirmed,14,,-4.0383,21.7587,Congo (Kinshasa),,03-19-2020.csv,,,2020-03-19T10:53:03Z,57,192
"Contra Costa, CA, USA",03-06-2020,Active,3,,37.8534,-121.9018,USA,CA,03-06-2020.csv,Contra Costa,,2020-03-06T19:43:02Z,44,110
"Converse, WY, USA",03-23-2020,Active,0,,42.97272268,-105.5081848,USA,WY,03-23-2020.csv,Converse,56009,2020-03-23T23:19:34Z,61,625
"Conway, AR, USA",03-25-2020,Active,1,,35.26205537,-92.70506566,USA,AR,03-25-2020.csv,Conway,05029,2020-03-25T23:33:19Z,63,626
"Cook, GA, USA",03-22-2020,Recovered,0,,31.16068491,-83.42947229,USA,GA,03-22-2020.csv,Cook,13075,2020-03-22T23:45:00Z,60,1381
"Cook, IL, USA",02-22-2020,Confirmed,2,,,,USA,IL,02-22-2020.csv,Cook,,2020-02-09T19:03:03Z,31,59
"Cook, MN, USA",03-27-2020,Deaths,0,,47.90504893,-90.52629546,USA,MN,03-27-2020.csv,Cook,27031,2020-03-27T22:14:55Z,65,629
"Cooke, TX, USA",03-30-2020,Confirmed,0,,33.63979567,-97.21240912,USA,TX,03-30-2020.csv,Cooke,48097,2020-03-30T22:52:45Z,68,630
"Cooper, MO, USA",03-24-2020,Confirmed,0,,38.844478,-92.80896081,USA,MO,03-24-2020.csv,Cooper,29053,2020-03-24T23:37:31Z,62,631
"Coos, NH, USA",03-26-2020,Confirmed,0,,44.69063265,-71.30633239,USA,NH,03-26-2020.csv,Coos,33007,2020-03-26T23:48:35Z,64,632
"Coos, OR, USA",03-23-2020,Deaths,0,,43.17406868,-124.0594514,USA,OR,03-23-2020.csv,Coos,41011,2020-03-23T23:19:34Z,61,633
"Coosa, AL, USA",03-30-2020,Confirmed,3,,32.93690146,-86.24847739,USA,AL,03-30-2020.csv,Coosa,01037,2020-03-30T22:52:45Z,68,634
"Copiah, MS, USA",03-29-2020,Confirmed,8,,31.86977774,-90.44565118,USA,MS,03-29-2020.csv,Copiah,28029,2020-03-29T23:08:25Z,67,635
"Corson, SD, USA",03-26-2020,Recovered,0,,45.70889983,-101.1970473,USA,SD,03-26-2020.csv,Corson,46031,2020-03-26T23:48:35Z,64,636
"Cortland, NY, USA",03-29-2020,Deaths,0,,42.59509207,-76.07048931,USA,NY,03-29-2020.csv,Cortland,36023,2020-03-29T23:08:25Z,67,637
"Coryell, TX, USA",03-24-2020,Deaths,0,,31.39078397,-97.79936155,USA,TX,03-24-2020.csv,Coryell,48099,2020-03-24T23:37:31Z,62,638
"Coshocton, OH, USA",03-29-2020,Active,4,,40.30096166,-81.91729018,USA,OH,03-29-2020.csv,Coshocton,39031,2020-03-29T23:08:25Z,67,639
Costa Rica,03-21-2020,Recovered,2,,9.7489,-83.7534,Costa Rica,,03-21-2020.csv,,,2020-03-21T20:43:02Z,59,125
"Costilla, CO, USA",03-28-2020,Active,1,,37.27732493,-105.4276548,USA,CO,03-28-2020.csv,Costilla,08023,2020-03-28T23:05:37Z,66,640
Cote d'Ivoire,03-13-2020,Recovered,0,,7.54,-5.5471,Cote d'Ivoire,,03-13-2020.csv,,,2020-03-11T20:00:00Z,51,145
"Cottle, TX, USA",03-30-2020,Recovered,0,,34.07783319,-100.27850620000001,USA,TX,03-30-2020.csv,Cottle,48101,2020-03-30T22:52:45Z,68,641
"Cotton, OK, USA",03-27-2020,Active,0,,34.28845626,-98.37053567,USA,OK,03-27-2020.csv,Cotton,40033,2020-03-27T22:14:55Z,65,642
"Cottonwood, MN, USA",03-26-2020,Active,0,,44.00715262,-95.18138802,USA,MN,03-26-2020.csv,Cottonwood,27033,2020-03-26T23:48:35Z,64,643
"Covington, AL, USA",03-27-2020,Deaths,0,,31.247785399999998,-86.45050893,USA,AL,03-27-2020.csv,Covington,01039,2020-03-27T22:14:55Z,65,644
"Covington, MS, USA",03-24-2020,Recovered,0,,31.63225413,-89.55389939,USA,MS,03-24-2020.csv,Covington,28031,2020-03-24T23:37:31Z,62,645
"Covington, VA, USA",03-26-2020,Active,0,,37.7824656,-79.98631446,USA,VA,03-26-2020.csv,Covington,51580,2020-03-26T23:48:35Z,64,646
"Coweta, GA, USA",03-23-2020,Confirmed,9,,33.35334302,-84.76129976,USA,GA,03-23-2020.csv,Coweta,13077,2020-03-23T23:19:34Z,61,647
"Cowley, KS, USA",03-28-2020,Recovered,0,,37.23781842,-96.83776647,USA,KS,03-28-2020.csv,Cowley,20035,2020-03-28T23:05:37Z,66,648
"Cowlitz, WA, USA",03-24-2020,Active,3,,46.19074721,-122.6782231,USA,WA,03-24-2020.csv,Cowlitz,53015,2020-03-24T23:37:31Z,62,649
"Craig, OK, USA",03-30-2020,Active,1,,36.76268118,-95.20916602,USA,OK,03-30-2020.csv,Craig,40035,2020-03-30T22:52:45Z,68,650
"Craig, VA, USA",03-28-2020,Confirmed,0,,37.48133648,-80.21072274,USA,VA,03-28-2020.csv,Craig,51045,2020-03-28T23:05:37Z,66,651
"Craighead, AR, USA",03-27-2020,Confirmed,4,,35.83018283,-90.63235729,USA,AR,03-27-2020.csv,Craighead,05031,2020-03-27T22:14:55Z,65,652
"Crane, TX, USA",03-26-2020,Active,1,,31.43052248,-102.5143314,USA,TX,03-26-2020.csv,Crane,48103,2020-03-26T23:48:35Z,64,653
"Craven, NC, USA",03-29-2020,Deaths,0,,35.11833364,-77.08398081,USA,NC,03-29-2020.csv,Craven,37049,2020-03-29T23:08:25Z,67,654
"Crawford, AR, USA",03-23-2020,Deaths,0,,35.58928601,-94.2446814,USA,AR,03-23-2020.csv,Crawford,05033,2020-03-23T23:19:34Z,61,655
"Crawford, GA, USA",03-26-2020,Deaths,0,,32.71391813,-83.98061238,USA,GA,03-26-2020.csv,Crawford,13079,2020-03-26T23:48:35Z,64,656
"Crawford, IA, USA",03-27-2020,Confirmed,0,,42.03718237,-95.3819718,USA,IA,03-27-2020.csv,Crawford,19047,2020-03-27T22:14:55Z,65,659
"Crawford, IL, USA",03-23-2020,Deaths,0,,39.0032229,-87.75954624,USA,IL,03-23-2020.csv,Crawford,17033,2020-03-23T23:19:34Z,61,657
"Crawford, IN, USA",03-24-2020,Recovered,0,,38.28814402,-86.44518825,USA,IN,03-24-2020.csv,Crawford,18025,2020-03-24T23:37:31Z,62,658
"Crawford, KS, USA",03-27-2020,Active,3,,37.50675523,-94.85245778,USA,KS,03-27-2020.csv,Crawford,20037,2020-03-27T22:14:55Z,65,660
"Crawford, MI, USA",03-29-2020,Recovered,0,,44.68255561,-84.61006219,USA,MI,03-29-2020.csv,Crawford,26039,2020-03-29T23:08:25Z,67,661
"Crawford, MO, USA",03-24-2020,Active,0,,37.97663738,-91.30528104,USA,MO,03-24-2020.csv,Crawford,29055,2020-03-24T23:37:31Z,62,662
"Crawford, OH, USA",03-30-2020,Confirmed,5,,40.85065156,-82.91989099,USA,OH,03-30-2020.csv,Crawford,39033,2020-03-30T22:52:45Z,68,663
"Crawford, PA, USA",03-29-2020,Active,3,,41.68447709,-80.10760592,USA,PA,03-29-2020.csv,Crawford,42039,2020-03-29T23:08:25Z,67,664
"Crawford, WI, USA",03-28-2020,Active,0,,43.23870316,-90.93073686,USA,WI,03-28-2020.csv,Crawford,55023,2020-03-28T23:05:37Z,66,665
"Creek, OK, USA",03-26-2020,Confirmed,10,,35.90230551,-96.37086028,USA,OK,03-26-2020.csv,Creek,40037,2020-03-26T23:48:35Z,64,666
"Crenshaw, AL, USA",03-22-2020,Confirmed,0,,31.72941803,-86.31593104,USA,AL,03-22-2020.csv,Crenshaw,1041,2020-03-22T23:45:00Z,60,1177
"Crisp, GA, USA",03-29-2020,Deaths,0,,31.92289565,-83.76811843,USA,GA,03-29-2020.csv,Crisp,13081,2020-03-29T23:08:25Z,67,668
"Crittenden, AR, USA",03-26-2020,Active,7,,35.21247318,-90.30839406,USA,AR,03-26-2020.csv,Crittenden,05035,2020-03-26T23:48:35Z,64,669
"Crittenden, KY, USA",03-26-2020,Recovered,0,,37.35839237,-88.08826090000002,USA,KY,03-26-2020.csv,Crittenden,21055,2020-03-26T23:48:35Z,64,670
Croatia,02-29-2020,Recovered,0,,,,Croatia,,02-29-2020.csv,,,2020-02-29T18:03:05Z,38,60
"Crockett, TN, USA",03-24-2020,Deaths,0,,35.81830662,-89.14916269,USA,TN,03-24-2020.csv,Crockett,47033,2020-03-24T23:37:31Z,62,671
"Crockett, TX, USA",03-26-2020,Recovered,0,,30.72367027,-101.4134238,USA,TX,03-26-2020.csv,Crockett,48105,2020-03-26T23:48:35Z,64,672
"Crook, OR, USA",03-27-2020,Active,0,,44.14230227,-120.356297,USA,OR,03-27-2020.csv,Crook,41013,2020-03-27T22:14:55Z,65,673
"Crook, WY, USA",03-28-2020,Deaths,0,,44.58855102,-104.56977049999999,USA,WY,03-28-2020.csv,Crook,56011,2020-03-28T23:05:37Z,66,674
"Crosby, TX, USA",03-29-2020,Recovered,0,,33.61431553,-101.30003640000001,USA,TX,03-29-2020.csv,Crosby,48107,2020-03-29T23:08:25Z,67,675
"Cross, AR, USA",03-22-2020,Active,0,,35.29631396,-90.77185818,USA,AR,03-22-2020.csv,Cross,5037,2020-03-22T23:45:00Z,60,1245
"Crow Wing, MN, USA",03-25-2020,Confirmed,0,,46.48096553,-94.06755609,USA,MN,03-25-2020.csv,Crow Wing,27035,2020-03-25T23:33:19Z,63,677
"Crowley, CO, USA",03-30-2020,Recovered,0,,38.32608609,-103.7844965,USA,CO,03-30-2020.csv,Crowley,08025,2020-03-30T22:52:45Z,68,678
"Cruise Ship, Others",02-07-2020,Recovered,0,,,,Others,Cruise Ship,02-07-2020.csv,,,2020-02-07T16:33:03Z,16,26
"CT, USA",03-20-2020,Recovered,0,,41.5978,-72.7554,USA,CT,03-20-2020.csv,,,2020-03-20T21:13:29Z,58,84
Cuba,03-30-2020,Deaths,4,,21.521757,-77.78116700000002,Cuba,,03-30-2020.csv,,,2020-03-30T22:52:33Z,68,3304
"Culberson, TX, USA",03-30-2020,Active,0,,31.44506775,-104.5185739,USA,TX,03-30-2020.csv,Culberson,48109,2020-03-30T22:52:45Z,68,679
"Cullman, AL, USA",03-24-2020,Active,3,,34.13020303,-86.86888037,USA,AL,03-24-2020.csv,Cullman,01043,2020-03-24T23:37:31Z,62,680
"Culpeper, VA, USA",03-30-2020,Active,3,,38.48199985,-77.95630870000002,USA,VA,03-30-2020.csv,Culpeper,51047,2020-03-30T22:52:45Z,68,681
"Cumberland, IL, USA",03-26-2020,Deaths,0,,39.27432424,-88.2401158,USA,IL,03-26-2020.csv,Cumberland,17035,2020-03-26T23:48:35Z,64,682
"Cumberland, KY, USA",03-22-2020,Recovered,0,,36.78926125,-85.39050034,USA,KY,03-22-2020.csv,Cumberland,21057,2020-03-22T23:45:00Z,60,1809
"Cumberland, ME, USA",03-22-2020,Deaths,0,,43.8370751,-70.37226999,USA,ME,03-22-2020.csv,Cumberland,23005,2020-03-22T23:45:00Z,60,1011
"Cumberland, NC, USA",03-22-2020,Confirmed,3,,35.04762133,-78.82623165,USA,NC,03-22-2020.csv,Cumberland,37051,2020-03-22T23:45:00Z,60,627
"Cumberland, NJ, USA",03-27-2020,Recovered,0,,39.37199394,-75.10712559,USA,NJ,03-27-2020.csv,Cumberland,34011,2020-03-27T22:14:55Z,65,685
"Cumberland, PA, USA",03-27-2020,Active,16,,40.1625372,-77.26130755,USA,PA,03-27-2020.csv,Cumberland,42041,2020-03-27T22:14:55Z,65,687
"Cumberland, TN, USA",03-23-2020,Active,2,,35.95271721,-84.99840585,USA,TN,03-23-2020.csv,Cumberland,47035,2020-03-23T23:19:34Z,61,688
"Cumberland, VA, USA",03-27-2020,Recovered,0,,37.51328851,-78.24398086,USA,VA,03-27-2020.csv,Cumberland,51049,2020-03-27T22:14:55Z,65,689
"Cuming, NE, USA",03-26-2020,Deaths,0,,41.91637624,-96.78730772,USA,NE,03-26-2020.csv,Cuming,31039,2020-03-26T23:48:35Z,64,690
Curacao,03-15-2020,Confirmed,1,,12.1696,-68.99,Curacao,,03-15-2020.csv,,,2020-03-14T16:15:18Z,53,228
"Curacao, Netherlands",03-30-2020,Recovered,2,,12.1696,-68.99,Netherlands,Curacao,03-30-2020.csv,,,2020-03-30T22:52:33Z,68,3191
"Currituck, NC, USA",03-29-2020,Deaths,0,,36.36123664,-75.95876401,USA,NC,03-29-2020.csv,Currituck,37053,2020-03-29T23:08:25Z,67,691
"Curry, NM, USA",03-23-2020,Confirmed,0,,34.57421077,-103.34688759999999,USA,NM,03-23-2020.csv,Curry,35009,2020-03-23T23:19:34Z,61,692
"Curry, OR, USA",03-24-2020,Recovered,0,,42.45911325,-124.15728200000001,USA,OR,03-24-2020.csv,Curry,41015,2020-03-24T23:37:31Z,62,693
"Custer, CO, USA",03-24-2020,Confirmed,0,,38.10883162,-105.3683478,USA,CO,03-24-2020.csv,Custer,08027,2020-03-24T23:37:31Z,62,694
"Custer, ID, USA",03-23-2020,Active,0,,44.24186819,-114.2855494,USA,ID,03-23-2020.csv,Custer,16037,2020-03-23T23:19:34Z,61,695
"Custer, MT, USA",03-25-2020,Deaths,0,,46.25319932,-105.57375259999998,USA,MT,03-25-2020.csv,Custer,30017,2020-03-25T23:33:19Z,63,696
"Custer, NE, USA",03-26-2020,Recovered,0,,41.39374521,-99.72805369,USA,NE,03-26-2020.csv,Custer,31041,2020-03-26T23:48:35Z,64,697
"Custer, OK, USA",03-30-2020,Recovered,0,,35.63853802,-99.00170785,USA,OK,03-30-2020.csv,Custer,40039,2020-03-30T22:52:45Z,68,698
"Custer, SD, USA",03-27-2020,Deaths,0,,43.67741105,-103.45345209999999,USA,SD,03-27-2020.csv,Custer,46033,2020-03-27T22:14:55Z,65,699
