Location Name Key,Date Reported,Attribute,Cumulative Value,Change Since Prior Day,Latitude,Longitude,Country or Region,Province or State,CSV File Name,USA State County,FIPS USA State County code,Last Updated UTC,File Number,Row Number
" Montreal, QC, Canada",03-05-2020,Active,2,,45.5017,-73.5673,Canada,QC,03-05-2020.csv,Montreal,,2020-03-05T14:03:04Z,43,107
" Norfolk, MA, USA",03-03-2020,Confirmed,1,,42.1767,-71.1449,USA,MA,03-03-2020.csv,Norfolk,,2020-03-03T14:33:03Z,41,129
"Abbeville, SC, USA",03-23-2020,Deaths,0,,34.22333378,-82.46170658,USA,SC,03-23-2020.csv,Abbeville,45001,2020-03-23T23:19:34Z,61,0
"Acadia, LA, USA",03-26-2020,Deaths,0,,30.295064899999996,-92.41419698,USA,LA,03-26-2020.csv,Acadia,22001,2020-03-26T23:48:35Z,64,1
"Accomack, VA, USA",03-29-2020,Active,3,,37.76707161,-75.63234615,USA,VA,03-29-2020.csv,Accomack,51001,2020-03-29T23:08:25Z,67,2
"Ada, ID, USA",03-24-2020,Deaths,0,,43.4526575,-116.24155159999998,USA,ID,03-24-2020.csv,Ada,16001,2020-03-24T23:37:31Z,62,3
"Adair, IA, USA",03-24-2020,Confirmed,1,,41.33075609,-94.47105874,USA,IA,03-24-2020.csv,Adair,19001,2020-03-24T23:37:31Z,62,4
"Adair, KY, USA",03-28-2020,Recovered,0,,37.10459774,-85.28129668,USA,KY,03-28-2020.csv,Adair,21001,2020-03-28T23:05:37Z,66,5
"Adair, MO, USA",03-28-2020,Active,1,,40.19058551,-92.60078167,USA,MO,03-28-2020.csv,Adair,29001,2020-03-28T23:05:37Z,66,6
"Adair, OK, USA",03-25-2020,Confirmed,2,,35.88494195,-94.65859267,USA,OK,03-25-2020.csv,Adair,40001,2020-03-25T23:33:19Z,63,7
"Adams, CO, USA",03-22-2020,Deaths,0,,39.87432092,-104.3362578,USA,CO,03-22-2020.csv,Adams,8001,2020-03-22T23:45:00Z,60,429
"Adams, IA, USA",03-22-2020,Recovered,0,,41.02903567,-94.69932645,USA,IA,03-22-2020.csv,Adams,19003,2020-03-22T23:45:00Z,60,1621
"Adams, ID, USA",03-26-2020,Confirmed,0,,44.89333571,-116.4545247,USA,ID,03-26-2020.csv,Adams,16003,2020-03-26T23:48:35Z,64,9
"Adams, IL, USA",03-26-2020,Confirmed,1,,39.98815591,-91.18786813,USA,IL,03-26-2020.csv,Adams,17001,2020-03-26T23:48:35Z,64,10
"Adams, IN, USA",03-22-2020,Active,1,,40.7457653,-84.93671406,USA,IN,03-22-2020.csv,Adams,18001,2020-03-22T23:45:00Z,60,782
"Adams, MS, USA",03-29-2020,Confirmed,7,,31.47669768,-91.35326037,USA,MS,03-29-2020.csv,Adams,28001,2020-03-29T23:08:25Z,67,13
"Adams, ND, USA",03-27-2020,Confirmed,0,,46.09686891,-102.5285397,USA,ND,03-27-2020.csv,Adams,38001,2020-03-27T22:14:55Z,65,15
"Adams, NE, USA",03-29-2020,Recovered,0,,40.52449420000001,-98.50117804,USA,NE,03-29-2020.csv,Adams,31001,2020-03-29T23:08:25Z,67,14
"Adams, OH, USA",03-26-2020,Active,0,,38.84541072,-83.4718964,USA,OH,03-26-2020.csv,Adams,39001,2020-03-26T23:48:35Z,64,16
"Adams, PA, USA",03-26-2020,Deaths,0,,39.87140411,-77.21610347,USA,PA,03-26-2020.csv,Adams,42001,2020-03-26T23:48:35Z,64,17
"Adams, WA, USA",03-22-2020,Active,0,,46.98299757,-118.5601734,USA,WA,03-22-2020.csv,Adams,53001,2020-03-22T23:45:00Z,60,3059
"Adams, WI, USA",03-27-2020,Recovered,0,,43.96974651,-89.76782777,USA,WI,03-27-2020.csv,Adams,55001,2020-03-27T22:14:55Z,65,19
"Addison, VT, USA",03-30-2020,Deaths,0,,44.03217337,-73.14130877,USA,VT,03-30-2020.csv,Addison,50001,2020-03-30T22:52:45Z,68,20
Afghanistan,03-14-2020,Active,11,,33.9391,67.7100,Afghanistan,,03-14-2020.csv,,,2020-03-14T14:53:04Z,52,151
"Aiken, SC, USA",03-23-2020,Active,1,,33.54338026,-81.63645384,USA,SC,03-23-2020.csv,Aiken,45003,2020-03-23T23:19:34Z,61,21
"Aitkin, MN, USA",03-28-2020,Active,0,,46.60962049,-93.41168259999999,USA,MN,03-28-2020.csv,Aitkin,27001,2020-03-28T23:05:37Z,66,22
"AK, USA",03-16-2020,Deaths,0,,61.3707,-152.4044,USA,AK,03-16-2020.csv,,,2020-03-13T14:53:03Z,54,264
"AL, USA",03-13-2020,Active,5,,32.3182,-86.9023,USA,AL,03-13-2020.csv,,,2020-03-11T20:00:00Z,51,139
"Alachua, FL, USA",03-22-2020,Confirmed,35,,29.67866525,-82.35928158,USA,FL,03-22-2020.csv,Alachua,12001,2020-03-22T23:45:00Z,60,206
"Alamance, NC, USA",03-27-2020,Active,5,,36.0434701,-79.39976137,USA,NC,03-27-2020.csv,Alamance,37001,2020-03-27T22:14:55Z,65,24
"Alameda, CA, USA",03-23-2020,Active,117,,37.64629437,-121.8929271,USA,CA,03-23-2020.csv,Alameda,06001,2020-03-23T23:19:34Z,61,25
"Alamosa, CO, USA",03-30-2020,Deaths,0,,37.57250606,-105.7885451,USA,CO,03-30-2020.csv,Alamosa,08003,2020-03-30T22:52:45Z,68,26
Albania,03-26-2020,Active,151,,41.1533,20.1683,Albania,,03-26-2020.csv,,,2020-03-26T23:48:18Z,64,3251
"Albany, NY, USA",03-25-2020,Confirmed,152,,42.60060306,-73.97723916,USA,NY,03-25-2020.csv,Albany,36001,2020-03-25T23:33:19Z,63,27
"Albany, WY, USA",03-26-2020,Recovered,0,,41.65498705,-105.72354150000001,USA,WY,03-26-2020.csv,Albany,56001,2020-03-26T23:48:35Z,64,28
"Albemarle, VA, USA",03-25-2020,Deaths,0,,38.02080697,-78.55481085,USA,VA,03-25-2020.csv,Albemarle,51003,2020-03-25T23:33:19Z,63,29
"Alberta, Canada",03-21-2020,Active,194,,53.9333,-116.5765,Canada,Alberta,03-21-2020.csv,,,2020-03-21T02:43:03Z,59,92
"Alcona, MI, USA",03-27-2020,Recovered,0,,44.6846864,-83.59507875,USA,MI,03-27-2020.csv,Alcona,26001,2020-03-27T22:14:55Z,65,30
"Alcorn, MS, USA",03-23-2020,Recovered,0,,34.88084463,-88.57996173,USA,MS,03-23-2020.csv,Alcorn,28003,2020-03-23T23:19:34Z,61,31
"Aleutians East, AK, USA",03-22-2020,Recovered,0,,55.32222414,-161.9722021,USA,AK,03-22-2020.csv,Aleutians East,2013,2020-03-22T23:45:00Z,60,1206
"Aleutians West, AK, USA",03-29-2020,Confirmed,0,,52.72541116,-110.4086433,USA,AK,03-29-2020.csv,Aleutians West,02016,2020-03-29T23:08:25Z,67,33
"Alexander, IL, USA",03-25-2020,Active,0,,37.18049267,-89.32910838,USA,IL,03-25-2020.csv,Alexander,17003,2020-03-25T23:33:19Z,63,34
"Alexander, NC, USA",03-27-2020,Confirmed,0,,35.922379600000006,-81.17751948,USA,NC,03-27-2020.csv,Alexander,37003,2020-03-27T22:14:55Z,65,35
"Alexandria, VA, USA",03-29-2020,Confirmed,25,,38.814003,-77.08183073,USA,VA,03-29-2020.csv,Alexandria,51510,2020-03-29T23:08:25Z,67,36
"Alfalfa, OK, USA",03-22-2020,Active,0,,36.73090616,-98.32408495,USA,OK,03-22-2020.csv,Alfalfa,40003,2020-03-22T23:45:00Z,60,2506
"Alger, MI, USA",03-22-2020,Recovered,0,,46.41292944,-86.60260122,USA,MI,03-22-2020.csv,Alger,26003,2020-03-22T23:45:00Z,60,1931
Algeria,03-04-2020,Confirmed,12,,28.0339,1.6596,Algeria,,03-04-2020.csv,,,2020-03-04T19:33:03Z,42,65
"Allamakee, IA, USA",03-25-2020,Deaths,0,,43.28383218,-91.37860922,USA,IA,03-25-2020.csv,Allamakee,19005,2020-03-25T23:33:19Z,63,39
"Allegan, MI, USA",03-26-2020,Active,1,,42.59147037,-85.89102866,USA,MI,03-26-2020.csv,Allegan,26005,2020-03-26T23:48:35Z,64,40
"Allegany, MD, USA",03-23-2020,Deaths,0,,39.62357628,-78.69280486,USA,MD,03-23-2020.csv,Allegany,24001,2020-03-23T23:19:34Z,61,41
"Allegany, NY, USA",03-27-2020,Recovered,0,,42.25748406,-78.02750466,USA,NY,03-27-2020.csv,Allegany,36003,2020-03-27T22:14:55Z,65,42
"Alleghany, NC, USA",03-25-2020,Confirmed,0,,36.49360862,-81.12857041,USA,NC,03-25-2020.csv,Alleghany,37005,2020-03-25T23:33:19Z,63,43
"Alleghany, VA, USA",03-29-2020,Confirmed,0,,37.78636074,-80.00222498,USA,VA,03-29-2020.csv,Alleghany,51005,2020-03-29T23:08:25Z,67,44
"Allegheny, PA, USA",03-24-2020,Active,56,,40.46809875,-79.98167747,USA,PA,03-24-2020.csv,Allegheny,42003,2020-03-24T23:37:31Z,62,45
"Allen, IN, USA",03-25-2020,Deaths,1,,41.09194313,-85.06800636,USA,IN,03-25-2020.csv,Allen,18003,2020-03-25T23:33:19Z,63,46
"Allen, KS, USA",03-24-2020,Recovered,0,,37.88582951,-95.30030847,USA,KS,03-24-2020.csv,Allen,20001,2020-03-24T23:37:31Z,62,47
"Allen, KY, USA",03-30-2020,Confirmed,1,,36.75197631,-86.19457544,USA,KY,03-30-2020.csv,Allen,21003,2020-03-30T22:52:45Z,68,48
"Allen, LA, USA",03-28-2020,Confirmed,7,,30.65385745,-92.82442028,USA,LA,03-28-2020.csv,Allen,22003,2020-03-28T23:05:37Z,66,49
"Allen, OH, USA",03-28-2020,Confirmed,2,,40.77285242,-84.10802343,USA,OH,03-28-2020.csv,Allen,39003,2020-03-28T23:05:37Z,66,50
"Allendale, SC, USA",03-30-2020,Recovered,0,,32.98837386,-81.35321066,USA,SC,03-30-2020.csv,Allendale,45005,2020-03-30T22:52:45Z,68,51
"Alpena, MI, USA",03-30-2020,Active,0,,45.03477666,-83.62212411,USA,MI,03-30-2020.csv,Alpena,26007,2020-03-30T22:52:45Z,68,52
"Alpine, CA, USA",03-22-2020,Confirmed,0,,38.59678594,-119.8223594,USA,CA,03-22-2020.csv,Alpine,6003,2020-03-22T23:45:00Z,60,1284
"Amador, CA, USA",03-23-2020,Deaths,0,,38.44583082,-120.65696000000001,USA,CA,03-23-2020.csv,Amador,06005,2020-03-23T23:19:34Z,61,54
"Amelia, VA, USA",03-23-2020,Deaths,0,,37.34081025,-77.98584649,USA,VA,03-23-2020.csv,Amelia,51007,2020-03-23T23:19:34Z,61,55
"Amherst, VA, USA",03-22-2020,Active,1,,37.60308293,-79.14548696,USA,VA,03-22-2020.csv,Amherst,51009,2020-03-22T23:45:00Z,60,705
"Amite, MS, USA",03-29-2020,Confirmed,4,,31.17467303,-90.80501621,USA,MS,03-29-2020.csv,Amite,28005,2020-03-29T23:08:25Z,67,57
"Anchorage, AK, USA",03-22-2020,Deaths,0,,61.14998174,-149.1426986,USA,AK,03-22-2020.csv,Anchorage,2020,2020-03-22T23:45:00Z,60,1147
"Anderson, KS, USA",03-28-2020,Recovered,0,,38.21413251,-95.29272815,USA,KS,03-28-2020.csv,Anderson,20003,2020-03-28T23:05:37Z,66,59
"Anderson, KY, USA",03-25-2020,Active,1,,38.00671029,-84.99171713,USA,KY,03-25-2020.csv,Anderson,21005,2020-03-25T23:33:19Z,63,60
"Anderson, SC, USA",03-24-2020,Confirmed,16,,34.51828081,-82.63959517,USA,SC,03-24-2020.csv,Anderson,45007,2020-03-24T23:37:31Z,62,61
"Anderson, TN, USA",03-28-2020,Confirmed,5,,36.12684348,-84.19965764,USA,TN,03-28-2020.csv,Anderson,47001,2020-03-28T23:05:37Z,66,62
"Anderson, TX, USA",03-30-2020,Confirmed,0,,31.81534745,-95.65354823,USA,TX,03-30-2020.csv,Anderson,48001,2020-03-30T22:52:45Z,68,63
Andorra,03-14-2020,Recovered,1,,42.5063,1.5218,Andorra,,03-14-2020.csv,,,2020-03-13T22:22:02Z,52,212
"Andrew, MO, USA",03-23-2020,Confirmed,0,,39.98492163,-94.80163024,USA,MO,03-23-2020.csv,Andrew,29003,2020-03-23T23:19:34Z,61,64
"Andrews, TX, USA",03-28-2020,Deaths,0,,32.30468633,-102.63765479999999,USA,TX,03-28-2020.csv,Andrews,48003,2020-03-28T23:05:37Z,66,65
"Androscoggin, ME, USA",03-22-2020,Recovered,0,,44.1664747,-70.20380627,USA,ME,03-22-2020.csv,Androscoggin,23001,2020-03-22T23:45:00Z,60,1017
"Angelina, TX, USA",03-24-2020,Recovered,0,,31.25457347,-94.60901487,USA,TX,03-24-2020.csv,Angelina,48005,2020-03-24T23:37:31Z,62,67
Angola,03-24-2020,Confirmed,3,,-11.2027,17.8739,Angola,,03-24-2020.csv,,,2020-03-24T23:37:15Z,62,3256
"Anguilla, United Kingdom",03-30-2020,Recovered,0,,18.2206,-63.0686,United Kingdom,Anguilla,03-30-2020.csv,,,2020-03-30T22:52:33Z,68,3180
"Anhui, China",02-23-2020,Deaths,6,,,,China,Anhui,02-23-2020.csv,,,2020-02-23T10:53:02Z,32,5
"Anne Arundel, MD, USA",03-25-2020,Active,31,,39.00670238,-76.60329337,USA,MD,03-25-2020.csv,Anne Arundel,24003,2020-03-25T23:33:19Z,63,68
"Anoka, MN, USA",03-29-2020,Deaths,0,,45.27476015,-93.24604565,USA,MN,03-29-2020.csv,Anoka,27003,2020-03-29T23:08:25Z,67,69
"Anson, NC, USA",03-22-2020,Confirmed,0,,34.97403241,-80.09953279,USA,NC,03-22-2020.csv,Anson,37007,2020-03-22T23:45:00Z,60,2360
"Antelope, NE, USA",03-27-2020,Confirmed,0,,42.17695516,-98.06662829999999,USA,NE,03-27-2020.csv,Antelope,31003,2020-03-27T22:14:55Z,65,71
Antigua and Barbuda,03-28-2020,Active,7,,17.0608,-61.7964,Antigua and Barbuda,,03-28-2020.csv,,,2020-03-28T23:05:25Z,66,3262
"Antrim, MI, USA",03-23-2020,Confirmed,0,,44.99690221,-85.15503082,USA,MI,03-23-2020.csv,Antrim,26009,2020-03-23T23:19:34Z,61,72
"Apache, AZ, USA",03-23-2020,Recovered,0,,35.39465006,-109.4892383,USA,AZ,03-23-2020.csv,Apache,04001,2020-03-23T23:19:34Z,61,73
"Appanoose, IA, USA",03-26-2020,Deaths,0,,40.74324454,-92.86865906,USA,IA,03-26-2020.csv,Appanoose,19007,2020-03-26T23:48:35Z,64,74
"Appling, GA, USA",03-27-2020,Active,0,,31.74847232,-82.28909114,USA,GA,03-27-2020.csv,Appling,13001,2020-03-27T22:14:55Z,65,75
"Appomattox, VA, USA",03-25-2020,Deaths,0,,37.37569884,-78.81340003,USA,VA,03-25-2020.csv,Appomattox,51011,2020-03-25T23:33:19Z,63,76
"AR, USA",03-12-2020,Confirmed,6,,34.9697,-92.3731,USA,AR,03-12-2020.csv,,,2020-03-12T21:39:10Z,50,149
"Aransas, TX, USA",03-23-2020,Deaths,0,,28.10556197,-96.9995047,USA,TX,03-23-2020.csv,Aransas,48007,2020-03-23T23:19:34Z,61,77
"Arapahoe, CO, USA",03-26-2020,Recovered,0,,39.64977461,-104.3353617,USA,CO,03-26-2020.csv,Arapahoe,08005,2020-03-26T23:48:35Z,64,78
"Archer, TX, USA",03-24-2020,Recovered,0,,33.61569967,-98.68754589,USA,TX,03-24-2020.csv,Archer,48009,2020-03-24T23:37:31Z,62,79
"Archuleta, CO, USA",03-29-2020,Active,0,,37.19474156,-107.04768670000001,USA,CO,03-29-2020.csv,Archuleta,08007,2020-03-29T23:08:25Z,67,80
"Arenac, MI, USA",03-22-2020,Recovered,0,,44.0636262,-83.89277559,USA,MI,03-22-2020.csv,Arenac,26011,2020-03-22T23:45:00Z,60,1934
Argentina,03-11-2020,Recovered,0,,-38.4161,-63.6167,Argentina,,03-11-2020.csv,,,2020-03-11T02:18:16Z,49,95
"Arkansas, AR, USA",03-24-2020,Active,0,,34.29145151,-91.37277296,USA,AR,03-24-2020.csv,Arkansas,05001,2020-03-24T23:37:31Z,62,82
"Arlington, VA, USA",03-24-2020,Active,36,,38.8767675,-77.10139853,USA,VA,03-24-2020.csv,Arlington,51013,2020-03-24T23:37:31Z,62,83
Armenia,03-25-2020,Deaths,0,,40.0691,45.0382,Armenia,,03-25-2020.csv,,,2020-03-25T23:33:04Z,63,3258
"Armstrong, PA, USA",03-23-2020,Recovered,0,,40.81665618,-79.46290811,USA,PA,03-23-2020.csv,Armstrong,42005,2020-03-23T23:19:34Z,61,84
"Armstrong, TX, USA",03-23-2020,Deaths,0,,34.96507426,-101.35748740000001,USA,TX,03-23-2020.csv,Armstrong,48011,2020-03-23T23:19:34Z,61,85
"Aroostook, ME, USA",03-23-2020,Deaths,0,,46.65926321,-68.59841248,USA,ME,03-23-2020.csv,Aroostook,23003,2020-03-23T23:19:34Z,61,86
"Arthur, NE, USA",03-26-2020,Recovered,0,,41.56896142,-101.6959559,USA,NE,03-26-2020.csv,Arthur,31005,2020-03-26T23:48:35Z,64,87
Aruba,03-15-2020,Confirmed,2,,12.5211,-69.9683,Aruba,,03-15-2020.csv,,,2020-03-13T23:53:03Z,53,202
"Aruba, Netherlands",03-18-2020,Recovered,0,,12.5186,-70.0358,Netherlands,Aruba,03-18-2020.csv,,,2020-03-18T00:53:02Z,56,241
"AS, USA",03-24-2020,Recovered,0,,-14.270999999999999,-170.132,USA,AS,03-24-2020.csv,,60000,2020-03-24T23:37:31Z,62,3171
"Ascension, LA, USA",03-30-2020,Deaths,5,,30.20406249,-90.91328409999998,USA,LA,03-30-2020.csv,Ascension,22005,2020-03-30T22:52:45Z,68,88
"Ashe, NC, USA",03-22-2020,Deaths,0,,36.43296207,-81.49862729,USA,NC,03-22-2020.csv,Ashe,37009,2020-03-22T23:45:00Z,60,2361
"Ashland, NE, USA",02-21-2020,Recovered,0,,,,USA,NE,02-21-2020.csv,Ashland,,2020-02-21T23:23:06Z,30,43
"Ashland, OH, USA",03-28-2020,Recovered,0,,40.84772277,-82.27280781,USA,OH,03-28-2020.csv,Ashland,39005,2020-03-28T23:05:37Z,66,90
"Ashland, WI, USA",03-23-2020,Confirmed,0,,46.31956891,-90.67837132,USA,WI,03-23-2020.csv,Ashland,55003,2020-03-23T23:19:34Z,61,91
"Ashley, AR, USA",03-26-2020,Deaths,0,,33.19153461,-91.76984709999999,USA,AR,03-26-2020.csv,Ashley,05003,2020-03-26T23:48:35Z,64,92
"Ashtabula, OH, USA",03-30-2020,Confirmed,6,,41.70860332,-80.74830218,USA,OH,03-30-2020.csv,Ashtabula,39007,2020-03-30T22:52:45Z,68,93
"Asotin, WA, USA",03-27-2020,Active,0,,46.18894415,-117.2022851,USA,WA,03-27-2020.csv,Asotin,53003,2020-03-27T22:14:55Z,65,94
"Assumption, LA, USA",03-25-2020,Active,2,,29.89946234,-91.06461642,USA,LA,03-25-2020.csv,Assumption,22007,2020-03-25T23:33:19Z,63,95
"Atascosa, TX, USA",03-26-2020,Recovered,0,,28.89333001,-98.52730485,USA,TX,03-26-2020.csv,Atascosa,48013,2020-03-26T23:48:35Z,64,96
"Atchison, KS, USA",03-26-2020,Deaths,0,,39.53185661,-95.30870026,USA,KS,03-26-2020.csv,Atchison,20005,2020-03-26T23:48:35Z,64,97
"Atchison, MO, USA",03-29-2020,Confirmed,1,,40.43238737,-95.42970639,USA,MO,03-29-2020.csv,Atchison,29005,2020-03-29T23:08:25Z,67,98
"Athens, OH, USA",03-30-2020,Recovered,0,,39.33425634,-82.04278644,USA,OH,03-30-2020.csv,Athens,39009,2020-03-30T22:52:45Z,68,99
"Atkinson, GA, USA",03-27-2020,Active,0,,31.29633502,-82.87545866,USA,GA,03-27-2020.csv,Atkinson,13003,2020-03-27T22:14:55Z,65,100
"Atlantic, NJ, USA",03-27-2020,Confirmed,14,,39.47538693,-74.65848483,USA,NJ,03-27-2020.csv,Atlantic,34001,2020-03-27T22:14:55Z,65,101
"Atoka, OK, USA",03-25-2020,Confirmed,0,,34.37366573,-96.03802487,USA,OK,03-25-2020.csv,Atoka,40005,2020-03-25T23:33:19Z,63,102
"Attala, MS, USA",03-26-2020,Active,7,,33.08658803,-89.57838564,USA,MS,03-26-2020.csv,Attala,28007,2020-03-26T23:48:35Z,64,103
"Audrain, MO, USA",03-25-2020,Deaths,0,,39.215877,-91.84242683,USA,MO,03-25-2020.csv,Audrain,29007,2020-03-25T23:33:19Z,63,104
"Audubon, IA, USA",03-30-2020,Active,1,,41.6844628,-94.90581859,USA,IA,03-30-2020.csv,Audubon,19009,2020-03-30T22:52:45Z,68,105
"Auglaize, OH, USA",03-25-2020,Active,0,,40.55998859,-84.22421429999999,USA,OH,03-25-2020.csv,Auglaize,39011,2020-03-25T23:33:19Z,63,106
"Augusta, VA, USA",03-25-2020,Confirmed,0,,38.16404586,-79.12461614,USA,VA,03-25-2020.csv,Augusta,51015,2020-03-25T23:33:19Z,63,107
"Aurora, SD, USA",03-26-2020,Active,0,,43.71757685,-98.56050467,USA,SD,03-26-2020.csv,Aurora,46003,2020-03-26T23:48:35Z,64,108
"Austin, TX, USA",03-28-2020,Deaths,0,,29.88548725,-96.27736949,USA,TX,03-28-2020.csv,Austin,48015,2020-03-28T23:05:37Z,66,109
Australia,01-25-2020,Active,4,,,,Australia,,01-25-2020.csv,,,2020-01-25T17:00:00Z,3,41
"Australian Capital Territory, Australia",03-30-2020,Active,75,,-35.4735,149.0124,Australia,Australian Capital Territory,03-30-2020.csv,,,2020-03-30T22:58:55Z,68,3183
Austria,03-12-2020,Confirmed,302,,47.5162,14.5501,Austria,,03-12-2020.csv,,,2020-03-12T11:13:29Z,50,32
"Autauga, AL, USA",03-30-2020,Confirmed,6,,32.53952745,-86.64408227,USA,AL,03-30-2020.csv,Autauga,01001,2020-03-30T22:52:45Z,68,110
"Avery, NC, USA",03-29-2020,Confirmed,0,,36.07569796,-81.92308483,USA,NC,03-29-2020.csv,Avery,37011,2020-03-29T23:08:25Z,67,111
"Avoyelles, LA, USA",03-23-2020,Active,1,,31.07796211,-92.00079449,USA,LA,03-23-2020.csv,Avoyelles,22009,2020-03-23T23:19:34Z,61,112
"AZ, USA",01-27-2020,Recovered,0,,,,USA,AZ,01-27-2020.csv,,,2020-01-27T23:59:00Z,5,36
Azerbaijan,03-12-2020,Confirmed,11,,40.1431,47.5769,Azerbaijan,,03-12-2020.csv,,,2020-03-11T08:13:09Z,50,124
"Baca, CO, USA",03-27-2020,Active,1,,37.31940883,-102.5603223,USA,CO,03-27-2020.csv,Baca,08009,2020-03-27T22:14:55Z,65,113
"Bacon, GA, USA",03-22-2020,Active,0,,31.55456473,-82.45936528,USA,GA,03-22-2020.csv,Bacon,13005,2020-03-22T23:45:00Z,60,1362
Bahamas,03-27-2020,Confirmed,10,,25.025885,-78.035889,Bahamas,,03-27-2020.csv,,,2020-03-27T23:23:03Z,65,3267
"Bahamas, The",03-21-2020,Active,4,,25.0343,-77.3963,"Bahamas, The",,03-21-2020.csv,,,2020-03-21T02:43:03Z,59,238
Bahrain,03-15-2020,Deaths,0,,26.0667,50.5577,Bahrain,,03-15-2020.csv,,,2020-03-14T11:53:29Z,53,45
"Bailey, TX, USA",03-23-2020,Recovered,0,,34.06854817,-102.8299707,USA,TX,03-23-2020.csv,Bailey,48017,2020-03-23T23:19:34Z,61,115
"Baker, FL, USA",03-28-2020,Active,7,,30.33060121,-82.28467476,USA,FL,03-28-2020.csv,Baker,12003,2020-03-28T23:05:37Z,66,116
"Baker, GA, USA",03-28-2020,Active,0,,31.32669878,-84.44218806,USA,GA,03-28-2020.csv,Baker,13007,2020-03-28T23:05:37Z,66,117
"Baker, OR, USA",03-24-2020,Active,0,,44.70915557,-117.6749883,USA,OR,03-24-2020.csv,Baker,41001,2020-03-24T23:37:31Z,62,118
"Baldwin, AL, USA",03-24-2020,Confirmed,4,,30.72774991,-87.72207058,USA,AL,03-24-2020.csv,Baldwin,01003,2020-03-24T23:37:31Z,62,119
"Baldwin, GA, USA",03-27-2020,Recovered,0,,33.06882326,-83.24701748,USA,GA,03-27-2020.csv,Baldwin,13009,2020-03-27T22:14:55Z,65,120
"Ballard, KY, USA",03-27-2020,Deaths,0,,37.05842757,-88.99427697,USA,KY,03-27-2020.csv,Ballard,21007,2020-03-27T22:14:55Z,65,121
"Baltimore City, MD, USA",03-24-2020,Recovered,0,,39.30211911,-76.61151012,USA,MD,03-24-2020.csv,Baltimore City,24510,2020-03-24T23:37:31Z,62,123
"Baltimore, MD, USA",03-30-2020,Confirmed,186,,39.45784712,-76.62911955,USA,MD,03-30-2020.csv,Baltimore,24005,2020-03-30T22:52:45Z,68,122
"Bamberg, SC, USA",03-29-2020,Confirmed,0,,33.21927586,-81.05659969,USA,SC,03-29-2020.csv,Bamberg,45009,2020-03-29T23:08:25Z,67,124
"Bandera, TX, USA",03-26-2020,Recovered,0,,29.74619598,-99.24598147,USA,TX,03-26-2020.csv,Bandera,48019,2020-03-26T23:48:35Z,64,125
Bangladesh,03-12-2020,Confirmed,3,,23.6850,90.3563,Bangladesh,,03-12-2020.csv,,,2020-03-10T06:19:32Z,50,163
"Banks, GA, USA",03-30-2020,Confirmed,1,,34.35607081,-83.49644388,USA,GA,03-30-2020.csv,Banks,13011,2020-03-30T22:52:45Z,68,126
"Banner, NE, USA",03-23-2020,Recovered,0,,41.54634427,-103.7114332,USA,NE,03-23-2020.csv,Banner,31007,2020-03-23T23:19:34Z,61,127
"Bannock, ID, USA",03-28-2020,Active,3,,42.67002716,-112.2233311,USA,ID,03-28-2020.csv,Bannock,16005,2020-03-28T23:05:37Z,66,128
"Baraga, MI, USA",03-27-2020,Confirmed,0,,46.6720582,-88.36363591,USA,MI,03-27-2020.csv,Baraga,26013,2020-03-27T22:14:55Z,65,129
Barbados,03-22-2020,Deaths,0,,13.1939,-59.5432,Barbados,,03-22-2020.csv,,,2020-03-22T23:45:00Z,60,3354
"Barber, KS, USA",03-22-2020,Confirmed,0,,37.2288586,-98.68460053,USA,KS,03-22-2020.csv,Barber,20007,2020-03-22T23:45:00Z,60,1699
"Barbour, AL, USA",03-27-2020,Active,0,,31.868263,-85.3871286,USA,AL,03-27-2020.csv,Barbour,01005,2020-03-27T22:14:55Z,65,131
"Barbour, WV, USA",03-30-2020,Active,0,,39.1307219,-80.00350858,USA,WV,03-30-2020.csv,Barbour,54001,2020-03-30T22:52:45Z,68,132
"Barnes, ND, USA",03-22-2020,Active,0,,46.93579637,-98.06605978,USA,ND,03-22-2020.csv,Barnes,38003,2020-03-22T23:45:00Z,60,2414
"Barnstable, MA, USA",03-30-2020,Deaths,2,,41.72980578,-70.28854339,USA,MA,03-30-2020.csv,Barnstable,25001,2020-03-30T22:52:45Z,68,134
"Barnwell, SC, USA",03-23-2020,Deaths,0,,33.26679302,-81.43584352,USA,SC,03-23-2020.csv,Barnwell,45011,2020-03-23T23:19:34Z,61,135
"Barren, KY, USA",03-24-2020,Confirmed,0,,36.96469836,-85.93338945,USA,KY,03-24-2020.csv,Barren,21009,2020-03-24T23:37:31Z,62,136
"Barron, WI, USA",03-28-2020,Active,0,,45.42372701,-91.84833627,USA,WI,03-28-2020.csv,Barron,55005,2020-03-28T23:05:37Z,66,137
"Barrow, GA, USA",03-24-2020,Active,1,,33.99148694,-83.71436292,USA,GA,03-24-2020.csv,Barrow,13013,2020-03-24T23:37:31Z,62,138
"Barry, MI, USA",03-24-2020,Deaths,0,,42.59513984,-85.30834519,USA,MI,03-24-2020.csv,Barry,26015,2020-03-24T23:37:31Z,62,139
"Barry, MO, USA",03-28-2020,Active,1,,36.70978521,-93.82919888,USA,MO,03-28-2020.csv,Barry,29009,2020-03-28T23:05:37Z,66,140
"Bartholomew, IN, USA",03-24-2020,Active,5,,39.20744865,-85.89558181,USA,IN,03-24-2020.csv,Bartholomew,18005,2020-03-24T23:37:31Z,62,141
"Barton, KS, USA",03-30-2020,Active,0,,38.47889676,-98.75636726,USA,KS,03-30-2020.csv,Barton,20009,2020-03-30T22:52:45Z,68,142
"Barton, MO, USA",03-26-2020,Active,0,,37.50207671,-94.34757022,USA,MO,03-26-2020.csv,Barton,29011,2020-03-26T23:48:35Z,64,143
"Bartow, GA, USA",03-29-2020,Deaths,1,,34.23732119,-84.83887523,USA,GA,03-29-2020.csv,Bartow,13015,2020-03-29T23:08:25Z,67,144
"Bastrop, TX, USA",03-27-2020,Confirmed,2,,30.10370699,-97.31206354,USA,TX,03-27-2020.csv,Bastrop,48021,2020-03-27T22:14:55Z,65,145
"Bates, MO, USA",03-27-2020,Deaths,0,,38.25271289,-94.34113157,USA,MO,03-27-2020.csv,Bates,29013,2020-03-27T22:14:55Z,65,146
"Bath, KY, USA",03-29-2020,Recovered,0,,38.14735938,-83.74588932,USA,KY,03-29-2020.csv,Bath,21011,2020-03-29T23:08:25Z,67,147
"Bath, VA, USA",03-25-2020,Confirmed,0,,38.05852573,-79.73912095,USA,VA,03-25-2020.csv,Bath,51017,2020-03-25T23:33:19Z,63,148
"Bavaria, Germany",01-29-2020,Deaths,0,,,,Germany,Bavaria,01-29-2020.csv,,,2020-01-29T19:30:00Z,7,51
"Baxter, AR, USA",03-27-2020,Deaths,0,,36.28784385,-92.33782872,USA,AR,03-27-2020.csv,Baxter,05005,2020-03-27T22:14:55Z,65,149
"Bay, FL, USA",03-28-2020,Active,5,,30.26548745,-85.62122584,USA,FL,03-28-2020.csv,Bay,12005,2020-03-28T23:05:37Z,66,150
"Bay, MI, USA",03-23-2020,Confirmed,2,,43.70639106,-83.98731479,USA,MI,03-23-2020.csv,Bay,26017,2020-03-23T23:19:34Z,61,151
"Bayfield, WI, USA",03-28-2020,Deaths,0,,46.52868768,-91.19716729,USA,WI,03-28-2020.csv,Bayfield,55007,2020-03-28T23:05:37Z,66,152
"Baylor, TX, USA",03-28-2020,Active,0,,33.61640794,-99.21352901,USA,TX,03-28-2020.csv,Baylor,48023,2020-03-28T23:05:37Z,66,153
"Beadle, SD, USA",03-24-2020,Active,13,,44.41464384,-98.27858469,USA,SD,03-24-2020.csv,Beadle,46005,2020-03-24T23:37:31Z,62,154
"Bear Lake, ID, USA",03-27-2020,Confirmed,0,,42.28269683,-111.32892379999998,USA,ID,03-27-2020.csv,Bear Lake,16007,2020-03-27T22:14:55Z,65,155
"Beaufort, NC, USA",03-23-2020,Confirmed,0,,35.48531943,-76.84325809,USA,NC,03-23-2020.csv,Beaufort,37013,2020-03-23T23:19:34Z,61,156
"Beaufort, SC, USA",03-30-2020,Confirmed,74,,32.39226291,-80.72619758,USA,SC,03-30-2020.csv,Beaufort,45013,2020-03-30T22:52:45Z,68,157
"Beauregard, LA, USA",03-28-2020,Active,4,,30.64836518,-93.34173616,USA,LA,03-28-2020.csv,Beauregard,22011,2020-03-28T23:05:37Z,66,158
"Beaver, OK, USA",03-29-2020,Active,0,,36.7496847,-100.4758872,USA,OK,03-29-2020.csv,Beaver,40007,2020-03-29T23:08:25Z,67,159
"Beaver, PA, USA",03-28-2020,Active,22,,40.6825484,-80.34921611,USA,PA,03-28-2020.csv,Beaver,42007,2020-03-28T23:05:37Z,66,160
"Beaver, UT, USA",03-24-2020,Confirmed,0,,38.35657051,-113.2342232,USA,UT,03-24-2020.csv,Beaver,49001,2020-03-24T23:37:31Z,62,161
"Beaverhead, MT, USA",03-22-2020,Confirmed,0,,45.13434354,-112.8984694,USA,MT,03-22-2020.csv,Beaverhead,30001,2020-03-22T23:45:00Z,60,2170
"Becker, MN, USA",03-29-2020,Active,0,,46.93479392,-95.67158144,USA,MN,03-29-2020.csv,Becker,27005,2020-03-29T23:08:25Z,67,163
"Beckham, OK, USA",03-24-2020,Confirmed,0,,35.26862449,-99.68128023,USA,OK,03-24-2020.csv,Beckham,40009,2020-03-24T23:37:31Z,62,164
"Bedford, PA, USA",03-25-2020,Recovered,0,,40.00522157,-78.48998442,USA,PA,03-25-2020.csv,Bedford,42009,2020-03-25T23:33:19Z,63,165
"Bedford, TN, USA",03-22-2020,Recovered,0,,35.51123746,-86.45549096,USA,TN,03-22-2020.csv,Bedford,47003,2020-03-22T23:45:00Z,60,2690
"Bedford, VA, USA",03-23-2020,Confirmed,1,,37.3080028,-79.5281964,USA,VA,03-23-2020.csv,Bedford,51019,2020-03-23T23:19:34Z,61,167
"Bee, TX, USA",03-23-2020,Deaths,0,,28.41761668,-97.74215593,USA,TX,03-23-2020.csv,Bee,48025,2020-03-23T23:19:34Z,61,168
"Beijing, China",03-17-2020,Deaths,8,,40.1824,116.4142,China,Beijing,03-17-2020.csv,,,2020-03-17T10:53:03Z,55,32
Belarus,02-28-2020,Deaths,0,,,,Belarus,,02-28-2020.csv,,,2020-02-28T16:23:03Z,37,81
Belgium,03-21-2020,Recovered,263,,50.5039,4.4699,Belgium,,03-21-2020.csv,,,2020-03-21T11:13:12Z,59,11
Belize,03-24-2020,Confirmed,1,,17.1899,-88.4976,Belize,,03-24-2020.csv,,,2020-03-24T23:37:15Z,62,3268
"Belknap, NH, USA",03-26-2020,Recovered,0,,43.51637314,-71.41684235,USA,NH,03-26-2020.csv,Belknap,33001,2020-03-26T23:48:35Z,64,169
"Bell, KY, USA",03-22-2020,Recovered,0,,36.73355174,-83.67766671,USA,KY,03-22-2020.csv,Bell,21013,2020-03-22T23:45:00Z,60,1791
"Bell, TX, USA",03-29-2020,Deaths,1,,31.03736027,-97.4785025,USA,TX,03-29-2020.csv,Bell,48027,2020-03-29T23:08:25Z,67,171
"Belmont, OH, USA",03-24-2020,Confirmed,2,,40.01625942,-80.9924051,USA,OH,03-24-2020.csv,Belmont,39013,2020-03-24T23:37:31Z,62,172
"Beltrami, MN, USA",03-29-2020,Active,2,,47.97373527,-94.93732139,USA,MN,03-29-2020.csv,Beltrami,27007,2020-03-29T23:08:25Z,67,173
"Ben Hill, GA, USA",03-23-2020,Confirmed,0,,31.76095874,-83.22145359,USA,GA,03-23-2020.csv,Ben Hill,13017,2020-03-23T23:19:34Z,61,174
"Benewah, ID, USA",03-26-2020,Active,0,,47.21754179,-116.6586851,USA,ID,03-26-2020.csv,Benewah,16009,2020-03-26T23:48:35Z,64,175
Benin,03-23-2020,Recovered,0,,9.3077,2.3158,Benin,,03-23-2020.csv,,,2020-03-23T23:19:21Z,61,3270
"Bennett, SD, USA",03-22-2020,Deaths,0,,43.19486375,-101.6665572,USA,SD,03-22-2020.csv,Bennett,46007,2020-03-22T23:45:00Z,60,2633
"Bennington, VT, USA",03-29-2020,Confirmed,16,,43.03519828,-73.09048868,USA,VT,03-29-2020.csv,Bennington,50003,2020-03-29T23:08:25Z,67,177
"Benson, ND, USA",03-23-2020,Deaths,0,,48.0683985,-99.35916363,USA,ND,03-23-2020.csv,Benson,38005,2020-03-23T23:19:34Z,61,178
"Bent, CO, USA",03-22-2020,Recovered,0,,37.95474293,-103.0720195,USA,CO,03-22-2020.csv,Bent,8011,2020-03-22T23:45:00Z,60,1305
"Benton, AR, USA",03-28-2020,Active,28,,36.33644656,-94.25680817,USA,AR,03-28-2020.csv,Benton,05007,2020-03-28T23:05:37Z,66,180
"Benton, IA, USA",03-29-2020,Recovered,0,,42.08011739,-92.06463573,USA,IA,03-29-2020.csv,Benton,19011,2020-03-29T23:08:25Z,67,182
"Benton, IN, USA",03-25-2020,Active,0,,40.60626947,-87.31093999,USA,IN,03-25-2020.csv,Benton,18007,2020-03-25T23:33:19Z,63,181
"Benton, MN, USA",03-22-2020,Active,1,,45.69804958,-93.99514135,USA,MN,03-22-2020.csv,Benton,27009,2020-03-22T23:45:00Z,60,865
"Benton, MO, USA",03-28-2020,Active,1,,38.29503305,-93.28756116,USA,MO,03-28-2020.csv,Benton,29015,2020-03-28T23:05:37Z,66,185
"Benton, MS, USA",03-27-2020,Active,2,,34.81681228,-89.18945516,USA,MS,03-27-2020.csv,Benton,28009,2020-03-27T22:14:55Z,65,184
"Benton, OR, USA",03-23-2020,Recovered,0,,44.49167306,-123.4316987,USA,OR,03-23-2020.csv,Benton,41003,2020-03-23T23:19:34Z,61,186
"Benton, TN, USA",03-28-2020,Recovered,0,,36.07110411,-88.06849355,USA,TN,03-28-2020.csv,Benton,47005,2020-03-28T23:05:37Z,66,187
"Benton, WA, USA",03-27-2020,Confirmed,42,,46.23946995,-119.51208340000001,USA,WA,03-27-2020.csv,Benton,53005,2020-03-27T22:14:55Z,65,188
"Benzie, MI, USA",03-24-2020,Deaths,0,,44.63899297,-86.01608482,USA,MI,03-24-2020.csv,Benzie,26019,2020-03-24T23:37:31Z,62,189
"Bergen, NJ, USA",03-09-2020,Recovered,0,,40.9263,-74.0770,USA,NJ,03-09-2020.csv,Bergen,,2020-03-08T21:23:03Z,47,131
"Berkeley, CA, USA",03-05-2020,Recovered,0,,37.8715,-122.2730,USA,CA,03-05-2020.csv,Berkeley,,2020-03-03T23:53:03Z,43,150
"Berkeley, SC, USA",03-23-2020,Confirmed,4,,33.20222596,-79.94654523,USA,SC,03-23-2020.csv,Berkeley,45015,2020-03-23T23:19:34Z,61,191
"Berkeley, WV, USA",03-30-2020,Deaths,0,,39.46704621,-78.02414609,USA,WV,03-30-2020.csv,Berkeley,54003,2020-03-30T22:52:45Z,68,192
"Berks, PA, USA",03-28-2020,Recovered,0,,40.41570541,-75.92457766,USA,PA,03-28-2020.csv,Berks,42011,2020-03-28T23:05:37Z,66,193
"Berkshire, MA, USA",03-09-2020,Recovered,0,,42.3118,-73.1822,USA,MA,03-09-2020.csv,Berkshire,,2020-03-08T00:43:03Z,47,204
"Bermuda, United Kingdom",03-29-2020,Active,20,,32.3078,-64.7505,United Kingdom,Bermuda,03-29-2020.csv,,,2020-03-29T23:08:13Z,67,3181
"Bernalillo, NM, USA",03-29-2020,Deaths,1,,35.05163625,-106.6703554,USA,NM,03-29-2020.csv,Bernalillo,35001,2020-03-29T23:08:25Z,67,195
"Berrien, GA, USA",03-22-2020,Deaths,0,,31.27590016,-83.2252992,USA,GA,03-22-2020.csv,Berrien,13019,2020-03-22T23:45:00Z,60,1366
"Berrien, MI, USA",03-25-2020,Recovered,0,,41.95447397,-86.41313079999998,USA,MI,03-25-2020.csv,Berrien,26021,2020-03-25T23:33:19Z,63,197
"Bertie, NC, USA",03-24-2020,Recovered,0,,36.0688473,-76.96545943,USA,NC,03-24-2020.csv,Bertie,37015,2020-03-24T23:37:31Z,62,198
"Bethel, AK, USA",03-25-2020,Deaths,0,,60.90980451,-159.8561831,USA,AK,03-25-2020.csv,Bethel,02050,2020-03-25T23:33:19Z,63,199
"Bexar, TX, USA",03-28-2020,Active,120,,29.44928723,-98.52019748,USA,TX,03-28-2020.csv,Bexar,48029,2020-03-28T23:05:37Z,66,200
Bhutan,03-27-2020,Active,3,,27.5142,90.4336,Bhutan,,03-27-2020.csv,,,2020-03-27T23:23:03Z,65,3275
"Bibb, AL, USA",03-22-2020,Deaths,0,,32.99642064,-87.1251146,USA,AL,03-22-2020.csv,Bibb,1007,2020-03-22T23:45:00Z,60,1162
"Bibb, GA, USA",03-28-2020,Deaths,0,,32.80904227,-83.70489165,USA,GA,03-28-2020.csv,Bibb,13021,2020-03-28T23:05:37Z,66,202
"Bienville, LA, USA",03-25-2020,Deaths,1,,32.34569994,-93.05398492,USA,LA,03-25-2020.csv,Bienville,22013,2020-03-25T23:33:19Z,63,203
"Big Horn, MT, USA",03-26-2020,Confirmed,0,,45.42335905,-107.492347,USA,MT,03-26-2020.csv,Big Horn,30003,2020-03-26T23:48:35Z,64,204
"Big Horn, WY, USA",03-28-2020,Active,0,,44.52405055,-107.9960365,USA,WY,03-28-2020.csv,Big Horn,56003,2020-03-28T23:05:37Z,66,205
"Big Stone, MN, USA",03-22-2020,Confirmed,0,,45.42712824,-96.41403739,USA,MN,03-22-2020.csv,Big Stone,27011,2020-03-22T23:45:00Z,60,1984
"Billings, ND, USA",03-23-2020,Recovered,0,,47.02366884,-103.3762965,USA,ND,03-23-2020.csv,Billings,38007,2020-03-23T23:19:34Z,61,207
"Bingham, ID, USA",03-29-2020,Active,1,,43.21672879999999,-112.3978437,USA,ID,03-29-2020.csv,Bingham,16011,2020-03-29T23:08:25Z,67,208
"Black Hawk, IA, USA",03-25-2020,Active,4,,42.4704581,-92.30524729,USA,IA,03-25-2020.csv,Black Hawk,19013,2020-03-25T23:33:19Z,63,209
"Blackford, IN, USA",03-24-2020,Recovered,0,,40.47388153,-85.32499702,USA,IN,03-24-2020.csv,Blackford,18009,2020-03-24T23:37:31Z,62,210
"Bladen, NC, USA",03-29-2020,Deaths,0,,34.61296243,-78.56180059,USA,NC,03-29-2020.csv,Bladen,37017,2020-03-29T23:08:25Z,67,211
"Blaine, ID, USA",03-29-2020,Recovered,0,,43.4085812,-113.9752658,USA,ID,03-29-2020.csv,Blaine,16013,2020-03-29T23:08:25Z,67,212
"Blaine, MT, USA",03-26-2020,Active,0,,48.43175214,-108.9582723,USA,MT,03-26-2020.csv,Blaine,30005,2020-03-26T23:48:35Z,64,213
"Blaine, NE, USA",03-24-2020,Recovered,0,,41.91311716,-99.97677845,USA,NE,03-24-2020.csv,Blaine,31009,2020-03-24T23:37:31Z,62,214
"Blaine, OK, USA",03-28-2020,Recovered,0,,35.87518314,-98.43307003,USA,OK,03-28-2020.csv,Blaine,40011,2020-03-28T23:05:37Z,66,215
"Blair, PA, USA",03-22-2020,Confirmed,0,,40.47961444,-78.34917412,USA,PA,03-22-2020.csv,Blair,42013,2020-03-22T23:45:00Z,60,2587
"Blanco, TX, USA",03-28-2020,Active,1,,30.26640707,-98.3999852,USA,TX,03-28-2020.csv,Blanco,48031,2020-03-28T23:05:37Z,66,217
"Bland, VA, USA",03-22-2020,Confirmed,0,,37.13128068,-81.13599391,USA,VA,03-22-2020.csv,Bland,51021,2020-03-22T23:45:00Z,60,2970
"Bleckley, GA, USA",03-30-2020,Deaths,0,,32.43829035,-83.33035166,USA,GA,03-30-2020.csv,Bleckley,13023,2020-03-30T22:52:45Z,68,219
"Bledsoe, TN, USA",03-23-2020,Confirmed,0,,35.59942968,-85.20611967,USA,TN,03-23-2020.csv,Bledsoe,47007,2020-03-23T23:19:34Z,61,220
"Blount, AL, USA",03-22-2020,Active,0,,33.98210918,-86.56790593,USA,AL,03-22-2020.csv,Blount,1009,2020-03-22T23:45:00Z,60,1163
"Blount, TN, USA",03-27-2020,Recovered,0,,35.68938198,-83.92847788,USA,TN,03-27-2020.csv,Blount,47009,2020-03-27T22:14:55Z,65,222
"Blue Earth, MN, USA",03-26-2020,Deaths,0,,44.03554215,-94.06699781,USA,MN,03-26-2020.csv,Blue Earth,27013,2020-03-26T23:48:35Z,64,223
"Boise, ID, USA",03-30-2020,Confirmed,0,,43.98829931,-115.7309284,USA,ID,03-30-2020.csv,Boise,16015,2020-03-30T22:52:45Z,68,224
"Bolivar, MS, USA",03-22-2020,Deaths,0,,33.79696941,-90.87372121,USA,MS,03-22-2020.csv,Bolivar,28011,2020-03-22T23:45:00Z,60,726
Bolivia,03-16-2020,Confirmed,11,,-16.2902,-63.5887,Bolivia,,03-16-2020.csv,,,2020-03-16T14:38:45Z,54,170
"Bollinger, MO, USA",03-23-2020,Confirmed,0,,37.32449052,-90.02725304,USA,MO,03-23-2020.csv,Bollinger,29017,2020-03-23T23:19:34Z,61,226
"Bon Homme, SD, USA",03-24-2020,Confirmed,1,,42.98914167,-97.88592746,USA,SD,03-24-2020.csv,Bon Homme,46009,2020-03-24T23:37:31Z,62,227
"Bond, IL, USA",03-24-2020,Confirmed,0,,38.88829622,-89.43534887,USA,IL,03-24-2020.csv,Bond,17005,2020-03-24T23:37:31Z,62,228
"Bonner, ID, USA",03-26-2020,Confirmed,0,,48.29996017,-116.6017932,USA,ID,03-26-2020.csv,Bonner,16017,2020-03-26T23:48:35Z,64,229
"Bonneville, ID, USA",03-29-2020,Deaths,0,,43.38713372,-111.6161537,USA,ID,03-29-2020.csv,Bonneville,16019,2020-03-29T23:08:25Z,67,230
"Boone, AR, USA",03-27-2020,Deaths,0,,36.3084504,-93.09374925,USA,AR,03-27-2020.csv,Boone,05009,2020-03-27T22:14:55Z,65,231
"Boone, IA, USA",03-23-2020,Recovered,0,,42.03657094,-93.9313999,USA,IA,03-23-2020.csv,Boone,19015,2020-03-23T23:19:34Z,61,234
"Boone, IL, USA",03-30-2020,Confirmed,0,,42.32359279,-88.82345779,USA,IL,03-30-2020.csv,Boone,17007,2020-03-30T22:52:45Z,68,232
"Boone, IN, USA",03-23-2020,Recovered,0,,40.0509304,-86.46841646,USA,IN,03-23-2020.csv,Boone,18011,2020-03-23T23:19:34Z,61,233
"Boone, KY, USA",03-28-2020,Confirmed,5,,38.97065142,-84.72615357,USA,KY,03-28-2020.csv,Boone,21015,2020-03-28T23:05:37Z,66,235
"Boone, MO, USA",03-28-2020,Confirmed,49,,38.99186229,-92.30723575,USA,MO,03-28-2020.csv,Boone,29019,2020-03-28T23:05:37Z,66,236
"Boone, NE, USA",03-24-2020,Active,0,,41.70759415,-98.06737183,USA,NE,03-24-2020.csv,Boone,31011,2020-03-24T23:37:31Z,62,237
"Boone, WV, USA",03-22-2020,Deaths,0,,38.01974191,-81.69888019,USA,WV,03-22-2020.csv,Boone,54005,2020-03-22T23:45:00Z,60,3071
"Borden, TX, USA",03-26-2020,Deaths,0,,32.74363984,-101.43165090000001,USA,TX,03-26-2020.csv,Borden,48033,2020-03-26T23:48:35Z,64,239
Bosnia and Herzegovina,03-05-2020,Confirmed,2,,43.9159,17.6791,Bosnia and Herzegovina,,03-05-2020.csv,,,2020-03-05T17:13:30Z,43,106
"Bosque, TX, USA",03-27-2020,Confirmed,0,,31.89978581,-97.63613524,USA,TX,03-27-2020.csv,Bosque,48035,2020-03-27T22:14:55Z,65,240
"Bossier, LA, USA",03-29-2020,Recovered,0,,32.67932307,-93.60460152,USA,LA,03-29-2020.csv,Bossier,22015,2020-03-29T23:08:25Z,67,241
"Boston, MA, USA",02-15-2020,Active,1,,,,USA,MA,02-15-2020.csv,Boston,,2020-02-01T19:43:03Z,24,68
"Botetourt, VA, USA",03-23-2020,Active,1,,37.55531756,-79.80982182,USA,VA,03-23-2020.csv,Botetourt,51023,2020-03-23T23:19:34Z,61,242
Botswana,03-30-2020,Active,3,,-22.3285,24.6849,Botswana,,03-30-2020.csv,,,2020-03-30T22:52:33Z,68,3286
"Bottineau, ND, USA",03-28-2020,Recovered,0,,48.79106111,-100.8378166,USA,ND,03-28-2020.csv,Bottineau,38009,2020-03-28T23:05:37Z,66,243
"Boulder, CO, USA",03-26-2020,Active,66,,40.09313619,-105.3546767,USA,CO,03-26-2020.csv,Boulder,08013,2020-03-26T23:48:35Z,64,244
"Boundary, ID, USA",03-25-2020,Active,0,,48.76684761,-116.4630179,USA,ID,03-25-2020.csv,Boundary,16021,2020-03-25T23:33:19Z,63,245
"Bourbon, KS, USA",03-29-2020,Confirmed,3,,37.85508555,-94.84865997,USA,KS,03-29-2020.csv,Bourbon,20011,2020-03-29T23:08:25Z,67,246
"Bourbon, KY, USA",03-28-2020,Recovered,0,,38.2054607,-84.21827874,USA,KY,03-28-2020.csv,Bourbon,21017,2020-03-28T23:05:37Z,66,247
"Bowie, TX, USA",03-28-2020,Deaths,0,,33.44626922,-94.41834132,USA,TX,03-28-2020.csv,Bowie,48037,2020-03-28T23:05:37Z,66,248
"Bowman, ND, USA",03-24-2020,Confirmed,0,,46.11285362,-103.5203343,USA,ND,03-24-2020.csv,Bowman,38011,2020-03-24T23:37:31Z,62,249
"Box Butte, NE, USA",03-22-2020,Active,0,,42.22079243,-103.0878834,USA,NE,03-22-2020.csv,Box Butte,31013,2020-03-22T23:45:00Z,60,2220
"Box Elder, UT, USA",03-27-2020,Confirmed,0,,41.52106798,-113.08328159999999,USA,UT,03-27-2020.csv,Box Elder,49003,2020-03-27T22:14:55Z,65,251
"Boyd, KY, USA",03-28-2020,Deaths,0,,38.36176608,-82.68652187,USA,KY,03-28-2020.csv,Boyd,21019,2020-03-28T23:05:37Z,66,252
"Boyd, NE, USA",03-25-2020,Confirmed,0,,42.899727399999996,-98.76486568,USA,NE,03-25-2020.csv,Boyd,31015,2020-03-25T23:33:19Z,63,253
"Boyle, KY, USA",03-22-2020,Confirmed,0,,37.62680923,-84.8633779,USA,KY,03-22-2020.csv,Boyle,21021,2020-03-22T23:45:00Z,60,1794
"Bracken, KY, USA",03-28-2020,Active,0,,38.69158994,-84.08532444,USA,KY,03-28-2020.csv,Bracken,21023,2020-03-28T23:05:37Z,66,255
"Bradford, FL, USA",03-22-2020,Recovered,0,,29.95079741,-82.16611613,USA,FL,03-22-2020.csv,Bradford,12007,2020-03-22T23:45:00Z,60,244
"Bradford, PA, USA",03-24-2020,Confirmed,1,,41.78869215,-76.51570822,USA,PA,03-24-2020.csv,Bradford,42015,2020-03-24T23:37:31Z,62,257
"Bradley, AR, USA",03-30-2020,Recovered,0,,33.46755808,-92.15980837,USA,AR,03-30-2020.csv,Bradley,05011,2020-03-30T22:52:45Z,68,258
"Bradley, TN, USA",03-23-2020,Confirmed,1,,35.15739424,-84.857186,USA,TN,03-23-2020.csv,Bradley,47011,2020-03-23T23:19:34Z,61,259
"Branch, MI, USA",03-27-2020,Active,0,,41.91600556,-85.05929476,USA,MI,03-27-2020.csv,Branch,26023,2020-03-27T22:14:55Z,65,260
"Brantley, GA, USA",03-30-2020,Active,0,,31.19576557,-81.97743999,USA,GA,03-30-2020.csv,Brantley,13025,2020-03-30T22:52:45Z,68,261
"Braxton, WV, USA",03-22-2020,Deaths,0,,38.70036159,-80.72011184,USA,WV,03-22-2020.csv,Braxton,54007,2020-03-22T23:45:00Z,60,3072
Brazil,03-21-2020,Confirmed,1021,,-14.2350,-51.9253,Brazil,,03-21-2020.csv,,,2020-03-21T17:43:03Z,59,24
"Brazoria, TX, USA",03-23-2020,Confirmed,16,,29.18757369,-95.44563172,USA,TX,03-23-2020.csv,Brazoria,48039,2020-03-23T23:19:34Z,61,263
"Brazos, TX, USA",03-29-2020,Deaths,2,,30.663644800000004,-96.30205577,USA,TX,03-29-2020.csv,Brazos,48041,2020-03-29T23:08:25Z,67,264
"Breathitt, KY, USA",03-27-2020,Deaths,0,,37.52333168,-83.31959161,USA,KY,03-27-2020.csv,Breathitt,21025,2020-03-27T22:14:55Z,65,265
"Breckinridge, KY, USA",03-24-2020,Confirmed,0,,37.77377239,-86.42885017,USA,KY,03-24-2020.csv,Breckinridge,21027,2020-03-24T23:37:31Z,62,266
"Bremer, IA, USA",03-28-2020,Deaths,0,,42.77461496,-92.31795937,USA,IA,03-28-2020.csv,Bremer,19017,2020-03-28T23:05:37Z,66,267
"Brevard, FL, USA",03-27-2020,Active,16,,28.29409504,-80.73091022,USA,FL,03-27-2020.csv,Brevard,12009,2020-03-27T22:14:55Z,65,268
"Brewster, TX, USA",03-28-2020,Recovered,0,,29.81008251,-103.25203259999999,USA,TX,03-28-2020.csv,Brewster,48043,2020-03-28T23:05:37Z,66,269
"Briscoe, TX, USA",03-29-2020,Active,0,,34.53026962,-101.2084947,USA,TX,03-29-2020.csv,Briscoe,48045,2020-03-29T23:08:25Z,67,270
"Bristol Bay, AK, USA",03-22-2020,Recovered,0,,58.74513976,-156.701064,USA,AK,03-22-2020.csv,Bristol Bay,2060,2020-03-22T23:45:00Z,60,1209
"Bristol, MA, USA",03-24-2020,Active,31,,41.79228404,-71.10872211,USA,MA,03-24-2020.csv,Bristol,25005,2020-03-24T23:37:31Z,62,271
"Bristol, RI, USA",03-26-2020,Confirmed,6,,41.71018079,-71.28652315,USA,RI,03-26-2020.csv,Bristol,44001,2020-03-26T23:48:35Z,64,272
"Bristol, VA, USA",03-23-2020,Confirmed,0,,36.616302399999995,-82.16359122,USA,VA,03-23-2020.csv,Bristol,51520,2020-03-23T23:19:34Z,61,273
"British Columbia, Canada",03-10-2020,Active,27,,53.7267,-127.6476,Canada,British Columbia,03-10-2020.csv,,,2020-03-09T22:43:25Z,48,73
"British Virgin Islands, United Kingdom",03-29-2020,Confirmed,2,,18.4207,-64.64,United Kingdom,British Virgin Islands,03-29-2020.csv,,,2020-03-29T23:08:13Z,67,3183
"Broadwater, MT, USA",03-26-2020,Deaths,0,,46.33277565,-111.49558130000001,USA,MT,03-26-2020.csv,Broadwater,30007,2020-03-26T23:48:35Z,64,275
"Bronx, NY, USA",03-26-2020,Deaths,0,,40.85209301,-73.86282755,USA,NY,03-26-2020.csv,Bronx,36005,2020-03-26T23:48:35Z,64,276
"Brooke, WV, USA",03-24-2020,Deaths,0,,40.27367263,-80.57915332,USA,WV,03-24-2020.csv,Brooke,54009,2020-03-24T23:37:31Z,62,277
"Brookings, SD, USA",03-29-2020,Active,1,,44.36974375,-96.79079945,USA,SD,03-29-2020.csv,Brookings,46011,2020-03-29T23:08:25Z,67,278
"Brooks, GA, USA",03-27-2020,Recovered,0,,30.83922642,-83.58303423,USA,GA,03-27-2020.csv,Brooks,13027,2020-03-27T22:14:55Z,65,279
"Brooks, TX, USA",03-22-2020,Active,0,,27.03103197,-98.21808402,USA,TX,03-22-2020.csv,Brooks,48047,2020-03-22T23:45:00Z,60,2761
"Broome, NY, USA",03-30-2020,Recovered,0,,42.15903158,-75.81326086,USA,NY,03-30-2020.csv,Broome,36007,2020-03-30T22:52:45Z,68,281
"Broomfield, CO, USA",03-29-2020,Confirmed,17,,39.95998787,-105.0566324,USA,CO,03-29-2020.csv,Broomfield,08014,2020-03-29T23:08:25Z,67,282
"Broward, FL, USA",03-28-2020,Recovered,0,,26.15184651,-80.48725556,USA,FL,03-28-2020.csv,Broward,12011,2020-03-28T23:05:37Z,66,283
"Brown, IL, USA",03-26-2020,Recovered,0,,39.96209138,-90.75068024,USA,IL,03-26-2020.csv,Brown,17009,2020-03-26T23:48:35Z,64,284
"Brown, IN, USA",03-23-2020,Active,0,,39.19605589,-86.22868909,USA,IN,03-23-2020.csv,Brown,18013,2020-03-23T23:19:34Z,61,285
"Brown, KS, USA",03-24-2020,Active,0,,39.82652589,-95.56421698,USA,KS,03-24-2020.csv,Brown,20013,2020-03-24T23:37:31Z,62,286
"Brown, MN, USA",03-28-2020,Active,0,,44.24205652,-94.72562874,USA,MN,03-28-2020.csv,Brown,27015,2020-03-28T23:05:37Z,66,287
"Brown, NE, USA",03-28-2020,Deaths,0,,42.43018907,-99.92904055,USA,NE,03-28-2020.csv,Brown,31017,2020-03-28T23:05:37Z,66,288
"Brown, OH, USA",03-29-2020,Recovered,0,,38.93416837,-83.86788395,USA,OH,03-29-2020.csv,Brown,39015,2020-03-29T23:08:25Z,67,289
"Brown, SD, USA",03-27-2020,Active,2,,45.58994323,-98.35165355,USA,SD,03-27-2020.csv,Brown,46013,2020-03-27T22:14:55Z,65,290
"Brown, TX, USA",03-24-2020,Recovered,0,,31.77430356,-98.99907113,USA,TX,03-24-2020.csv,Brown,48049,2020-03-24T23:37:31Z,62,291
"Brown, WI, USA",03-24-2020,Recovered,0,,44.452655299999996,-88.00411844,USA,WI,03-24-2020.csv,Brown,55009,2020-03-24T23:37:31Z,62,292
"Brule, SD, USA",03-24-2020,Confirmed,0,,43.71756379,-99.08118954,USA,SD,03-24-2020.csv,Brule,46015,2020-03-24T23:37:31Z,62,293
Brunei,03-14-2020,Deaths,0,,4.5353,114.7277,Brunei,,03-14-2020.csv,,,2020-03-14T20:33:03Z,52,100
"Brunswick, NC, USA",03-28-2020,Active,12,,34.070565,-78.22814204,USA,NC,03-28-2020.csv,Brunswick,37019,2020-03-28T23:05:37Z,66,294
"Brunswick, VA, USA",03-24-2020,Active,0,,36.76366949,-77.8593436,USA,VA,03-24-2020.csv,Brunswick,51025,2020-03-24T23:37:31Z,62,295
"Bryan, GA, USA",03-25-2020,Confirmed,2,,32.00979311,-81.44002948,USA,GA,03-25-2020.csv,Bryan,13029,2020-03-25T23:33:19Z,63,296
"Bryan, OK, USA",03-24-2020,Recovered,0,,33.96472458,-96.25903472,USA,OK,03-24-2020.csv,Bryan,40013,2020-03-24T23:37:31Z,62,297
"Buchanan, IA, USA",03-25-2020,Deaths,0,,42.4709188,-91.83510825,USA,IA,03-25-2020.csv,Buchanan,19019,2020-03-25T23:33:19Z,63,298
"Buchanan, MO, USA",03-28-2020,Recovered,0,,39.65816401,-94.80138942,USA,MO,03-28-2020.csv,Buchanan,29021,2020-03-28T23:05:37Z,66,299
"Buchanan, VA, USA",03-26-2020,Recovered,0,,37.26818323,-82.03749726,USA,VA,03-26-2020.csv,Buchanan,51027,2020-03-26T23:48:35Z,64,300
"Buckingham, VA, USA",03-28-2020,Recovered,0,,37.57242268,-78.52518834,USA,VA,03-28-2020.csv,Buckingham,51029,2020-03-28T23:05:37Z,66,301
"Bucks, PA, USA",03-30-2020,Confirmed,249,,40.33682119,-75.10836643,USA,PA,03-30-2020.csv,Bucks,42017,2020-03-30T22:52:45Z,68,302
"Buena Vista, IA, USA",03-29-2020,Active,0,,42.73545875,-95.15100162,USA,IA,03-29-2020.csv,Buena Vista,19021,2020-03-29T23:08:25Z,67,303
"Buena Vista, VA, USA",03-29-2020,Recovered,0,,37.73484642,-79.35296097,USA,VA,03-29-2020.csv,Buena Vista,51530,2020-03-29T23:08:25Z,67,304
"Buffalo, NE, USA",03-29-2020,Confirmed,5,,40.85486962,-99.07500296,USA,NE,03-29-2020.csv,Buffalo,31019,2020-03-29T23:08:25Z,67,305
"Buffalo, SD, USA",03-30-2020,Deaths,0,,44.07657829,-99.20814467,USA,SD,03-30-2020.csv,Buffalo,46017,2020-03-30T22:52:45Z,68,306
"Buffalo, WI, USA",03-24-2020,Active,0,,44.37835084,-91.75332578,USA,WI,03-24-2020.csv,Buffalo,55011,2020-03-24T23:37:31Z,62,307
Bulgaria,03-08-2020,Active,4,,42.7339,25.4858,Bulgaria,,03-08-2020.csv,,,2020-03-08T11:13:17Z,46,124
"Bullitt, KY, USA",03-29-2020,Active,2,,37.97162523,-85.68955617,USA,KY,03-29-2020.csv,Bullitt,21029,2020-03-29T23:08:25Z,67,308
"Bulloch, GA, USA",03-25-2020,Deaths,0,,32.39577406,-81.74811421,USA,GA,03-25-2020.csv,Bulloch,13031,2020-03-25T23:33:19Z,63,309
"Bullock, AL, USA",03-28-2020,Active,3,,32.10030533,-85.71265535,USA,AL,03-28-2020.csv,Bullock,01011,2020-03-28T23:05:37Z,66,310
"Buncombe, NC, USA",03-27-2020,Active,15,,35.61113393,-82.53305,USA,NC,03-27-2020.csv,Buncombe,37021,2020-03-27T22:14:55Z,65,311
"Bureau, IL, USA",03-24-2020,Deaths,0,,41.40385234,-89.5283051,USA,IL,03-24-2020.csv,Bureau,17011,2020-03-24T23:37:31Z,62,312
"Burke, GA, USA",03-25-2020,Confirmed,1,,33.05917989,-81.99928721,USA,GA,03-25-2020.csv,Burke,13033,2020-03-25T23:33:19Z,63,313
"Burke, NC, USA",03-27-2020,Confirmed,3,,35.74989637,-81.70755735,USA,NC,03-27-2020.csv,Burke,37023,2020-03-27T22:14:55Z,65,314
"Burke, ND, USA",03-29-2020,Active,0,,48.79094471,-102.51821170000001,USA,ND,03-29-2020.csv,Burke,38013,2020-03-29T23:08:25Z,67,315
Burkina Faso,03-30-2020,Active,203,,12.2383,-1.5616,Burkina Faso,,03-30-2020.csv,,,2020-03-30T22:52:33Z,68,3290
"Burleigh, ND, USA",03-22-2020,Recovered,0,,46.97847375,-100.4645214,USA,ND,03-22-2020.csv,Burleigh,38015,2020-03-22T23:45:00Z,60,1121
"Burleson, TX, USA",03-29-2020,Deaths,0,,30.49273808,-96.62158484,USA,TX,03-29-2020.csv,Burleson,48051,2020-03-29T23:08:25Z,67,317
"Burlington, NJ, USA",03-30-2020,Recovered,0,,39.87681124,-74.66927768,USA,NJ,03-30-2020.csv,Burlington,34005,2020-03-30T22:52:45Z,68,318
Burma,03-27-2020,Deaths,0,,21.9162,95.956,Burma,,03-27-2020.csv,,,2020-03-27T23:23:03Z,65,3282
"Burnet, TX, USA",03-27-2020,Active,1,,30.78801353,-98.181887,USA,TX,03-27-2020.csv,Burnet,48053,2020-03-27T22:14:55Z,65,319
"Burnett, WI, USA",03-26-2020,Active,0,,45.86303537,-92.36711412,USA,WI,03-26-2020.csv,Burnett,55013,2020-03-26T23:48:35Z,64,320
"Burt, NE, USA",03-25-2020,Confirmed,0,,41.85056773,-96.32605633,USA,NE,03-25-2020.csv,Burt,31021,2020-03-25T23:33:19Z,63,321
"Butler, AL, USA",03-27-2020,Recovered,0,,31.75300095,-86.68057478,USA,AL,03-27-2020.csv,Butler,01013,2020-03-27T22:14:55Z,65,322
"Butler, IA, USA",03-26-2020,Deaths,0,,42.73172833,-92.79015971,USA,IA,03-26-2020.csv,Butler,19023,2020-03-26T23:48:35Z,64,323
"Butler, KS, USA",03-30-2020,Recovered,0,,37.78134351,-96.83878537,USA,KS,03-30-2020.csv,Butler,20015,2020-03-30T22:52:45Z,68,324
"Butler, KY, USA",03-29-2020,Recovered,0,,37.20946153,-86.68748787,USA,KY,03-29-2020.csv,Butler,21031,2020-03-29T23:08:25Z,67,325
"Butler, MO, USA",03-24-2020,Active,0,,36.71462476,-90.40421163,USA,MO,03-24-2020.csv,Butler,29023,2020-03-24T23:37:31Z,62,326
"Butler, NE, USA",03-22-2020,Recovered,0,,41.22703692,-97.13106306,USA,NE,03-22-2020.csv,Butler,31023,2020-03-22T23:45:00Z,60,2224
"Butler, OH, USA",03-28-2020,Active,25,,39.44012838,-84.57388716,USA,OH,03-28-2020.csv,Butler,39017,2020-03-28T23:05:37Z,66,328
"Butler, PA, USA",03-30-2020,Confirmed,49,,40.91152759,-79.91351055,USA,PA,03-30-2020.csv,Butler,42019,2020-03-30T22:52:45Z,68,329
"Butte, CA, USA",03-27-2020,Confirmed,5,,39.66727762,-121.6005252,USA,CA,03-27-2020.csv,Butte,06007,2020-03-27T22:14:55Z,65,330
"Butte, ID, USA",03-28-2020,Deaths,0,,43.72592209,-113.1735463,USA,ID,03-28-2020.csv,Butte,16023,2020-03-28T23:05:37Z,66,331
"Butte, SD, USA",03-23-2020,Active,0,,44.90608745,-103.5079318,USA,SD,03-23-2020.csv,Butte,46019,2020-03-23T23:19:34Z,61,332
"Butts, GA, USA",03-22-2020,Active,1,,33.2830945,-83.9543504,USA,GA,03-22-2020.csv,Butts,13035,2020-03-22T23:45:00Z,60,416
"CA, USA",03-19-2020,Active,934,,36.1162,-119.6816,USA,CA,03-19-2020.csv,,,2020-03-19T21:13:40Z,57,22
"Cabarrus, NC, USA",03-22-2020,Recovered,0,,35.3877799,-80.55267168,USA,NC,03-22-2020.csv,Cabarrus,37025,2020-03-22T23:45:00Z,60,612
"Cabell, WV, USA",03-22-2020,Active,0,,38.42424062,-82.23855912,USA,WV,03-22-2020.csv,Cabell,54011,2020-03-22T23:45:00Z,60,3074
Cabo Verde,03-28-2020,Active,4,,16.5388,-23.0418,Cabo Verde,,03-28-2020.csv,,,2020-03-28T23:05:25Z,66,3283
"Cache, UT, USA",03-23-2020,Recovered,0,,41.72330587,-111.74436670000001,USA,UT,03-23-2020.csv,Cache,49005,2020-03-23T23:19:34Z,61,336
"Caddo, LA, USA",03-27-2020,Deaths,2,,32.57991587,-93.88375652,USA,LA,03-27-2020.csv,Caddo,22017,2020-03-27T22:14:55Z,65,337
"Caddo, OK, USA",03-24-2020,Confirmed,0,,35.17364557,-98.37534464,USA,OK,03-24-2020.csv,Caddo,40015,2020-03-24T23:37:31Z,62,338
"Calaveras, CA, USA",03-29-2020,Deaths,0,,38.20537103,-120.55291299999999,USA,CA,03-29-2020.csv,Calaveras,06009,2020-03-29T23:08:25Z,67,339
"Calcasieu, LA, USA",03-23-2020,Recovered,0,,30.22931235,-93.35400434,USA,LA,03-23-2020.csv,Calcasieu,22019,2020-03-23T23:19:34Z,61,340
"Caldwell, KY, USA",03-30-2020,Active,0,,37.14749129,-87.86948214,USA,KY,03-30-2020.csv,Caldwell,21033,2020-03-30T22:52:45Z,68,341
"Caldwell, LA, USA",03-22-2020,Deaths,0,,32.0902519,-92.11752148,USA,LA,03-22-2020.csv,Caldwell,22021,2020-03-22T23:45:00Z,60,1888
"Caldwell, MO, USA",03-26-2020,Active,0,,39.65620858,-93.98308093,USA,MO,03-26-2020.csv,Caldwell,29025,2020-03-26T23:48:35Z,64,343
"Caldwell, NC, USA",03-22-2020,Recovered,0,,35.95204977,-81.54799522,USA,NC,03-22-2020.csv,Caldwell,37027,2020-03-22T23:45:00Z,60,2367
"Caldwell, TX, USA",03-25-2020,Active,0,,29.83668859,-97.61814775,USA,TX,03-25-2020.csv,Caldwell,48055,2020-03-25T23:33:19Z,63,345
"Caledonia, VT, USA",03-29-2020,Recovered,0,,44.46548598,-72.10314651,USA,VT,03-29-2020.csv,Caledonia,50005,2020-03-29T23:08:25Z,67,346
"Calgary, Alberta, Canada",03-07-2020,Deaths,0,,51.0447,-114.0719,Canada,Alberta,03-07-2020.csv,Calgary,,2020-03-06T13:13:34Z,45,159
"Calhoun, AL, USA",03-29-2020,Confirmed,3,,33.77483727,-85.82630386,USA,AL,03-29-2020.csv,Calhoun,01015,2020-03-29T23:08:25Z,67,347
"Calhoun, AR, USA",03-24-2020,Recovered,0,,33.55598792,-92.49974403,USA,AR,03-24-2020.csv,Calhoun,05013,2020-03-24T23:37:31Z,62,348
"Calhoun, FL, USA",03-23-2020,Recovered,0,,30.40666734,-85.19394153,USA,FL,03-23-2020.csv,Calhoun,12013,2020-03-23T23:19:34Z,61,349
"Calhoun, GA, USA",03-25-2020,Active,0,,31.53169785,-84.62725131,USA,GA,03-25-2020.csv,Calhoun,13037,2020-03-25T23:33:19Z,63,350
"Calhoun, IA, USA",03-30-2020,Recovered,0,,42.38521079,-94.64046046,USA,IA,03-30-2020.csv,Calhoun,19025,2020-03-30T22:52:45Z,68,352
"Calhoun, IL, USA",03-30-2020,Confirmed,0,,39.16840183,-90.66330078,USA,IL,03-30-2020.csv,Calhoun,17013,2020-03-30T22:52:45Z,68,351
"Calhoun, MI, USA",03-25-2020,Confirmed,6,,42.24633834,-85.00493569,USA,MI,03-25-2020.csv,Calhoun,26025,2020-03-25T23:33:19Z,63,353
"Calhoun, MS, USA",03-23-2020,Active,0,,33.93683395,-89.33686647,USA,MS,03-23-2020.csv,Calhoun,28013,2020-03-23T23:19:34Z,61,354
"Calhoun, SC, USA",03-28-2020,Recovered,0,,33.66926881,-80.77722168,USA,SC,03-28-2020.csv,Calhoun,45017,2020-03-28T23:05:37Z,66,355
"Calhoun, TX, USA",03-26-2020,Recovered,0,,28.47048236,-96.61633945,USA,TX,03-26-2020.csv,Calhoun,48057,2020-03-26T23:48:35Z,64,356
"Calhoun, WV, USA",03-26-2020,Recovered,0,,38.84315422,-81.11934872,USA,WV,03-26-2020.csv,Calhoun,54013,2020-03-26T23:48:35Z,64,357
"Callahan, TX, USA",03-22-2020,Deaths,0,,32.29760619,-99.37326312,USA,TX,03-22-2020.csv,Callahan,48059,2020-03-22T23:45:00Z,60,2765
"Callaway, MO, USA",03-28-2020,Deaths,0,,38.83674754,-91.92186505,USA,MO,03-28-2020.csv,Callaway,29027,2020-03-28T23:05:37Z,66,359
"Calloway, KY, USA",03-27-2020,Active,1,,36.62093411,-88.2731593,USA,KY,03-27-2020.csv,Calloway,21035,2020-03-27T22:14:55Z,65,360
"Calumet, WI, USA",03-25-2020,Active,1,,44.0816316,-88.21780273,USA,WI,03-25-2020.csv,Calumet,55015,2020-03-25T23:33:19Z,63,361
"Calvert, MD, USA",03-30-2020,Confirmed,12,,38.53961642,-76.56820632,USA,MD,03-30-2020.csv,Calvert,24009,2020-03-30T22:52:45Z,68,362
"Camas, ID, USA",03-29-2020,Active,0,,43.46665742,-114.8065892,USA,ID,03-29-2020.csv,Camas,16025,2020-03-29T23:08:25Z,67,363
Cambodia,03-20-2020,Active,50,,12.5657,104.9910,Cambodia,,03-20-2020.csv,,,2020-03-20T15:43:24Z,58,154
"Cambria, PA, USA",03-22-2020,Deaths,0,,40.49527404,-78.71377428,USA,PA,03-22-2020.csv,Cambria,42021,2020-03-22T23:45:00Z,60,2589
"Camden, GA, USA",03-26-2020,Active,2,,30.92951916,-81.66601818,USA,GA,03-26-2020.csv,Camden,13039,2020-03-26T23:48:35Z,64,365
"Camden, MO, USA",03-30-2020,Active,10,,38.02199522,-92.76083747,USA,MO,03-30-2020.csv,Camden,29029,2020-03-30T22:52:45Z,68,366
"Camden, NC, USA",03-23-2020,Active,0,,36.33804939,-76.15568396,USA,NC,03-23-2020.csv,Camden,37029,2020-03-23T23:19:34Z,61,368
"Camden, NJ, USA",03-25-2020,Confirmed,61,,39.80343818,-74.96388753,USA,NJ,03-25-2020.csv,Camden,34007,2020-03-25T23:33:19Z,63,367
"Cameron, LA, USA",03-23-2020,Active,0,,29.87592238,-93.19310676,USA,LA,03-23-2020.csv,Cameron,22023,2020-03-23T23:19:34Z,61,369
"Cameron, PA, USA",03-24-2020,Recovered,0,,41.43625568,-78.20376845,USA,PA,03-24-2020.csv,Cameron,42023,2020-03-24T23:37:31Z,62,370
"Cameron, TX, USA",03-26-2020,Confirmed,10,,26.14524221,-97.48140372,USA,TX,03-26-2020.csv,Cameron,48061,2020-03-26T23:48:35Z,64,371
Cameroon,03-08-2020,Deaths,0,,3.8480,11.5021,Cameroon,,03-08-2020.csv,,,2020-03-08T05:23:03Z,46,151
"Camp, TX, USA",03-30-2020,Recovered,0,,32.97195142,-94.97790104,USA,TX,03-30-2020.csv,Camp,48063,2020-03-30T22:52:45Z,68,372
"Campbell, KY, USA",03-28-2020,Recovered,0,,38.94384345,-84.37875208,USA,KY,03-28-2020.csv,Campbell,21037,2020-03-28T23:05:37Z,66,373
"Campbell, SD, USA",03-23-2020,Active,0,,45.77074915,-100.0510181,USA,SD,03-23-2020.csv,Campbell,46021,2020-03-23T23:19:34Z,61,374
"Campbell, TN, USA",03-29-2020,Recovered,0,,36.40355516,-84.15108559999999,USA,TN,03-29-2020.csv,Campbell,47013,2020-03-29T23:08:25Z,67,375
"Campbell, VA, USA",03-26-2020,Confirmed,0,,37.20553386,-79.09678609,USA,VA,03-26-2020.csv,Campbell,51031,2020-03-26T23:48:35Z,64,376
"Campbell, WY, USA",03-26-2020,Confirmed,1,,44.24886082,-105.54744040000001,USA,WY,03-26-2020.csv,Campbell,56005,2020-03-26T23:48:35Z,64,377
"Canadian, OK, USA",03-28-2020,Active,11,,35.5426055,-97.98465569,USA,OK,03-28-2020.csv,Canadian,40017,2020-03-28T23:05:37Z,66,378
"Candler, GA, USA",03-29-2020,Deaths,0,,32.40209349,-82.07702563,USA,GA,03-29-2020.csv,Candler,13043,2020-03-29T23:08:25Z,67,379
"Cannon, TN, USA",03-24-2020,Active,0,,35.80990797,-86.05738983,USA,TN,03-24-2020.csv,Cannon,47015,2020-03-24T23:37:31Z,62,380
"Canyon, ID, USA",03-24-2020,Active,5,,43.61970148,-116.70954990000001,USA,ID,03-24-2020.csv,Canyon,16027,2020-03-24T23:37:31Z,62,381
"Cape Girardeau, MO, USA",03-29-2020,Deaths,0,,37.38489388,-89.6843587,USA,MO,03-29-2020.csv,Cape Girardeau,29031,2020-03-29T23:08:25Z,67,382
"Cape May, NJ, USA",03-27-2020,Recovered,0,,39.15008829,-74.80170244,USA,NJ,03-27-2020.csv,Cape May,34009,2020-03-27T22:14:55Z,65,383
Cape Verde,03-21-2020,Active,1,,15.1111,-23.6167,Cape Verde,,03-21-2020.csv,,,2020-03-21T23:43:02Z,59,271
"Carbon, MT, USA",03-23-2020,Confirmed,0,,45.22850116,-109.0274047,USA,MT,03-23-2020.csv,Carbon,30009,2020-03-23T23:19:34Z,61,384
"Carbon, PA, USA",03-28-2020,Confirmed,3,,40.91545395,-75.7068525,USA,PA,03-28-2020.csv,Carbon,42025,2020-03-28T23:05:37Z,66,385
"Carbon, UT, USA",03-26-2020,Active,0,,39.64834818,-110.58725120000001,USA,UT,03-26-2020.csv,Carbon,49007,2020-03-26T23:48:35Z,64,386
"Carbon, WY, USA",03-23-2020,Confirmed,1,,41.69357844,-106.9326084,USA,WY,03-23-2020.csv,Carbon,56007,2020-03-23T23:19:34Z,61,387
"Caribou, ID, USA",03-23-2020,Confirmed,0,,42.77149116,-111.5597683,USA,ID,03-23-2020.csv,Caribou,16029,2020-03-23T23:19:34Z,61,388
"Carlisle, KY, USA",03-26-2020,Deaths,0,,36.85372876,-88.96692220000001,USA,KY,03-26-2020.csv,Carlisle,21039,2020-03-26T23:48:35Z,64,389
"Carlton, MN, USA",03-25-2020,Deaths,0,,46.59180601,-92.67601019,USA,MN,03-25-2020.csv,Carlton,27017,2020-03-25T23:33:19Z,63,390
"Caroline, MD, USA",03-29-2020,Confirmed,3,,38.87172293,-75.82904158,USA,MD,03-29-2020.csv,Caroline,24011,2020-03-29T23:08:25Z,67,391
"Caroline, VA, USA",03-24-2020,Active,0,,38.02679129,-77.34901405,USA,VA,03-24-2020.csv,Caroline,51033,2020-03-24T23:37:31Z,62,392
"Carroll, AR, USA",03-28-2020,Confirmed,0,,36.34038560000001,-93.54270261,USA,AR,03-28-2020.csv,Carroll,05015,2020-03-28T23:05:37Z,66,393
"Carroll, GA, USA",03-26-2020,Recovered,0,,33.58138199,-85.07976677,USA,GA,03-26-2020.csv,Carroll,13045,2020-03-26T23:48:35Z,64,394
"Carroll, IA, USA",03-24-2020,Confirmed,1,,42.03617207,-94.86032705,USA,IA,03-24-2020.csv,Carroll,19027,2020-03-24T23:37:31Z,62,397
"Carroll, IL, USA",03-22-2020,Deaths,0,,42.06823429,-89.93395545,USA,IL,03-22-2020.csv,Carroll,17015,2020-03-22T23:45:00Z,60,1503
"Carroll, IN, USA",03-28-2020,Deaths,0,,40.580783200000006,-86.56198812,USA,IN,03-28-2020.csv,Carroll,18015,2020-03-28T23:05:37Z,66,396
"Carroll, KY, USA",03-25-2020,Active,0,,38.66599534,-85.12601074,USA,KY,03-25-2020.csv,Carroll,21041,2020-03-25T23:33:19Z,63,398
"Carroll, MD, USA",03-30-2020,Recovered,0,,39.56453592,-77.02373735,USA,MD,03-30-2020.csv,Carroll,24013,2020-03-30T22:52:45Z,68,399
"Carroll, MO, USA",03-28-2020,Confirmed,0,,39.42762566,-93.50626255,USA,MO,03-28-2020.csv,Carroll,29033,2020-03-28T23:05:37Z,66,401
"Carroll, MS, USA",03-27-2020,Recovered,0,,33.44834567,-89.91994479,USA,MS,03-27-2020.csv,Carroll,28015,2020-03-27T22:14:55Z,65,400
"Carroll, NH, USA",03-25-2020,Active,7,,43.87498583,-71.20430216,USA,NH,03-25-2020.csv,Carroll,33003,2020-03-25T23:33:19Z,63,402
"Carroll, OH, USA",03-29-2020,Recovered,0,,40.578968599999996,-81.09178213,USA,OH,03-29-2020.csv,Carroll,39019,2020-03-29T23:08:25Z,67,403
"Carroll, TN, USA",03-23-2020,Active,2,,35.97366108,-88.45189331,USA,TN,03-23-2020.csv,Carroll,47017,2020-03-23T23:19:34Z,61,404
"Carroll, VA, USA",03-22-2020,Confirmed,0,,36.73066666,-80.73455942,USA,VA,03-22-2020.csv,Carroll,51035,2020-03-22T23:45:00Z,60,2978
"Carson City, NV, USA",03-28-2020,Active,5,,39.15509045,-119.7480219,USA,NV,03-28-2020.csv,Carson City,32510,2020-03-28T23:05:37Z,66,407
"Carson, TX, USA",03-26-2020,Active,0,,35.40365929,-101.35426690000001,USA,TX,03-26-2020.csv,Carson,48065,2020-03-26T23:48:35Z,64,406
"Carter, KY, USA",03-26-2020,Recovered,0,,38.31690743,-83.05092385,USA,KY,03-26-2020.csv,Carter,21043,2020-03-26T23:48:35Z,64,408
"Carter, MO, USA",03-29-2020,Active,2,,36.94160441,-90.96051322,USA,MO,03-29-2020.csv,Carter,29035,2020-03-29T23:08:25Z,67,409
"Carter, MT, USA",03-26-2020,Confirmed,0,,45.5197966,-104.53955359999999,USA,MT,03-26-2020.csv,Carter,30011,2020-03-26T23:48:35Z,64,410
"Carter, OK, USA",03-22-2020,Deaths,0,,34.25103751,-97.28552485,USA,OK,03-22-2020.csv,Carter,40019,2020-03-22T23:45:00Z,60,2513
"Carter, TN, USA",03-23-2020,Deaths,0,,36.28969086,-82.12588974,USA,TN,03-23-2020.csv,Carter,47019,2020-03-23T23:19:34Z,61,412
"Carteret, NC, USA",03-30-2020,Recovered,0,,34.8932941,-76.54120135,USA,NC,03-30-2020.csv,Carteret,37031,2020-03-30T22:52:45Z,68,413
"Carver, MN, USA",03-25-2020,Active,8,,44.82017001,-93.80099179999999,USA,MN,03-25-2020.csv,Carver,27019,2020-03-25T23:33:19Z,63,414
"Cascade, MT, USA",03-25-2020,Confirmed,3,,47.30797024,-111.3467922,USA,MT,03-25-2020.csv,Cascade,30013,2020-03-25T23:33:19Z,63,415
"Casey, KY, USA",03-29-2020,Deaths,0,,37.32533118,-84.92726209,USA,KY,03-29-2020.csv,Casey,21045,2020-03-29T23:08:25Z,67,416
"Cass, IA, USA",03-28-2020,Deaths,0,,41.33149454,-94.92792482,USA,IA,03-28-2020.csv,Cass,19029,2020-03-28T23:05:37Z,66,419
"Cass, IL, USA",03-28-2020,Confirmed,0,,39.96991073,-90.24734436,USA,IL,03-28-2020.csv,Cass,17017,2020-03-28T23:05:37Z,66,417
"Cass, IN, USA",03-23-2020,Confirmed,0,,40.76135835,-86.34830753,USA,IN,03-23-2020.csv,Cass,18017,2020-03-23T23:19:34Z,61,418
"Cass, MI, USA",03-25-2020,Active,0,,41.91522292,-85.99405727,USA,MI,03-25-2020.csv,Cass,26027,2020-03-25T23:33:19Z,63,420
"Cass, MN, USA",03-26-2020,Recovered,0,,46.95043611,-94.32603968,USA,MN,03-26-2020.csv,Cass,27021,2020-03-26T23:48:35Z,64,421
"Cass, MO, USA",03-30-2020,Recovered,0,,38.64789422,-94.353399,USA,MO,03-30-2020.csv,Cass,29037,2020-03-30T22:52:45Z,68,422
"Cass, ND, USA",03-23-2020,Deaths,0,,46.93201724,-97.24447190000001,USA,ND,03-23-2020.csv,Cass,38017,2020-03-23T23:19:34Z,61,424
"Cass, NE, USA",03-26-2020,Active,2,,40.90899107,-96.13971217,USA,NE,03-26-2020.csv,Cass,31025,2020-03-26T23:48:35Z,64,423
"Cass, TX, USA",03-23-2020,Active,0,,33.07499881,-94.34646905,USA,TX,03-23-2020.csv,Cass,48067,2020-03-23T23:19:34Z,61,425
"Cassia, ID, USA",03-26-2020,Active,1,,42.28347888,-113.6012409,USA,ID,03-26-2020.csv,Cassia,16031,2020-03-26T23:48:35Z,64,426
"Castro, TX, USA",03-26-2020,Active,6,,34.53016752,-102.2617243,USA,TX,03-26-2020.csv,Castro,48069,2020-03-26T23:48:35Z,64,427
"Caswell, NC, USA",03-29-2020,Active,1,,36.39312665,-79.33353281,USA,NC,03-29-2020.csv,Caswell,37033,2020-03-29T23:08:25Z,67,428
"Catahoula, LA, USA",03-24-2020,Active,0,,31.66778967,-91.84526385,USA,LA,03-24-2020.csv,Catahoula,22025,2020-03-24T23:37:31Z,62,429
"Catawba, NC, USA",03-25-2020,Recovered,0,,35.66211129,-81.2132617,USA,NC,03-25-2020.csv,Catawba,37035,2020-03-25T23:33:19Z,63,430
"Catoosa, GA, USA",03-27-2020,Recovered,0,,34.89872298,-85.13757014,USA,GA,03-27-2020.csv,Catoosa,13047,2020-03-27T22:14:55Z,65,431
"Catron, NM, USA",03-25-2020,Active,0,,33.91514144,-108.4046587,USA,NM,03-25-2020.csv,Catron,35003,2020-03-25T23:33:19Z,63,432
"Cattaraugus, NY, USA",03-25-2020,Active,0,,42.24778241,-78.67923096,USA,NY,03-25-2020.csv,Cattaraugus,36009,2020-03-25T23:33:19Z,63,433
"Cavalier, ND, USA",03-29-2020,Active,0,,48.77286211,-98.46685243,USA,ND,03-29-2020.csv,Cavalier,38019,2020-03-29T23:08:25Z,67,434
Cayman Islands,03-13-2020,Active,1,,19.3133,-81.2546,Cayman Islands,,03-13-2020.csv,,,2020-03-11T20:00:00Z,51,101
"Cayman Islands, United Kingdom",03-29-2020,Recovered,0,,19.3133,-81.2546,United Kingdom,Cayman Islands,03-29-2020.csv,,,2020-03-29T23:08:13Z,67,3184
"Cayuga, NY, USA",03-22-2020,Active,0,,42.91261714,-76.55731592,USA,NY,03-22-2020.csv,Cayuga,36011,2020-03-22T23:45:00Z,60,2342
"Cecil, MD, USA",03-25-2020,Active,4,,39.56647682,-75.94627411,USA,MD,03-25-2020.csv,Cecil,24015,2020-03-25T23:33:19Z,63,436
"Cedar, IA, USA",03-28-2020,Deaths,0,,41.77233777,-91.13246684,USA,IA,03-28-2020.csv,Cedar,19031,2020-03-28T23:05:37Z,66,437
"Cedar, MO, USA",03-30-2020,Recovered,0,,37.72391475,-93.85445441,USA,MO,03-30-2020.csv,Cedar,29039,2020-03-30T22:52:45Z,68,438
"Cedar, NE, USA",03-26-2020,Recovered,0,,42.598885100000004,-97.25311951,USA,NE,03-26-2020.csv,Cedar,31027,2020-03-26T23:48:35Z,64,439
Central African Republic,03-22-2020,Active,3,,6.6111,20.9394,Central African Republic,,03-22-2020.csv,,,2020-03-22T23:45:00Z,60,3376
"Centre, PA, USA",03-28-2020,Deaths,0,,40.92058903,-77.82200624,USA,PA,03-28-2020.csv,Centre,42027,2020-03-28T23:05:37Z,66,440
"Cerro Gordo, IA, USA",03-26-2020,Deaths,0,,43.08177563,-93.2612239,USA,IA,03-26-2020.csv,Cerro Gordo,19033,2020-03-26T23:48:35Z,64,441
Chad,03-20-2020,Active,1,,15.4542,18.7322,Chad,,03-20-2020.csv,,,2020-03-19T16:43:03Z,58,266
"Chaffee, CO, USA",03-26-2020,Active,5,,38.74745778,-106.19265729999998,USA,CO,03-26-2020.csv,Chaffee,08015,2020-03-26T23:48:35Z,64,442
"Chambers, AL, USA",03-26-2020,Recovered,0,,32.91360079,-85.39072749,USA,AL,03-26-2020.csv,Chambers,01017,2020-03-26T23:48:35Z,64,443
"Chambers, TX, USA",03-22-2020,Active,1,,29.70972016,-94.67154501,USA,TX,03-22-2020.csv,Chambers,48071,2020-03-22T23:45:00Z,60,354
"Champaign, IL, USA",03-30-2020,Deaths,0,,40.13919438,-88.20046615,USA,IL,03-30-2020.csv,Champaign,17019,2020-03-30T22:52:45Z,68,445
"Champaign, OH, USA",03-26-2020,Confirmed,2,,40.13923427,-83.76875242,USA,OH,03-26-2020.csv,Champaign,39021,2020-03-26T23:48:35Z,64,446
Channel Islands,03-10-2020,Active,1,,49.3723,-2.3644,Channel Islands,,03-10-2020.csv,,,2020-03-10T05:33:02Z,48,172
"Channel Islands, United Kingdom",03-21-2020,Deaths,0,,49.3723,-2.3644,United Kingdom,Channel Islands,03-21-2020.csv,,,2020-03-21T21:13:29Z,59,183
"Chariton, MO, USA",03-25-2020,Deaths,0,,39.51499357,-92.9629191,USA,MO,03-25-2020.csv,Chariton,29041,2020-03-25T23:33:19Z,63,447
"Charles City, VA, USA",03-23-2020,Recovered,0,,37.35358063,-77.05634116,USA,VA,03-23-2020.csv,Charles City,51036,2020-03-23T23:19:34Z,61,449
"Charles Mix, SD, USA",03-23-2020,Deaths,0,,43.20660134,-98.58856175,USA,SD,03-23-2020.csv,Charles Mix,46023,2020-03-23T23:19:34Z,61,450
"Charles, MD, USA",03-28-2020,Active,21,,38.51092331,-76.98580666,USA,MD,03-28-2020.csv,Charles,24017,2020-03-28T23:05:37Z,66,448
"Charleston, SC, USA",03-27-2020,Active,91,,32.82487866,-79.96512315,USA,SC,03-27-2020.csv,Charleston,45019,2020-03-27T22:14:55Z,65,451
"Charlevoix, MI, USA",03-24-2020,Deaths,0,,45.37790017,-85.19614053,USA,MI,03-24-2020.csv,Charlevoix,26029,2020-03-24T23:37:31Z,62,452
"Charlotte, FL, USA",03-29-2020,Deaths,0,,26.90131002,-81.92949121,USA,FL,03-29-2020.csv,Charlotte,12015,2020-03-29T23:08:25Z,67,453
"Charlotte, VA, USA",03-25-2020,Confirmed,0,,37.01909701,-78.66314092,USA,VA,03-25-2020.csv,Charlotte,51037,2020-03-25T23:33:19Z,63,454
"Charlottesville, VA, USA",03-22-2020,Active,4,,38.03527919,-78.48569588,USA,VA,03-22-2020.csv,Charlottesville,51540,2020-03-22T23:45:00Z,60,682
"Charlton, GA, USA",03-26-2020,Confirmed,1,,30.78371028,-82.13951596,USA,GA,03-26-2020.csv,Charlton,13049,2020-03-26T23:48:35Z,64,456
"Chase, KS, USA",03-24-2020,Confirmed,0,,38.30292938,-96.59563862,USA,KS,03-24-2020.csv,Chase,20017,2020-03-24T23:37:31Z,62,457
"Chase, NE, USA",03-27-2020,Confirmed,0,,40.523719799999995,-101.69780259999999,USA,NE,03-27-2020.csv,Chase,31029,2020-03-27T22:14:55Z,65,458
"Chatham, GA, USA",03-26-2020,Confirmed,9,,32.00043026,-81.12489526,USA,GA,03-26-2020.csv,Chatham,13051,2020-03-26T23:48:35Z,64,459
"Chatham, NC, USA",03-23-2020,Deaths,0,,35.70394416,-79.25541492,USA,NC,03-23-2020.csv,Chatham,37037,2020-03-23T23:19:34Z,61,460
"Chattahoochee, GA, USA",03-28-2020,Confirmed,1,,32.34341231,-84.78809239,USA,GA,03-28-2020.csv,Chattahoochee,13053,2020-03-28T23:05:37Z,66,461
"Chattooga, GA, USA",03-29-2020,Recovered,0,,34.47197698,-85.34535662,USA,GA,03-29-2020.csv,Chattooga,13055,2020-03-29T23:08:25Z,67,462
"Chautauqua, KS, USA",03-25-2020,Recovered,0,,37.14994405,-96.2454192,USA,KS,03-25-2020.csv,Chautauqua,20019,2020-03-25T23:33:19Z,63,463
"Chautauqua, NY, USA",03-25-2020,Deaths,0,,42.22769210000001,-79.36691763,USA,NY,03-25-2020.csv,Chautauqua,36013,2020-03-25T23:33:19Z,63,464
"Chaves, NM, USA",03-22-2020,Active,0,,33.36406072,-104.4665365,USA,NM,03-22-2020.csv,Chaves,35005,2020-03-22T23:45:00Z,60,2316
"Cheatham, TN, USA",03-22-2020,Active,4,,36.26136216,-87.08903581,USA,TN,03-22-2020.csv,Cheatham,47021,2020-03-22T23:45:00Z,60,493
"Cheboygan, MI, USA",03-26-2020,Active,0,,45.44787015,-84.50122149,USA,MI,03-26-2020.csv,Cheboygan,26031,2020-03-26T23:48:35Z,64,467
"Chelan, WA, USA",03-28-2020,Deaths,1,,47.87046092,-120.6173956,USA,WA,03-28-2020.csv,Chelan,53007,2020-03-28T23:05:37Z,66,468
"Chemung, NY, USA",03-28-2020,Active,12,,42.13891056,-76.7638805,USA,NY,03-28-2020.csv,Chemung,36015,2020-03-28T23:05:37Z,66,469
"Chenango, NY, USA",03-25-2020,Deaths,0,,42.49430041,-75.60887553,USA,NY,03-25-2020.csv,Chenango,36017,2020-03-25T23:33:19Z,63,470
"Cherokee, AL, USA",03-23-2020,Recovered,0,,34.17805983,-85.60638968,USA,AL,03-23-2020.csv,Cherokee,01019,2020-03-23T23:19:34Z,61,471
"Cherokee, GA, USA",03-28-2020,Confirmed,52,,34.24393976,-84.47431861,USA,GA,03-28-2020.csv,Cherokee,13057,2020-03-28T23:05:37Z,66,472
"Cherokee, IA, USA",03-27-2020,Recovered,0,,42.73538914,-95.62389402,USA,IA,03-27-2020.csv,Cherokee,19035,2020-03-27T22:14:55Z,65,473
"Cherokee, KS, USA",03-25-2020,Recovered,0,,37.16928494,-94.8462897,USA,KS,03-25-2020.csv,Cherokee,20021,2020-03-25T23:33:19Z,63,474
"Cherokee, NC, USA",03-22-2020,Confirmed,4,,35.1349263,-84.05970864,USA,NC,03-22-2020.csv,Cherokee,37039,2020-03-22T23:45:00Z,60,619
"Cherokee, OK, USA",03-30-2020,Active,1,,35.90692775,-94.99980896,USA,OK,03-30-2020.csv,Cherokee,40021,2020-03-30T22:52:45Z,68,476
"Cherokee, SC, USA",03-25-2020,Active,0,,35.05122251,-81.61828622,USA,SC,03-25-2020.csv,Cherokee,45021,2020-03-25T23:33:19Z,63,477
"Cherokee, TX, USA",03-29-2020,Deaths,0,,31.837258000000002,-95.16559897,USA,TX,03-29-2020.csv,Cherokee,48073,2020-03-29T23:08:25Z,67,478
"Cherry, NE, USA",03-22-2020,Recovered,0,,42.54502621,-101.1244332,USA,NE,03-22-2020.csv,Cherry,31031,2020-03-22T23:45:00Z,60,2227
"Chesapeake, VA, USA",03-27-2020,Confirmed,5,,36.67670048,-76.30545744,USA,VA,03-27-2020.csv,Chesapeake,51550,2020-03-27T22:14:55Z,65,480
"Cheshire, NH, USA",03-27-2020,Recovered,0,,42.92015988,-72.25311043,USA,NH,03-27-2020.csv,Cheshire,33005,2020-03-27T22:14:55Z,65,481
"Chester, PA, USA",03-27-2020,Confirmed,107,,39.97291773,-75.74768357,USA,PA,03-27-2020.csv,Chester,42029,2020-03-27T22:14:55Z,65,482
"Chester, SC, USA",03-25-2020,Confirmed,1,,34.69249168,-81.1583216,USA,SC,03-25-2020.csv,Chester,45023,2020-03-25T23:33:19Z,63,483
"Chester, TN, USA",03-30-2020,Confirmed,2,,35.42527478,-88.6095842,USA,TN,03-30-2020.csv,Chester,47023,2020-03-30T22:52:45Z,68,484
"Chesterfield, SC, USA",03-22-2020,Recovered,0,,34.64137396,-80.1564014,USA,SC,03-22-2020.csv,Chesterfield,45025,2020-03-22T23:45:00Z,60,2624
"Chesterfield, VA, USA",03-26-2020,Deaths,0,,37.37373208,-77.58680140000001,USA,VA,03-26-2020.csv,Chesterfield,51041,2020-03-26T23:48:35Z,64,486
"Cheyenne, CO, USA",03-29-2020,Confirmed,0,,38.82777431,-102.6032558,USA,CO,03-29-2020.csv,Cheyenne,08017,2020-03-29T23:08:25Z,67,487
"Cheyenne, KS, USA",03-26-2020,Deaths,0,,39.78580976,-101.7318201,USA,KS,03-26-2020.csv,Cheyenne,20023,2020-03-26T23:48:35Z,64,488
"Cheyenne, NE, USA",03-26-2020,Active,0,,41.21999357,-102.9941693,USA,NE,03-26-2020.csv,Cheyenne,31033,2020-03-26T23:48:35Z,64,489
"Chickasaw, IA, USA",03-28-2020,Recovered,0,,43.06001295,-92.31773347,USA,IA,03-28-2020.csv,Chickasaw,19037,2020-03-28T23:05:37Z,66,490
"Chickasaw, MS, USA",03-24-2020,Active,6,,33.91983202,-88.9481545,USA,MS,03-24-2020.csv,Chickasaw,28017,2020-03-24T23:37:31Z,62,491
"Chicot, AR, USA",03-24-2020,Active,0,,33.26458973,-91.29539209,USA,AR,03-24-2020.csv,Chicot,05017,2020-03-24T23:37:31Z,62,492
"Childress, TX, USA",03-30-2020,Recovered,0,,34.529304100000004,-100.2077916,USA,TX,03-30-2020.csv,Childress,48075,2020-03-30T22:52:45Z,68,493
Chile,03-25-2020,Deaths,3,,-35.6751,-71.543,Chile,,03-25-2020.csv,,,2020-03-25T23:33:04Z,63,3281
"Chilton, AL, USA",03-24-2020,Confirmed,0,,32.85044126,-86.7173256,USA,AL,03-24-2020.csv,Chilton,01021,2020-03-24T23:37:31Z,62,494
"Chippewa, MI, USA",03-26-2020,Active,1,,46.29552653,-84.54353449,USA,MI,03-26-2020.csv,Chippewa,26033,2020-03-26T23:48:35Z,64,495
"Chippewa, MN, USA",03-23-2020,Recovered,0,,45.02343421,-95.56403693,USA,MN,03-23-2020.csv,Chippewa,27023,2020-03-23T23:19:34Z,61,496
"Chippewa, WI, USA",03-29-2020,Deaths,0,,45.06939744,-91.28068855,USA,WI,03-29-2020.csv,Chippewa,55017,2020-03-29T23:08:25Z,67,497
"Chisago, MN, USA",03-25-2020,Confirmed,2,,45.5021011,-92.90861945,USA,MN,03-25-2020.csv,Chisago,27025,2020-03-25T23:33:19Z,63,498
"Chittenden, VT, USA",03-23-2020,Confirmed,32,,44.46322849,-73.08359212,USA,VT,03-23-2020.csv,Chittenden,50007,2020-03-23T23:19:34Z,61,499
"Choctaw, AL, USA",03-24-2020,Recovered,0,,32.02227341,-88.26564429999998,USA,AL,03-24-2020.csv,Choctaw,01023,2020-03-24T23:37:31Z,62,500
"Choctaw, MS, USA",03-27-2020,Deaths,0,,33.34598242,-89.24809382,USA,MS,03-27-2020.csv,Choctaw,28019,2020-03-27T22:14:55Z,65,501
"Choctaw, OK, USA",03-28-2020,Active,1,,34.02807439,-95.54771129,USA,OK,03-28-2020.csv,Choctaw,40023,2020-03-28T23:05:37Z,66,502
"Chongqing, China",03-17-2020,Deaths,6,,30.0572,107.8740,China,Chongqing,03-17-2020.csv,,,2020-03-15T03:53:04Z,55,29
"Chouteau, MT, USA",03-22-2020,Recovered,0,,47.88084126,-110.4353362,USA,MT,03-22-2020.csv,Chouteau,30015,2020-03-22T23:45:00Z,60,2175
"Chowan, NC, USA",03-25-2020,Active,0,,36.12908077,-76.60118385,USA,NC,03-25-2020.csv,Chowan,37041,2020-03-25T23:33:19Z,63,504
"Christian, IL, USA",03-27-2020,Confirmed,1,,39.54581621,-89.27780482,USA,IL,03-27-2020.csv,Christian,17021,2020-03-27T22:14:55Z,65,505
"Christian, KY, USA",03-25-2020,Confirmed,2,,36.89267803,-87.49055367,USA,KY,03-25-2020.csv,Christian,21047,2020-03-25T23:33:19Z,63,506
"Christian, MO, USA",03-25-2020,Deaths,0,,36.9711783,-93.18537118,USA,MO,03-25-2020.csv,Christian,29043,2020-03-25T23:33:19Z,63,507
"Churchill, NV, USA",03-24-2020,Active,0,,39.58105744,-118.3394607,USA,NV,03-24-2020.csv,Churchill,32001,2020-03-24T23:37:31Z,62,508
"Cibola, NM, USA",03-28-2020,Deaths,0,,34.91131525,-107.998876,USA,NM,03-28-2020.csv,Cibola,35006,2020-03-28T23:05:37Z,66,509
"Cimarron, OK, USA",03-26-2020,Confirmed,0,,36.74817177,-102.5173885,USA,OK,03-26-2020.csv,Cimarron,40025,2020-03-26T23:48:35Z,64,510
"Citrus, FL, USA",03-25-2020,Deaths,0,,28.84804315,-82.47614748,USA,FL,03-25-2020.csv,Citrus,12017,2020-03-25T23:33:19Z,63,511
"Clackamas, OR, USA",03-25-2020,Recovered,0,,45.18787398,-122.2179634,USA,OR,03-25-2020.csv,Clackamas,41005,2020-03-25T23:33:19Z,63,512
"Claiborne, LA, USA",03-27-2020,Recovered,0,,32.82308512,-92.99526883,USA,LA,03-27-2020.csv,Claiborne,22027,2020-03-27T22:14:55Z,65,513
"Claiborne, MS, USA",03-24-2020,Active,0,,31.97061673,-90.90702196,USA,MS,03-24-2020.csv,Claiborne,28021,2020-03-24T23:37:31Z,62,514
"Claiborne, TN, USA",03-23-2020,Active,1,,36.48319149,-83.65947309,USA,TN,03-23-2020.csv,Claiborne,47025,2020-03-23T23:19:34Z,61,515
"Clallam, WA, USA",03-28-2020,Confirmed,5,,48.04754642,-123.92263190000001,USA,WA,03-28-2020.csv,Clallam,53009,2020-03-28T23:05:37Z,66,516
"Clare, MI, USA",03-27-2020,Active,1,,43.98794227,-84.84819859999998,USA,MI,03-27-2020.csv,Clare,26035,2020-03-27T22:14:55Z,65,517
"Clarendon, SC, USA",03-30-2020,Recovered,0,,33.66610974,-80.21647898,USA,SC,03-30-2020.csv,Clarendon,45027,2020-03-30T22:52:45Z,68,518
"Clarion, PA, USA",03-27-2020,Active,0,,41.19265812,-79.42413524,USA,PA,03-27-2020.csv,Clarion,42031,2020-03-27T22:14:55Z,65,519
"Clark, AR, USA",03-23-2020,Active,7,,34.04613432,-93.17484713,USA,AR,03-23-2020.csv,Clark,05019,2020-03-23T23:19:34Z,61,520
"Clark, ID, USA",03-26-2020,Confirmed,0,,44.28496071,-112.35057040000001,USA,ID,03-26-2020.csv,Clark,16033,2020-03-26T23:48:35Z,64,521
"Clark, IL, USA",03-28-2020,Active,0,,39.33425789,-87.78705622,USA,IL,03-28-2020.csv,Clark,17023,2020-03-28T23:05:37Z,66,522
"Clark, IN, USA",03-25-2020,Recovered,0,,38.48015445,-85.70510334,USA,IN,03-25-2020.csv,Clark,18019,2020-03-25T23:33:19Z,63,523
"Clark, KS, USA",03-23-2020,Active,0,,37.23577007,-99.81883015,USA,KS,03-23-2020.csv,Clark,20025,2020-03-23T23:19:34Z,61,524
"Clark, KY, USA",03-27-2020,Recovered,0,,37.9689263,-84.14615986,USA,KY,03-27-2020.csv,Clark,21049,2020-03-27T22:14:55Z,65,525
"Clark, MO, USA",03-22-2020,Recovered,0,,40.41040752,-91.73661677,USA,MO,03-22-2020.csv,Clark,29045,2020-03-22T23:45:00Z,60,2089
"Clark, NV, USA",03-07-2020,Confirmed,1,,36.0796,-115.0940,USA,NV,03-07-2020.csv,Clark,,2020-03-05T20:53:03Z,45,183
"Clark, OH, USA",03-30-2020,Active,6,,39.91592258,-83.78498252,USA,OH,03-30-2020.csv,Clark,39023,2020-03-30T22:52:45Z,68,528
"Clark, SD, USA",03-22-2020,Deaths,0,,44.85834507,-97.72925109,USA,SD,03-22-2020.csv,Clark,46025,2020-03-22T23:45:00Z,60,2639
"Clark, WA, USA",03-24-2020,Confirmed,13,,45.77568046,-122.48292040000001,USA,WA,03-24-2020.csv,Clark,53011,2020-03-24T23:37:31Z,62,530
"Clark, WI, USA",03-24-2020,Active,0,,44.73483377,-90.61207486,USA,WI,03-24-2020.csv,Clark,55019,2020-03-24T23:37:31Z,62,531
"Clarke, AL, USA",03-23-2020,Deaths,0,,31.68099859,-87.83548597,USA,AL,03-23-2020.csv,Clarke,01025,2020-03-23T23:19:34Z,61,532
"Clarke, GA, USA",03-25-2020,Recovered,0,,33.95436462,-83.37124007,USA,GA,03-25-2020.csv,Clarke,13059,2020-03-25T23:33:19Z,63,533
"Clarke, IA, USA",03-26-2020,Deaths,0,,41.02868181,-93.78499767,USA,IA,03-26-2020.csv,Clarke,19039,2020-03-26T23:48:35Z,64,534
"Clarke, MS, USA",03-28-2020,Deaths,0,,32.04158545,-88.68896219999998,USA,MS,03-28-2020.csv,Clarke,28023,2020-03-28T23:05:37Z,66,535
"Clarke, VA, USA",03-24-2020,Recovered,0,,39.11271747,-77.99199425,USA,VA,03-24-2020.csv,Clarke,51043,2020-03-24T23:37:31Z,62,536
"Clatsop, OR, USA",03-27-2020,Deaths,0,,45.99712889,-123.660711,USA,OR,03-27-2020.csv,Clatsop,41007,2020-03-27T22:14:55Z,65,537
"Clay, AL, USA",03-22-2020,Recovered,0,,33.26984193,-85.85836077,USA,AL,03-22-2020.csv,Clay,1027,2020-03-22T23:45:00Z,60,1170
"Clay, AR, USA",03-29-2020,Recovered,0,,36.36826212,-90.4148172,USA,AR,03-29-2020.csv,Clay,05021,2020-03-29T23:08:25Z,67,539
"Clay, FL, USA",03-22-2020,Deaths,1,,29.98319144,-81.85609986,USA,FL,03-22-2020.csv,Clay,12019,2020-03-22T23:45:00Z,60,221
"Clay, GA, USA",03-26-2020,Active,0,,31.62221166,-84.97713865,USA,GA,03-26-2020.csv,Clay,13061,2020-03-26T23:48:35Z,64,541
"Clay, IA, USA",03-29-2020,Active,0,,43.08247182,-95.15096481,USA,IA,03-29-2020.csv,Clay,19041,2020-03-29T23:08:25Z,67,544
"Clay, IL, USA",03-26-2020,Deaths,0,,38.75388572,-88.48914513,USA,IL,03-26-2020.csv,Clay,17025,2020-03-26T23:48:35Z,64,542
"Clay, IN, USA",03-25-2020,Active,0,,39.39561833,-87.11723506,USA,IN,03-25-2020.csv,Clay,18021,2020-03-25T23:33:19Z,63,543
"Clay, KS, USA",03-28-2020,Recovered,0,,39.34948772,-97.16518128,USA,KS,03-28-2020.csv,Clay,20027,2020-03-28T23:05:37Z,66,545
"Clay, KY, USA",03-27-2020,Deaths,0,,37.16451126,-83.712575,USA,KY,03-27-2020.csv,Clay,21051,2020-03-27T22:14:55Z,65,546
"Clay, MN, USA",03-30-2020,Recovered,0,,46.89289518,-96.48761922,USA,MN,03-30-2020.csv,Clay,27027,2020-03-30T22:52:45Z,68,547
"Clay, MO, USA",03-28-2020,Confirmed,10,,39.31132056,-94.41850862,USA,MO,03-28-2020.csv,Clay,29047,2020-03-28T23:05:37Z,66,549
"Clay, MS, USA",03-29-2020,Confirmed,2,,33.65358105,-88.77784255,USA,MS,03-29-2020.csv,Clay,28025,2020-03-29T23:08:25Z,67,548
"Clay, NC, USA",03-25-2020,Confirmed,0,,35.05704275,-83.74353633,USA,NC,03-25-2020.csv,Clay,37043,2020-03-25T23:33:19Z,63,551
"Clay, NE, USA",03-30-2020,Deaths,0,,40.52439441,-98.05126296,USA,NE,03-30-2020.csv,Clay,31035,2020-03-30T22:52:45Z,68,550
"Clay, SD, USA",03-28-2020,Deaths,0,,42.91296147,-96.97656917,USA,SD,03-28-2020.csv,Clay,46027,2020-03-28T23:05:37Z,66,552
"Clay, TN, USA",03-29-2020,Confirmed,0,,36.55151008,-85.53930419,USA,TN,03-29-2020.csv,Clay,47027,2020-03-29T23:08:25Z,67,553
"Clay, TX, USA",03-23-2020,Deaths,0,,33.78686685,-98.20771198,USA,TX,03-23-2020.csv,Clay,48077,2020-03-23T23:19:34Z,61,554
"Clay, WV, USA",03-27-2020,Active,0,,38.46231092,-81.07652217,USA,WV,03-27-2020.csv,Clay,54015,2020-03-27T22:14:55Z,65,555
"Clayton, GA, USA",03-27-2020,Recovered,0,,33.54187245,-84.35594188,USA,GA,03-27-2020.csv,Clayton,13063,2020-03-27T22:14:55Z,65,556
"Clayton, IA, USA",03-25-2020,Active,0,,42.84443388,-91.34133693,USA,IA,03-25-2020.csv,Clayton,19043,2020-03-25T23:33:19Z,63,557
"Clear Creek, CO, USA",03-26-2020,Deaths,0,,39.68864463,-105.6463118,USA,CO,03-26-2020.csv,Clear Creek,08019,2020-03-26T23:48:35Z,64,558
"Clearfield, PA, USA",03-29-2020,Deaths,0,,41.00110782,-78.47592663,USA,PA,03-29-2020.csv,Clearfield,42033,2020-03-29T23:08:25Z,67,559
"Clearwater, ID, USA",03-29-2020,Confirmed,0,,46.67459924,-115.6622393,USA,ID,03-29-2020.csv,Clearwater,16035,2020-03-29T23:08:25Z,67,560
"Clearwater, MN, USA",03-25-2020,Active,0,,47.57992111,-95.37790562,USA,MN,03-25-2020.csv,Clearwater,27029,2020-03-25T23:33:19Z,63,561
"Cleburne, AL, USA",03-27-2020,Confirmed,3,,33.67679204,-85.52005899,USA,AL,03-27-2020.csv,Cleburne,01029,2020-03-27T22:14:55Z,65,562
"Cleburne, AR, USA",03-30-2020,Recovered,0,,35.53864922,-92.02640019,USA,AR,03-30-2020.csv,Cleburne,05023,2020-03-30T22:52:45Z,68,563
"Clermont, OH, USA",03-22-2020,Deaths,0,,39.04847534,-84.15375786,USA,OH,03-22-2020.csv,Clermont,39025,2020-03-22T23:45:00Z,60,568
"Cleveland, AR, USA",03-23-2020,Active,3,,33.89723187,-92.18537045,USA,AR,03-23-2020.csv,Cleveland,05025,2020-03-23T23:19:34Z,61,565
"Cleveland, NC, USA",03-25-2020,Active,2,,35.33553364,-81.55204486,USA,NC,03-25-2020.csv,Cleveland,37045,2020-03-25T23:33:19Z,63,566
"Cleveland, OK, USA",03-27-2020,Deaths,3,,35.20413532,-97.32519562,USA,OK,03-27-2020.csv,Cleveland,40027,2020-03-27T22:14:55Z,65,567
"Clinch, GA, USA",03-30-2020,Confirmed,1,,30.91395822,-82.70432472,USA,GA,03-30-2020.csv,Clinch,13065,2020-03-30T22:52:45Z,68,568
"Clinton, IA, USA",03-23-2020,Deaths,0,,41.89981633,-90.53275096,USA,IA,03-23-2020.csv,Clinton,19045,2020-03-23T23:19:34Z,61,571
"Clinton, IL, USA",03-22-2020,Active,3,,38.60704876,-89.42385254,USA,IL,03-22-2020.csv,Clinton,17027,2020-03-22T23:45:00Z,60,148
"Clinton, IN, USA",03-22-2020,Recovered,0,,40.30319754,-86.47277257,USA,IN,03-22-2020.csv,Clinton,18023,2020-03-22T23:45:00Z,60,1575
"Clinton, KY, USA",03-29-2020,Deaths,0,,36.72581156,-85.13377529,USA,KY,03-29-2020.csv,Clinton,21053,2020-03-29T23:08:25Z,67,572
"Clinton, MI, USA",03-26-2020,Deaths,0,,42.94400871,-84.60145248,USA,MI,03-26-2020.csv,Clinton,26037,2020-03-26T23:48:35Z,64,573
"Clinton, MO, USA",03-25-2020,Active,1,,39.6013098,-94.40465394,USA,MO,03-25-2020.csv,Clinton,29049,2020-03-25T23:33:19Z,63,574
"Clinton, NY, USA",03-25-2020,Active,10,,44.74530905,-73.67875352,USA,NY,03-25-2020.csv,Clinton,36019,2020-03-25T23:33:19Z,63,575
"Clinton, OH, USA",03-23-2020,Deaths,0,,39.41485808,-83.80852286,USA,OH,03-23-2020.csv,Clinton,39027,2020-03-23T23:19:34Z,61,576
"Clinton, PA, USA",03-24-2020,Recovered,0,,41.23255967,-77.63785995,USA,PA,03-24-2020.csv,Clinton,42035,2020-03-24T23:37:31Z,62,577
"Cloud, KS, USA",03-25-2020,Deaths,0,,39.48028352,-97.64925343,USA,KS,03-25-2020.csv,Cloud,20029,2020-03-25T23:33:19Z,63,578
"CO, USA",03-10-2020,Active,15,,39.0598,-105.3111,USA,CO,03-10-2020.csv,,,2020-03-10T18:33:03Z,48,94
"Coahoma, MS, USA",03-23-2020,Deaths,0,,34.22772299,-90.60415045,USA,MS,03-23-2020.csv,Coahoma,28027,2020-03-23T23:19:34Z,61,579
"Coal, OK, USA",03-28-2020,Deaths,0,,34.58840127,-96.29798747,USA,OK,03-28-2020.csv,Coal,40029,2020-03-28T23:05:37Z,66,580
"Cobb, GA, USA",03-26-2020,Confirmed,115,,33.94243204,-84.5761255,USA,GA,03-26-2020.csv,Cobb,13067,2020-03-26T23:48:35Z,64,581
"Cochise, AZ, USA",03-26-2020,Confirmed,2,,31.87934684,-109.7516088,USA,AZ,03-26-2020.csv,Cochise,04003,2020-03-26T23:48:35Z,64,582
"Cochran, TX, USA",03-29-2020,Active,0,,33.60425307,-102.82844990000001,USA,TX,03-29-2020.csv,Cochran,48079,2020-03-29T23:08:25Z,67,583
"Cocke, TN, USA",03-23-2020,Active,1,,35.9278914,-83.11828725,USA,TN,03-23-2020.csv,Cocke,47029,2020-03-23T23:19:34Z,61,584
"Coconino, AZ, USA",03-26-2020,Confirmed,28,,35.83883429,-111.77071780000001,USA,AZ,03-26-2020.csv,Coconino,04005,2020-03-26T23:48:35Z,64,585
"Codington, SD, USA",03-22-2020,Recovered,0,,44.97788119,-97.18827677,USA,SD,03-22-2020.csv,Codington,46029,2020-03-22T23:45:00Z,60,2641
"Coffee, AL, USA",03-27-2020,Active,0,,31.39932826,-85.98901039,USA,AL,03-27-2020.csv,Coffee,01031,2020-03-27T22:14:55Z,65,587
"Coffee, GA, USA",03-25-2020,Active,2,,31.54892966,-82.85492059999999,USA,GA,03-25-2020.csv,Coffee,13069,2020-03-25T23:33:19Z,63,588
"Coffee, TN, USA",03-23-2020,Active,0,,35.49090731,-86.07311784,USA,TN,03-23-2020.csv,Coffee,47031,2020-03-23T23:19:34Z,61,589
"Coffey, KS, USA",03-23-2020,Recovered,0,,38.2365018,-95.73379515,USA,KS,03-23-2020.csv,Coffey,20031,2020-03-23T23:19:34Z,61,590
"Coke, TX, USA",03-22-2020,Recovered,0,,31.88911733,-100.5297533,USA,TX,03-22-2020.csv,Coke,48081,2020-03-22T23:45:00Z,60,2773
"Colbert, AL, USA",03-25-2020,Deaths,0,,34.69847452,-87.80168544,USA,AL,03-25-2020.csv,Colbert,01033,2020-03-25T23:33:19Z,63,592
"Cole, MO, USA",03-29-2020,Confirmed,17,,38.50455671,-92.27860244,USA,MO,03-29-2020.csv,Cole,29051,2020-03-29T23:08:25Z,67,593
"Coleman, TX, USA",03-28-2020,Deaths,0,,31.76736834,-99.45240766,USA,TX,03-28-2020.csv,Coleman,48083,2020-03-28T23:05:37Z,66,594
"Coles, IL, USA",03-30-2020,Deaths,0,,39.51949084,-88.22358557,USA,IL,03-30-2020.csv,Coles,17029,2020-03-30T22:52:45Z,68,595
"Colfax, NE, USA",03-25-2020,Active,0,,41.57486951,-97.0868542,USA,NE,03-25-2020.csv,Colfax,31037,2020-03-25T23:33:19Z,63,596
"Colfax, NM, USA",03-30-2020,Confirmed,0,,36.60569702,-104.64726740000002,USA,NM,03-30-2020.csv,Colfax,35007,2020-03-30T22:52:45Z,68,597
"Colleton, SC, USA",03-25-2020,Recovered,0,,32.87582989,-80.67641292,USA,SC,03-25-2020.csv,Colleton,45029,2020-03-25T23:33:19Z,63,598
"Collier, FL, USA",03-23-2020,Active,39,,26.11091986,-81.34687065,USA,FL,03-23-2020.csv,Collier,12021,2020-03-23T23:19:34Z,61,599
"Collin, TX, USA",03-09-2020,Recovered,0,,33.1795,-96.4930,USA,TX,03-09-2020.csv,Collin,,2020-03-09T18:53:13Z,47,211
"Collingsworth, TX, USA",03-25-2020,Active,0,,34.96489496,-100.27001109999999,USA,TX,03-25-2020.csv,Collingsworth,48087,2020-03-25T23:33:19Z,63,601
Colombia,03-07-2020,Confirmed,1,,4.5709,-74.2973,Colombia,,03-07-2020.csv,,,2020-03-07T00:43:02Z,45,162
"Colonial Heights, VA, USA",03-28-2020,Deaths,0,,37.26420587,-77.39609676,USA,VA,03-28-2020.csv,Colonial Heights,51570,2020-03-28T23:05:37Z,66,602
"Colorado, TX, USA",03-27-2020,Active,0,,29.622097999999998,-96.5273805,USA,TX,03-27-2020.csv,Colorado,48089,2020-03-27T22:14:55Z,65,603
"Colquitt, GA, USA",03-22-2020,Active,0,,31.18810588,-83.7677946,USA,GA,03-22-2020.csv,Colquitt,13071,2020-03-22T23:45:00Z,60,1380
"Columbia, AR, USA",03-27-2020,Confirmed,1,,33.21230701,-93.22642793,USA,AR,03-27-2020.csv,Columbia,05027,2020-03-27T22:14:55Z,65,605
"Columbia, FL, USA",03-25-2020,Recovered,0,,30.22509788,-82.62160164,USA,FL,03-25-2020.csv,Columbia,12023,2020-03-25T23:33:19Z,63,606
"Columbia, GA, USA",03-24-2020,Confirmed,4,,33.54534185,-82.263524,USA,GA,03-24-2020.csv,Columbia,13073,2020-03-24T23:37:31Z,62,607
"Columbia, NY, USA",03-30-2020,Recovered,0,,42.24819348,-73.63089095,USA,NY,03-30-2020.csv,Columbia,36021,2020-03-30T22:52:45Z,68,608
"Columbia, OR, USA",03-26-2020,Confirmed,0,,45.94464254,-123.08908980000001,USA,OR,03-26-2020.csv,Columbia,41009,2020-03-26T23:48:35Z,64,609
"Columbia, PA, USA",03-24-2020,Recovered,0,,41.04821986,-76.40565017,USA,PA,03-24-2020.csv,Columbia,42037,2020-03-24T23:37:31Z,62,610
"Columbia, WA, USA",03-27-2020,Confirmed,1,,46.29442881,-117.9051983,USA,WA,03-27-2020.csv,Columbia,53013,2020-03-27T22:14:55Z,65,611
"Columbia, WI, USA",03-29-2020,Confirmed,9,,43.46492199,-89.33589004,USA,WI,03-29-2020.csv,Columbia,55021,2020-03-29T23:08:25Z,67,612
"Columbiana, OH, USA",03-29-2020,Recovered,0,,40.76932373,-80.78094576,USA,OH,03-29-2020.csv,Columbiana,39029,2020-03-29T23:08:25Z,67,613
"Columbus, NC, USA",03-30-2020,Recovered,0,,34.26744084,-78.65801424,USA,NC,03-30-2020.csv,Columbus,37047,2020-03-30T22:52:45Z,68,614
"Colusa, CA, USA",03-30-2020,Active,1,,39.17881957,-122.2331726,USA,CA,03-30-2020.csv,Colusa,06011,2020-03-30T22:52:45Z,68,615
"Comal, TX, USA",03-28-2020,Deaths,1,,29.80811278,-98.27647225,USA,TX,03-28-2020.csv,Comal,48091,2020-03-28T23:05:37Z,66,616
"Comanche, KS, USA",03-28-2020,Deaths,0,,37.19114520000001,-99.27113247,USA,KS,03-28-2020.csv,Comanche,20033,2020-03-28T23:05:37Z,66,617
"Comanche, OK, USA",03-27-2020,Deaths,0,,34.65973764,-98.47195055,USA,OK,03-27-2020.csv,Comanche,40031,2020-03-27T22:14:55Z,65,618
"Comanche, TX, USA",03-23-2020,Active,0,,31.94854689,-98.55876441,USA,TX,03-23-2020.csv,Comanche,48093,2020-03-23T23:19:34Z,61,619
"Concho, TX, USA",03-30-2020,Active,0,,31.32635934,-99.86473038,USA,TX,03-30-2020.csv,Concho,48095,2020-03-30T22:52:45Z,68,620
"Concordia, LA, USA",03-29-2020,Confirmed,0,,31.44817835,-91.63814433,USA,LA,03-29-2020.csv,Concordia,22029,2020-03-29T23:08:25Z,67,621
"Conecuh, AL, USA",03-26-2020,Recovered,0,,31.43401703,-86.99320044,USA,AL,03-26-2020.csv,Conecuh,01035,2020-03-26T23:48:35Z,64,622
"Conejos, CO, USA",03-23-2020,Deaths,0,,37.201606,-106.19174879999998,USA,CO,03-23-2020.csv,Conejos,08021,2020-03-23T23:19:34Z,61,623
Congo (Brazzaville),03-26-2020,Active,4,,-4.2634,15.2832,Congo (Brazzaville),,03-26-2020.csv,,,2020-03-26T23:48:18Z,64,3282
Congo (Kinshasa),03-24-2020,Confirmed,45,,-4.322447,15.307045,Congo (Kinshasa),,03-24-2020.csv,,,2020-03-24T23:37:15Z,62,3285
"Contra Costa, CA, USA",03-06-2020,Active,3,,37.8534,-121.9018,USA,CA,03-06-2020.csv,Contra Costa,,2020-03-06T19:43:02Z,44,110
"Converse, WY, USA",03-29-2020,Deaths,0,,42.97272268,-105.5081848,USA,WY,03-29-2020.csv,Converse,56009,2020-03-29T23:08:25Z,67,625
"Conway, AR, USA",03-30-2020,Active,0,,35.26205537,-92.70506566,USA,AR,03-30-2020.csv,Conway,05029,2020-03-30T22:52:45Z,68,626
"Cook, GA, USA",03-27-2020,Confirmed,0,,31.16068491,-83.42947229,USA,GA,03-27-2020.csv,Cook,13075,2020-03-27T22:14:55Z,65,627
"Cook, IL, USA",02-15-2020,Deaths,0,,,,USA,IL,02-15-2020.csv,Cook,,2020-02-09T19:03:03Z,24,55
"Cook, MN, USA",03-29-2020,Active,0,,47.90504893,-90.52629546,USA,MN,03-29-2020.csv,Cook,27031,2020-03-29T23:08:25Z,67,629
"Cooke, TX, USA",03-25-2020,Confirmed,0,,33.63979567,-97.21240912,USA,TX,03-25-2020.csv,Cooke,48097,2020-03-25T23:33:19Z,63,630
"Cooper, MO, USA",03-24-2020,Deaths,0,,38.844478,-92.80896081,USA,MO,03-24-2020.csv,Cooper,29053,2020-03-24T23:37:31Z,62,631
"Coos, NH, USA",03-29-2020,Recovered,0,,44.69063265,-71.30633239,USA,NH,03-29-2020.csv,Coos,33007,2020-03-29T23:08:25Z,67,632
"Coos, OR, USA",03-24-2020,Recovered,0,,43.17406868,-124.0594514,USA,OR,03-24-2020.csv,Coos,41011,2020-03-24T23:37:31Z,62,633
"Coosa, AL, USA",03-23-2020,Active,0,,32.93690146,-86.24847739,USA,AL,03-23-2020.csv,Coosa,01037,2020-03-23T23:19:34Z,61,634
"Copiah, MS, USA",03-24-2020,Active,5,,31.86977774,-90.44565118,USA,MS,03-24-2020.csv,Copiah,28029,2020-03-24T23:37:31Z,62,635
"Corson, SD, USA",03-22-2020,Deaths,0,,45.70889983,-101.1970473,USA,SD,03-22-2020.csv,Corson,46031,2020-03-22T23:45:00Z,60,2642
"Cortland, NY, USA",03-27-2020,Recovered,0,,42.59509207,-76.07048931,USA,NY,03-27-2020.csv,Cortland,36023,2020-03-27T22:14:55Z,65,637
"Coryell, TX, USA",03-27-2020,Active,1,,31.39078397,-97.79936155,USA,TX,03-27-2020.csv,Coryell,48099,2020-03-27T22:14:55Z,65,638
"Coshocton, OH, USA",03-24-2020,Confirmed,3,,40.30096166,-81.91729018,USA,OH,03-24-2020.csv,Coshocton,39031,2020-03-24T23:37:31Z,62,639
Costa Rica,03-25-2020,Active,197,,9.7489,-83.7534,Costa Rica,,03-25-2020.csv,,,2020-03-25T23:33:04Z,63,3285
"Costilla, CO, USA",03-24-2020,Recovered,0,,37.27732493,-105.4276548,USA,CO,03-24-2020.csv,Costilla,08023,2020-03-24T23:37:31Z,62,640
Cote d'Ivoire,03-21-2020,Recovered,1,,7.5400,-5.5471,Cote d'Ivoire,,03-21-2020.csv,,,2020-03-21T12:43:08Z,59,215
"Cottle, TX, USA",03-28-2020,Deaths,0,,34.07783319,-100.27850620000001,USA,TX,03-28-2020.csv,Cottle,48101,2020-03-28T23:05:37Z,66,641
"Cotton, OK, USA",03-28-2020,Confirmed,0,,34.28845626,-98.37053567,USA,OK,03-28-2020.csv,Cotton,40033,2020-03-28T23:05:37Z,66,642
"Cottonwood, MN, USA",03-22-2020,Recovered,0,,44.00715262,-95.18138802,USA,MN,03-22-2020.csv,Cottonwood,27033,2020-03-22T23:45:00Z,60,1990
"Covington, AL, USA",03-22-2020,Recovered,0,,31.2477854,-86.45050893,USA,AL,03-22-2020.csv,Covington,1039,2020-03-22T23:45:00Z,60,1176
"Covington, MS, USA",03-24-2020,Recovered,0,,31.63225413,-89.55389939,USA,MS,03-24-2020.csv,Covington,28031,2020-03-24T23:37:31Z,62,645
"Covington, VA, USA",03-27-2020,Confirmed,0,,37.7824656,-79.98631446,USA,VA,03-27-2020.csv,Covington,51580,2020-03-27T22:14:55Z,65,646
"Coweta, GA, USA",03-24-2020,Confirmed,10,,33.35334302,-84.76129976,USA,GA,03-24-2020.csv,Coweta,13077,2020-03-24T23:37:31Z,62,647
"Cowley, KS, USA",03-29-2020,Recovered,0,,37.23781842,-96.83776647,USA,KS,03-29-2020.csv,Cowley,20035,2020-03-29T23:08:25Z,67,648
"Cowlitz, WA, USA",03-25-2020,Deaths,0,,46.19074721,-122.6782231,USA,WA,03-25-2020.csv,Cowlitz,53015,2020-03-25T23:33:19Z,63,649
"Craig, OK, USA",03-22-2020,Active,0,,36.76268118,-95.20916602,USA,OK,03-22-2020.csv,Craig,40035,2020-03-22T23:45:00Z,60,2520
"Craig, VA, USA",03-30-2020,Recovered,0,,37.48133648,-80.21072274,USA,VA,03-30-2020.csv,Craig,51045,2020-03-30T22:52:45Z,68,651
"Craighead, AR, USA",03-26-2020,Recovered,0,,35.83018283,-90.63235729,USA,AR,03-26-2020.csv,Craighead,05031,2020-03-26T23:48:35Z,64,652
"Crane, TX, USA",03-30-2020,Active,2,,31.43052248,-102.5143314,USA,TX,03-30-2020.csv,Crane,48103,2020-03-30T22:52:45Z,68,653
"Craven, NC, USA",03-22-2020,Active,2,,35.11833364,-77.08398081,USA,NC,03-22-2020.csv,Craven,37049,2020-03-22T23:45:00Z,60,628
"Crawford, AR, USA",03-27-2020,Confirmed,1,,35.58928601,-94.2446814,USA,AR,03-27-2020.csv,Crawford,05033,2020-03-27T22:14:55Z,65,655
"Crawford, GA, USA",03-25-2020,Confirmed,0,,32.71391813,-83.98061238,USA,GA,03-25-2020.csv,Crawford,13079,2020-03-25T23:33:19Z,63,656
"Crawford, IA, USA",03-28-2020,Confirmed,0,,42.03718237,-95.3819718,USA,IA,03-28-2020.csv,Crawford,19047,2020-03-28T23:05:37Z,66,659
"Crawford, IL, USA",03-27-2020,Confirmed,0,,39.0032229,-87.75954624,USA,IL,03-27-2020.csv,Crawford,17033,2020-03-27T22:14:55Z,65,657
"Crawford, IN, USA",03-23-2020,Recovered,0,,38.28814402,-86.44518825,USA,IN,03-23-2020.csv,Crawford,18025,2020-03-23T23:19:34Z,61,658
"Crawford, KS, USA",03-28-2020,Confirmed,3,,37.50675523,-94.85245778,USA,KS,03-28-2020.csv,Crawford,20037,2020-03-28T23:05:37Z,66,660
"Crawford, MI, USA",03-27-2020,Active,1,,44.68255561,-84.61006219,USA,MI,03-27-2020.csv,Crawford,26039,2020-03-27T22:14:55Z,65,661
"Crawford, MO, USA",03-23-2020,Deaths,0,,37.97663738,-91.30528104,USA,MO,03-23-2020.csv,Crawford,29055,2020-03-23T23:19:34Z,61,662
"Crawford, OH, USA",03-30-2020,Recovered,0,,40.85065156,-82.91989099,USA,OH,03-30-2020.csv,Crawford,39033,2020-03-30T22:52:45Z,68,663
"Crawford, PA, USA",03-28-2020,Active,2,,41.68447709,-80.10760592,USA,PA,03-28-2020.csv,Crawford,42039,2020-03-28T23:05:37Z,66,664
"Crawford, WI, USA",03-29-2020,Recovered,0,,43.23870316,-90.93073686,USA,WI,03-29-2020.csv,Crawford,55023,2020-03-29T23:08:25Z,67,665
"Creek, OK, USA",03-22-2020,Active,0,,35.90230551,-96.37086028,USA,OK,03-22-2020.csv,Creek,40037,2020-03-22T23:45:00Z,60,2521
"Crenshaw, AL, USA",03-23-2020,Active,0,,31.72941803,-86.31593104,USA,AL,03-23-2020.csv,Crenshaw,01041,2020-03-23T23:19:34Z,61,667
"Crisp, GA, USA",03-23-2020,Confirmed,0,,31.92289565,-83.76811843,USA,GA,03-23-2020.csv,Crisp,13081,2020-03-23T23:19:34Z,61,668
"Crittenden, AR, USA",03-24-2020,Deaths,0,,35.21247318,-90.30839406,USA,AR,03-24-2020.csv,Crittenden,05035,2020-03-24T23:37:31Z,62,669
"Crittenden, KY, USA",03-30-2020,Deaths,0,,37.35839237,-88.08826090000002,USA,KY,03-30-2020.csv,Crittenden,21055,2020-03-30T22:52:45Z,68,670
Croatia,03-03-2020,Active,9,,45.1667,15.5000,Croatia,,03-03-2020.csv,,,2020-03-03T09:53:08Z,41,69
"Crockett, TN, USA",03-25-2020,Deaths,0,,35.81830662,-89.14916269,USA,TN,03-25-2020.csv,Crockett,47033,2020-03-25T23:33:19Z,63,671
"Crockett, TX, USA",03-25-2020,Recovered,0,,30.72367027,-101.4134238,USA,TX,03-25-2020.csv,Crockett,48105,2020-03-25T23:33:19Z,63,672
"Crook, OR, USA",03-26-2020,Active,0,,44.14230227,-120.356297,USA,OR,03-26-2020.csv,Crook,41013,2020-03-26T23:48:35Z,64,673
"Crook, WY, USA",03-27-2020,Deaths,0,,44.58855102,-104.56977049999999,USA,WY,03-27-2020.csv,Crook,56011,2020-03-27T22:14:55Z,65,674
"Crosby, TX, USA",03-23-2020,Confirmed,0,,33.61431553,-101.30003640000001,USA,TX,03-23-2020.csv,Crosby,48107,2020-03-23T23:19:34Z,61,675
"Cross, AR, USA",03-28-2020,Active,1,,35.29631396,-90.77185818,USA,AR,03-28-2020.csv,Cross,05037,2020-03-28T23:05:37Z,66,676
"Crow Wing, MN, USA",03-29-2020,Deaths,0,,46.48096553,-94.06755609,USA,MN,03-29-2020.csv,Crow Wing,27035,2020-03-29T23:08:25Z,67,677
"Crowley, CO, USA",03-24-2020,Active,0,,38.32608609,-103.7844965,USA,CO,03-24-2020.csv,Crowley,08025,2020-03-24T23:37:31Z,62,678
"Cruise Ship, Others",02-08-2020,Deaths,0,,,,Others,Cruise Ship,02-08-2020.csv,,,2020-02-07T16:33:03Z,17,26
"CT, USA",03-17-2020,Confirmed,68,,41.5978,-72.7554,USA,CT,03-17-2020.csv,,,2020-03-17T23:13:10Z,55,105
Cuba,03-13-2020,Deaths,0,,21.5218,-77.7812,Cuba,,03-13-2020.csv,,,2020-03-11T20:00:00Z,51,88
"Culberson, TX, USA",03-25-2020,Active,0,,31.44506775,-104.5185739,USA,TX,03-25-2020.csv,Culberson,48109,2020-03-25T23:33:19Z,63,679
"Cullman, AL, USA",03-22-2020,Confirmed,2,,34.13020303,-86.86888037,USA,AL,03-22-2020.csv,Cullman,1043,2020-03-22T23:45:00Z,60,930
"Culpeper, VA, USA",03-28-2020,Confirmed,2,,38.48199985,-77.95630870000002,USA,VA,03-28-2020.csv,Culpeper,51047,2020-03-28T23:05:37Z,66,681
"Cumberland, IL, USA",03-22-2020,Deaths,0,,39.27432424,-88.2401158,USA,IL,03-22-2020.csv,Cumberland,17035,2020-03-22T23:45:00Z,60,155
"Cumberland, KY, USA",03-26-2020,Confirmed,0,,36.78926125,-85.39050034,USA,KY,03-26-2020.csv,Cumberland,21057,2020-03-26T23:48:35Z,64,683
"Cumberland, ME, USA",03-22-2020,Confirmed,53,,43.8370751,-70.37226999,USA,ME,03-22-2020.csv,Cumberland,23005,2020-03-22T23:45:00Z,60,1011
"Cumberland, NC, USA",03-30-2020,Confirmed,15,,35.04762133,-78.82623165,USA,NC,03-30-2020.csv,Cumberland,37051,2020-03-30T22:52:45Z,68,686
"Cumberland, NJ, USA",03-27-2020,Deaths,0,,39.37199394,-75.10712559,USA,NJ,03-27-2020.csv,Cumberland,34011,2020-03-27T22:14:55Z,65,685
"Cumberland, PA, USA",03-27-2020,Deaths,0,,40.1625372,-77.26130755,USA,PA,03-27-2020.csv,Cumberland,42041,2020-03-27T22:14:55Z,65,687
"Cumberland, TN, USA",03-27-2020,Active,6,,35.95271721,-84.99840585,USA,TN,03-27-2020.csv,Cumberland,47035,2020-03-27T22:14:55Z,65,688
"Cumberland, VA, USA",03-28-2020,Active,0,,37.51328851,-78.24398086,USA,VA,03-28-2020.csv,Cumberland,51049,2020-03-28T23:05:37Z,66,689
"Cuming, NE, USA",03-29-2020,Active,0,,41.91637624,-96.78730772,USA,NE,03-29-2020.csv,Cuming,31039,2020-03-29T23:08:25Z,67,690
Curacao,03-15-2020,Confirmed,1,,12.1696,-68.99,Curacao,,03-15-2020.csv,,,2020-03-14T16:15:18Z,53,228
"Curacao, Netherlands",03-20-2020,Deaths,1,,12.1696,-68.9900,Netherlands,Curacao,03-20-2020.csv,,,2020-03-19T08:53:03Z,58,247
"Currituck, NC, USA",03-30-2020,Active,1,,36.36123664,-75.95876401,USA,NC,03-30-2020.csv,Currituck,37053,2020-03-30T22:52:45Z,68,691
"Curry, NM, USA",03-29-2020,Recovered,0,,34.57421077,-103.34688759999999,USA,NM,03-29-2020.csv,Curry,35009,2020-03-29T23:08:25Z,67,692
"Curry, OR, USA",03-29-2020,Recovered,0,,42.45911325,-124.15728200000001,USA,OR,03-29-2020.csv,Curry,41015,2020-03-29T23:08:25Z,67,693
"Custer, CO, USA",03-25-2020,Active,0,,38.10883162,-105.3683478,USA,CO,03-25-2020.csv,Custer,08027,2020-03-25T23:33:19Z,63,694
"Custer, ID, USA",03-30-2020,Recovered,0,,44.24186819,-114.2855494,USA,ID,03-30-2020.csv,Custer,16037,2020-03-30T22:52:45Z,68,695
"Custer, MT, USA",03-23-2020,Recovered,0,,46.25319932,-105.57375259999998,USA,MT,03-23-2020.csv,Custer,30017,2020-03-23T23:19:34Z,61,696
"Custer, NE, USA",03-30-2020,Recovered,0,,41.39374521,-99.72805369,USA,NE,03-30-2020.csv,Custer,31041,2020-03-30T22:52:45Z,68,697
